Carl Icahn,@Carl_C_Icahn,Business Man,1534167900,461282269034864641,Good op-ed in Saturday’s New York Times by Joe Nocera on Warren Buffett: http://t.co/AgSMca7DTf,2014-04-29T23:13:57.000Z
Carl Icahn,@Carl_C_Icahn,Business Man,1534167900,462321425723166720,"I’ve written what I believe to be an informative piece titled “Why Buffett is Wrong on Coke,” which will appear tomorrow in Barron’s",2014-05-02T20:03:12.000Z
Carl Icahn,@Carl_C_Icahn,Business Man,1534167900,462631737424879616,Here’s  my piece in today’s Barron's @barronsonline re Warren Buffett abstaining on Coke  comp vote: http://t.co/hQ8lFyHg3v,2014-05-03T16:36:16.000Z
Carl Icahn,@Carl_C_Icahn,Business Man,1534167900,463048273268596736,My article from Barron's on Warren Buffett's abstention from a vote on Coke's executive-pay plan now on http://t.co/DOV4d2Aa5Q,2014-05-04T20:11:26.000Z
Carl Icahn,@Carl_C_Icahn,Business Man,1534167900,463339466305048576,I will be speaking with @ScottWapnerCNBC today at 12:30 p.m. ET. on @CNBCFastMoney Halftime Report.,2014-05-05T15:28:31.000Z
Carl Icahn,@Carl_C_Icahn,Business Man,1534167900,466970932796719104,Good piece in Monday’s NYT by Anthony @Scaramucci on the great potential for activists to change corporate America: http://t.co/kbtP0NkzzW,2014-05-15T15:58:40.000Z
Carl Icahn,@Carl_C_Icahn,Business Man,1534167900,475019951229509632,Disclosed a 9% position in FAMILY DOLLAR today. Hope to continue our streak of value enhancement. Read our 13D here: http://t.co/0FKHMSFyAZ,2014-06-06T21:02:36.000Z
Carl Icahn,@Carl_C_Icahn,Business Man,1534167900,479719384286384129,"Sent a letter to $FDO (FAMILY DOLLAR) today. Read it here: http://t.co/EBESnZAbsh  
Important SEC legend: http://t.co/AW7nvROPxN",2014-06-19T20:16:28.000Z
Carl Icahn,@Carl_C_Icahn,Business Man,1534167900,489427370000908288,Look forward to speaking at the #DeliveringAlpha conference today. I'll be interviewed by @ScottWapnerCNBC at 4:30 p.m.,2014-07-16T15:12:32.000Z
Carl Icahn,@Carl_C_Icahn,Business Man,1534167900,493807609896394752,Happy the way the week started for all $FDO (Family Dollar) shareholders.  Read our press release at http://t.co/F0jL2v8V5J,2014-07-28T17:18:03.000Z
Carl Icahn,@Carl_C_Icahn,Business Man,1534167900,496709486732902400,Very pleased with IEP’s performance for Q2.  You can find our Q2 2014 financial results &amp; earnings webcast here: http://t.co/8EXfzSYdpC,2014-08-05T17:29:04.000Z
Carl Icahn,@Carl_C_Icahn,Business Man,1534167900,498907350267609088,Thanks @nathanvardi for a nice piece in @Forbes re $IEP’s activism: http://t.co/IwcURVWJLE,2014-08-11T19:02:36.000Z
Carl Icahn,@Carl_C_Icahn,Business Man,1534167900,499202842981576704,"Excited to be a member of @YahooFinance Contributors.  Here’s my first post, “The Bottom Line”: http://t.co/tE4q1IaH0c $IEP",2014-08-12T14:36:47.000Z
Carl Icahn,@Carl_C_Icahn,Business Man,1534167900,500029498080129024,We just filed a 13D on Gannett Company ($GCI).  Read more here:http://t.co/yfOWKVY58w,2014-08-14T21:21:37.000Z
Carl Icahn,@Carl_C_Icahn,Business Man,1534167900,501451810369175554,"In response to media inquiries, see our statement concerning Dollar General’s ($DG) bid for Family Dollar ($FDO): http://t.co/DOV4d2Aa5Q",2014-08-18T19:33:22.000Z
Carl Icahn,@Carl_C_Icahn,Business Man,1534167900,501793872159449089,$AAPL crossed $100 today (equivalent of pre split $700).,2014-08-19T18:12:36.000Z
Carl Icahn,@Carl_C_Icahn,Business Man,1534167900,501794076942172160,About 1 yr ago we tweeted to our followers about our investment in $AAPL and that stock was “extremely undervalued” https://t.co/JUrfmWEHLx,2014-08-19T18:13:25.000Z
Carl Icahn,@Carl_C_Icahn,Business Man,1534167900,501794143413493760,Believed $AAPL to be one of my “no-brainers”. Anyone that invested at that time would be up 53% (including dividends),2014-08-19T18:13:41.000Z
Carl Icahn,@Carl_C_Icahn,Business Man,1534167900,501794271922765824,All my chips still on the table and in fact increased position over past year.,2014-08-19T18:14:11.000Z
Carl Icahn,@Carl_C_Icahn,Business Man,1534167900,501794327505686528,More observations about markets and stocks to come. See http://t.co/DOV4d2Aa5Q,2014-08-19T18:14:25.000Z
Carl Icahn,@Carl_C_Icahn,Business Man,1534167900,502178561479159809,We just filed a 13D on The Hertz Corporation ($HTZ).,2014-08-20T19:41:13.000Z
Carl Icahn,@Carl_C_Icahn,Business Man,1534167900,502181631562891264,Read our 13D on $HTZ here: http://t.co/Asadtb7xqj,2014-08-20T19:53:25.000Z
Carl Icahn,@Carl_C_Icahn,Business Man,1534167900,502879384743976960,"As I’ve said b4, w/ exceptions, many companies in America are terribly run. This sad situation leads to many financial woes we face today.",2014-08-22T18:06:03.000Z
Carl Icahn,@Carl_C_Icahn,Business Man,1534167900,502879689892171777,I believe sound #shareholderactivism (note $IEP) can help alleviate some of these current economic struggles http://t.co/mElFXbWYEw,2014-08-22T18:07:15.000Z
Carl Icahn,@Carl_C_Icahn,Business Man,1534167900,502936516487045122,Here’s an interesting piece from @CNNMoney that points to several others concerned with a stock market bubble: http://t.co/xTTiSmPc0u,2014-08-22T21:53:04.000Z
Carl Icahn,@Carl_C_Icahn,Business Man,1534167900,504643451124985856,"To Rich Handler, will get back to you shortly on #ALSChallenge, but right now too busy working on BIG deal with another investment banker",2014-08-27T14:55:49.000Z
Carl Icahn,@Carl_C_Icahn,Business Man,1534167900,510198935491985410,Happy to have 3 nominees joining $HTZ Board soon http://t.co/tB37eyhCQM,2014-09-11T22:51:19.000Z
Carl Icahn,@Carl_C_Icahn,Business Man,1534167900,516699819713507328,I just released a statement on Taj AC. I find Union reaction incomprehensible.  See Shareholders' Square Table:  http://t.co/gfMdMYlr3F,2014-09-29T21:23:31.000Z
Carl Icahn,@Carl_C_Icahn,Business Man,1534167900,516971802128818177,Happy about spin off of PayPal. Read more on my thoughts concerning future of $EBAY at Shareholders’ Square Table: http://t.co/n3ypp4T3yQ,2014-09-30T15:24:17.000Z
Carl Icahn,@Carl_C_Icahn,Business Man,1534167900,519918488040005632,"Just over 1yr ago we tweeted our large position in $AAPL &amp; belief the company extremely undervalued.  Since then, stock is up 50.6%",2014-10-08T18:33:21.000Z
Carl Icahn,@Carl_C_Icahn,Business Man,1534167900,519918577718423552,Tmrw we’ll be sending an open letter to @tim_cook.  Believe it will be interesting.,2014-10-08T18:33:43.000Z
Carl Icahn,@Carl_C_Icahn,Business Man,1534167900,520190869849534464,"Here’s our letter to @tim_cook re $AAPL:  ""Sale: Apple Shares at Half Price"" http://t.co/1DOSdoRPOW",2014-10-09T12:35:42.000Z
Carl Icahn,@Carl_C_Icahn,Business Man,1534167900,520194248327852034,"Our letter to @tim_cook re $AAPL on @YahooFinance Contributors ""Sale: Apple Shares at Half Price"" http://t.co/z4F2XMtHv8",2014-10-09T12:49:08.000Z
Carl Icahn,@Carl_C_Icahn,Business Man,1534167900,520233482766012416,"I, Brett &amp; Dave (the Sargon duo) will be speaking w/ @ScottWapnerCNBC at noon on @CNBCFastMoney Halftime Report re $AAPL, &amp; activism",2014-10-09T15:25:02.000Z
Carl Icahn,@Carl_C_Icahn,Business Man,1534167900,520265224180727809,"We’ll be talking to @trish_regan of @BloombergTV at 2pm about $AAPL, activism and more.",2014-10-09T17:31:10.000Z
Carl Icahn,@Carl_C_Icahn,Business Man,1534167900,520266556115542016,"At 3pm we’ll be on @FoxBusiness  with @LizClaman &amp; @CGasparino, and we promise that is it for today.",2014-10-09T17:36:27.000Z
Carl Icahn,@Carl_C_Icahn,Business Man,1534167900,520624097425113088,Just posted message to Mayor Guardian of Atlantic City.  Happy he recognizes our turnaround of the Tropicana in AC http://t.co/TvWthLrrYl,2014-10-10T17:17:12.000Z
Carl Icahn,@Carl_C_Icahn,Business Man,1534167900,520660031550017536,A Message to Concerned Citizens of Atlantic City: http://t.co/K2pkGqCchV,2014-10-10T19:39:59.000Z
Carl Icahn,@Carl_C_Icahn,Business Man,1534167900,524609196625784833,Today I’ll be speaking about #shareholderactivism at the @robinhoodnyc #RHInvestors conference to help a great cause.,2014-10-21T17:12:33.000Z
Carl Icahn,@Carl_C_Icahn,Business Man,1534167900,524619155375673344,I will be speaking with @ScottWapnerCNBC on @CNBC at 5pm ET.  #RHInvestors,2014-10-21T17:52:08.000Z
Carl Icahn,@Carl_C_Icahn,Business Man,1534167900,524619783065858048,At 5:30pm ET I will be talking to @SRuhle on @BloombergTV. #RHInvestors,2014-10-21T17:54:37.000Z
Carl Icahn,@Carl_C_Icahn,Business Man,1534167900,525319058158551040,Enjoyed participating in the #shareholderactivism panel at the @robinhoodnyc #RHInvestors conference on Tuesday – a great cause.,2014-10-23T16:13:18.000Z
Carl Icahn,@Carl_C_Icahn,Business Man,1534167900,525319368214081536,Nice time speaking with @scottwapnercnbc @cnbc #RHInvestors http://t.co/XBsNsyA4bz,2014-10-23T16:14:32.000Z
Carl Icahn,@Carl_C_Icahn,Business Man,1534167900,525320443612647425,Had a good conversation with @SRuhle @BloombergTV #RHInvestors http://t.co/qelE87GhAn,2014-10-23T16:18:48.000Z
Carl Icahn,@Carl_C_Icahn,Business Man,1534167900,525603616611401728,Just issued letter to Taj Local 54 Employees: http://t.co/nr7kWJcHGy,2014-10-24T11:04:02.000Z
Carl Icahn,@Carl_C_Icahn,Business Man,1534167900,525640738902908929,Understand Taj employees are asking @GovChristie &amp; Senator Sweeney to help save their jobs. #savetheTajnow,2014-10-24T13:31:32.000Z
Carl Icahn,@Carl_C_Icahn,Business Man,1534167900,525640851897483265,Glad Taj employees stopped listening to Union leaders who don’t care about their jobs. #savetheTajnow http://t.co/nr7kWJcHGy,2014-10-24T13:31:59.000Z
Carl Icahn,@Carl_C_Icahn,Business Man,1534167900,526776646544949248,"Good editorial in the Press of Atlantic City.  Sums up situation well.   http://t.co/6WTXVN1pzU 
#acpress #savetheTajnow",2014-10-27T16:45:14.000Z
Carl Icahn,@Carl_C_Icahn,Business Man,1534167900,531918982899843072,Excellent letter just issued by Trump Taj Mahal to its employees. Sums it all up: http://t.co/kItCUniwof,2014-11-10T21:19:02.000Z
Carl Icahn,@Carl_C_Icahn,Business Man,1534167900,535143675161247744,Take a look at this letter sent by the Taj to its employees. @UHLocal54 continues to misrepresent the facts:  http://t.co/AjqjXReRPE,2014-11-19T18:52:49.000Z
Carl Icahn,@Carl_C_Icahn,Business Man,1534167900,535544824909537280,Believe $HTZ has hired an excellent CEO – read company’s press release: http://t.co/Q73Nz1vYdm,2014-11-20T21:26:50.000Z
Carl Icahn,@Carl_C_Icahn,Business Man,1534167900,536919043073388544,.@TheEconomist asked me to write 850 words on what investors should do to profit in 2015. Here’s what I said: http://t.co/5fUchEwADF,2014-11-24T16:27:29.000Z
Carl Icahn,@Carl_C_Icahn,Business Man,1534167900,537297803597606913,Never met/spoke to magician Becker @nypost states I've been talking to re running the Taj. Hope &amp; believe Taj can be saved w/out a magician,2014-11-25T17:32:33.000Z
Carl Icahn,@Carl_C_Icahn,Business Man,1534167900,537358698889633793,Wrote an open letter to @UHLocal54 president Bob McDevitt re Taj.  Read at Shareholders’ Square Table: http://t.co/i2QHNENS8W,2014-11-25T21:34:32.000Z
Carl Icahn,@Carl_C_Icahn,Business Man,1534167900,544588634301943808,My Q &amp; A with Bloomberg’s @BSteverman @business: http://t.co/VMoUgDgZzl,2014-12-15T20:23:43.000Z
Carl Icahn,@Carl_C_Icahn,Business Man,1534167900,545658803426181120,"I’ve written a response letter to CEO of Trump Entertainment Resorts, Bob Griffin, re the Taj. You can read it at http://t.co/FUZ9wX1nXJ",2014-12-18T19:16:11.000Z
Carl Icahn,@Carl_C_Icahn,Business Man,1534167900,552169402494619648,Good read from Dec 27 @barronsonline by @HarvardWinters re $AAPL. Supports our buyback thesis: http://t.co/UecY2rUr1Y,2015-01-05T18:26:59.000Z
Carl Icahn,@Carl_C_Icahn,Business Man,1534167900,553242856056696832,I’ll be on @CNBCFastMoney today at 5:30pm ET for their 8th anniversary show,2015-01-08T17:32:30.000Z
Carl Icahn,@Carl_C_Icahn,Business Man,1534167900,558014219787198464,See our comments re $EBAY agreement on http://t.co/vGoykWZEQk. It’s a good day for corporate governance #corpgov,2015-01-21T21:32:12.000Z
Carl Icahn,@Carl_C_Icahn,Business Man,1534167900,558256547353362433,Read my letter (including other important information) to the CEO of $GCI at http://t.co/MUCKm5rujY,2015-01-22T13:35:07.000Z
Carl Icahn,@Carl_C_Icahn,Business Man,1534167900,558281849580298241,"I’ll be speaking with @ScottWapnerCNBC on @CNBCFastMoney at 12:30ET.  We’ll be discussing recent events at $EBAY, $GCI and more.",2015-01-22T15:15:39.000Z
Carl Icahn,@Carl_C_Icahn,Business Man,1534167900,560481247919898625,Will be talking to @ScottWapnerCNBC on @CNBC at 12:30 with Brett Icahn &amp; David Schechter to discuss our thoughts on $AAPL,2015-01-28T16:55:17.000Z
Carl Icahn,@Carl_C_Icahn,Business Man,1534167900,560507207973097473,I’ll be speaking with @PoppyHarlowCNN on @questCNN at 4:15pm ET.,2015-01-28T18:38:26.000Z
Carl Icahn,@Carl_C_Icahn,Business Man,1534167900,561233305761480704,I’ve written a response to the letter I received yesterday from employees of the Trump Taj Mahal.  Read it at http://t.co/ZIM2nB8Epc,2015-01-30T18:43:41.000Z
Carl Icahn,@Carl_C_Icahn,Business Man,1534167900,564789059453980672,See my comments re $MTW agreement on http://t.co/rM9sehkzvg …Another great day for corporate governance #corpgov,2015-02-09T14:12:59.000Z
Carl Icahn,@Carl_C_Icahn,Business Man,1534167900,564903043284492289,"Pleased to announce $IEP to acquire substantially all assets of Uni-Select USA, a leading auto parts distributor:
http://t.co/b4hoOAGRcP",2015-02-09T21:45:55.000Z
Carl Icahn,@Carl_C_Icahn,Business Man,1534167900,565598397890326528,Read our latest thoughts on $AAPL: http://t.co/1eW2BGMOxQ,2015-02-11T19:49:01.000Z
Carl Icahn,@Carl_C_Icahn,Business Man,1534167900,565967276252622848,I greatly respect $AAPL’s Board but my comments on @CNBC not only underscore my opinion on buyback …,2015-02-12T20:14:48.000Z
Carl Icahn,@Carl_C_Icahn,Business Man,1534167900,565967308582297601,but also about belief that shareholders have the right to voice opinions - that is what democracy is all about http://t.co/ETILUjs1pc,2015-02-12T20:14:56.000Z
Carl Icahn,@Carl_C_Icahn,Business Man,1534167900,568472292768014336,Good piece by @maureenmfarrell in @WSJMoneyBeat re $AAPL http://t.co/9WpZYsc5AR. Many analysts still missing it. AAPL currently only 11x P/E,2015-02-19T18:08:50.000Z
Carl Icahn,@Carl_C_Icahn,Business Man,1534167900,572372186754908160,See my thoughts on our agreement with $GCI on http://t.co/ndG9m96YVP…Another step forward for corporate governance,2015-03-02T12:25:38.000Z
Carl Icahn,@Carl_C_Icahn,Business Man,1534167900,577453355477393410,"For those interested in #corpgov issues, the Peltz intw w/ @davidfaber &amp; @jimcramer is a must watch.Great points made http://t.co/kFKOKBglyL",2015-03-16T12:56:23.000Z
Carl Icahn,@Carl_C_Icahn,Business Man,1534167900,578533042387427328,Just wrote a letter to the unionized employees of the Trump Taj Mahal. Read it at http://t.co/dr8YSH7KKl,2015-03-19T12:26:40.000Z
Carl Icahn,@Carl_C_Icahn,Business Man,1534167900,593073924822343680,$AAPL is still undervalued and misunderstood. Expect to put out another in-depth report within two weeks.,2015-04-28T15:26:57.000Z
Carl Icahn,@Carl_C_Icahn,Business Man,1534167900,594261430569861120,I’ll be on @WallStreetWeek Sunday discussing #Apple $AAPL + more with @Scaramucci &amp; @GaryKaminsky. Tune in 11AM ET at http://t.co/MQ1LyfL0fo,2015-05-01T22:05:40.000Z
Carl Icahn,@Carl_C_Icahn,Business Man,1534167900,600315019041996800,Think you will find our latest letter to @tim_cook re $AAPL interesting: http://t.co/w6e9XvWptb,2015-05-18T15:00:28.000Z
Carl Icahn,@Carl_C_Icahn,Business Man,1534167900,601750341655220225,Good article in @Reuters by @SamuelForgione re $AAPL: http://t.co/Fwq4mYoQMj,2015-05-22T14:03:56.000Z
Carl Icahn,@Carl_C_Icahn,Business Man,1534167900,604303187621724160,You can watch the 2nd part of my @WallStreetWeek intrview w/ @Scaramucci @GaryKaminsky this Sunday - 11AM ET on FOX &amp; http://t.co/BQAZ9tFGvD,2015-05-29T15:08:01.000Z
Carl Icahn,@Carl_C_Icahn,Business Man,1534167900,605380762393669632,Pleased to announce $IEP closed acquisition of substantially all assets of Uni-Select USA &amp; Beck/Arnley Worldparts: http://t.co/DIdb6TV1kK,2015-06-01T14:29:55.000Z
Carl Icahn,@Carl_C_Icahn,Business Man,1534167900,605413787747770368,I’ll be speaking with @TrishIntel  on ‘Trish Regan Intel’ today around 2:30pm ET on @FoxBusiness.,2015-06-01T16:41:09.000Z
Carl Icahn,@Carl_C_Icahn,Business Man,1534167900,608347419819057154,Read my response to @UHLocal54 re important facts about their union: http://t.co/BgAPA73AQA,2015-06-09T18:58:22.000Z
Carl Icahn,@Carl_C_Icahn,Business Man,1534167900,611921396747272192,A few remarks re @realDonaldTrump running for President &amp; wanting to nominate me for the Secretary of Treasury. http://t.co/7VRkNvV2RT,2015-06-19T15:40:04.000Z
Carl Icahn,@Carl_C_Icahn,Business Man,1534167900,611983515748470785,You can see my intvw w/ @trish_regan &amp; @TeamCavuto on @FoxBusiness re interest rates &amp; more: http://t.co/JXvRPFl0oB ; http://t.co/GsuxQC7T0b,2015-06-19T19:46:54.000Z
Carl Icahn,@Carl_C_Icahn,Business Man,1534167900,613718497219076096,Sold last of our $NFLX today.  Believe $AAPL currently represents same opportunity we stated NFLX offered several years ago.,2015-06-24T14:41:06.000Z
Carl Icahn,@Carl_C_Icahn,Business Man,1534167900,613727064164663296,1/2   I believe the market is extremely overheated – especially high yield bonds.,2015-06-24T15:15:09.000Z
Carl Icahn,@Carl_C_Icahn,Business Man,1534167900,613727158909833217,"2/2   If more respected investors had warned about the market in ’07, we might have avoided the crisis in ’08.",2015-06-24T15:15:31.000Z
Carl Icahn,@Carl_C_Icahn,Business Man,1534167900,621337939558182912,I’ll be debating w/ Larry Fink at @DeliveringAlpha today at 4:40pm ET.  @ScottWapnerCNBC to moderate.  Will be live on @CNBC.,2015-07-15T15:18:03.000Z
Carl Icahn,@Carl_C_Icahn,Business Man,1534167900,623187610429693952,This recent @WSJ piece shows other investors are concerned about a bond ETF crisis too. More to come on this soon: http://t.co/d2B23QuIDz,2015-07-20T17:47:59.000Z
Carl Icahn,@Carl_C_Icahn,Business Man,1534167900,628658180990599168,1/ 2  Trimmed our position but remain a huge supporter of Steve MacMillan and the @Hologic ($HOLX) team.,2015-08-04T20:06:04.000Z
Carl Icahn,@Carl_C_Icahn,Business Man,1534167900,628658283918852096,"2/2  Happy we were instrumental in bringing Steve in, and think he’s done a great job.",2015-08-04T20:06:29.000Z
Carl Icahn,@Carl_C_Icahn,Business Man,1534167900,629731049686364160,1/3 After last night’s debate I decided to accept @realDonaldTrump offer for Secretary of Treasury.,2015-08-07T19:09:16.000Z
Carl Icahn,@Carl_C_Icahn,Business Man,1534167900,629731085883154432,"2/3 Seriously, the methods of electing our corporate and political leaders have become completely dysfunctional.",2015-08-07T19:09:25.000Z
Carl Icahn,@Carl_C_Icahn,Business Man,1534167900,629731132020555777,"3/3  In both areas, we are in dire need of a breath of fresh air.",2015-08-07T19:09:36.000Z
Carl Icahn,@Carl_C_Icahn,Business Man,1534167900,633767724351549440,Clip from Alan Greenspan’s interview with @trish_regan is worth watching.  http://t.co/warLpL51B4,2015-08-18T22:29:34.000Z
Carl Icahn,@Carl_C_Icahn,Business Man,1534167900,635802140427087872,Happy to announce we reached an agreement to join Cheniere $LNG board: http://t.co/RXbioJjEnf,2015-08-24T13:13:37.000Z
Carl Icahn,@Carl_C_Icahn,Business Man,1534167900,638372524171071488,Excellent @barronsonline article that reiterates the dangers of #ETF s I debated during @DeliveringAlpha on @CNBC: http://t.co/05XDhV3h3b,2015-08-31T15:27:24.000Z
Carl Icahn,@Carl_C_Icahn,Business Man,1534167900,648436208222248961,I’m releasing a new video at midnight called “Danger Ahead.” It covers several critical matters I believe we need to be far more aware of.,2015-09-28T09:56:54.000Z
Carl Icahn,@Carl_C_Icahn,Business Man,1534167900,648436400883412992,Danger Ahead will be available tonight at midnight on http://t.co/4rVAcLBsH9.  You can watch the trailer there now.,2015-09-28T09:57:39.000Z
Carl Icahn,@Carl_C_Icahn,Business Man,1534167900,648709060678823937,'Danger Ahead' is now available on http://t.co/4rVAcLBsH9,2015-09-29T04:01:07.000Z
Carl Icahn,@Carl_C_Icahn,Business Man,1534167900,648860840523902977,"You can watch my new video, ‘Danger Ahead,’ on http://t.co/4rVAcLBsH9",2015-09-29T14:04:14.000Z
Carl Icahn,@Carl_C_Icahn,Business Man,1534167900,649252737415258112,I’ll be speaking with @ScottWapnerCNBC on @HalftimeReport today at 12:15pm ET re markets and ‘Danger Ahead’,2015-09-30T16:01:29.000Z
Carl Icahn,@Carl_C_Icahn,Business Man,1534167900,649642907075526656,"Good article by @nathanvardi @Forbes about #DangerAhead
https://t.co/qPxc803WrU",2015-10-01T17:51:53.000Z
Carl Icahn,@Carl_C_Icahn,Business Man,1534167900,649650382734557184,"Here’s the full interview I had with @ScottWapnerCNBC yesterday on @CNBC:
https://t.co/1ayVQK86OL",2015-10-01T18:21:35.000Z
Carl Icahn,@Carl_C_Icahn,Business Man,1534167900,649997467023450112,"If you want to know what’s wrong with earnings these days, @jciesielski ’s recent reports are a must-read: http://t.co/b4zTjxbc8y",2015-10-02T17:20:47.000Z
Carl Icahn,@Carl_C_Icahn,Business Man,1534167900,651067549703118848,I’ll be speaking with @trish_regan on @FOXBUSINESS today at 2:15pm ET,2015-10-05T16:12:54.000Z
Carl Icahn,@Carl_C_Icahn,Business Man,1534167900,651753340112646145,Happy to announce we reached an agreement to join Freeport-McMoRan $FCX board: http://t.co/ogZ2qed6kN,2015-10-07T13:37:59.000Z
Carl Icahn,@Carl_C_Icahn,Business Man,1534167900,656847494584799233,1/2   I am starting a Super PAC with my initial commitment of $150 million to help end the crippling dysfunction in Congress,2015-10-21T15:00:21.000Z
Carl Icahn,@Carl_C_Icahn,Business Man,1534167900,656847655667011588,2/2   I have therefore sent the following letter to the relevant committees and leaders of Congress: https://t.co/EGcuHvzou4,2015-10-21T15:00:59.000Z
Carl Icahn,@Carl_C_Icahn,Business Man,1534167900,656853508650459136,I’ll be speaking with @ScottWapnerCNBC on @CNBC @HalftimeReport today at 12:30pm ET,2015-10-21T15:24:14.000Z
Carl Icahn,@Carl_C_Icahn,Business Man,1534167900,656912346414252032,I’ll be speaking with @PoppyHarlowCNN on Quest Means Business @CNN International today at 4pm ET,2015-10-21T19:18:02.000Z
Carl Icahn,@Carl_C_Icahn,Business Man,1534167900,658640616570671104,"Good article by @zachmider @bpolitics re my super PAC, view of inversions and some recent criticism: https://t.co/kdTcqWkNwJ",2015-10-26T13:45:34.000Z
Carl Icahn,@Carl_C_Icahn,Business Man,1534167900,659045301785874436,Senator Rob Portman is right on: https://t.co/yzBqnj80sP,2015-10-27T16:33:39.000Z
Carl Icahn,@Carl_C_Icahn,Business Man,1534167900,659355099848941569,I own a large stake in AIG and have just sent the following letter to the CEO: https://t.co/YbwIYpRfVE,2015-10-28T13:04:40.000Z
Carl Icahn,@Carl_C_Icahn,Business Man,1534167900,659791787842736128,"1/3 Unfortunately, my warning concerning the imminent exodus of many of our best companies is coming true.",2015-10-29T17:59:55.000Z
Carl Icahn,@Carl_C_Icahn,Business Man,1534167900,659791847540264961,2/3 Today Pfizer confirmed they are planning to move out of the country. The situation is much more dangerous than most people believe.,2015-10-29T18:00:09.000Z
Carl Icahn,@Carl_C_Icahn,Business Man,1534167900,659792132207677440,3/3 There is no reason Congress cannot act now to pass international tax reform with the Highway Bill.Read my letter https://t.co/fbbB8mNWMR,2015-10-29T18:01:17.000Z
Carl Icahn,@Carl_C_Icahn,Business Man,1534167900,661319353544126464,I’ll be on @MariaBartiromo ‘s ‘Mornings with Maria’ tomorrow at 7:20 a.m. ET on @FoxBusiness,2015-11-02T23:09:55.000Z
Carl Icahn,@Carl_C_Icahn,Business Man,1534167900,664509147996626944,I’ll be speaking with @TeamCavuto today at 1:40pm ET on @FoxBusiness,2015-11-11T18:25:01.000Z
Carl Icahn,@Carl_C_Icahn,Business Man,1534167900,668791339077779456,We just released a statement (including other important information) on $AIG – available here: https://t.co/QOVsS3kgg4,2015-11-23T14:00:55.000Z
Carl Icahn,@Carl_C_Icahn,Business Man,1534167900,672395527917580288,I was recently a guest on @boonepickens 's podcast.  You can watch it here: https://t.co/oOVVZDEGu1,2015-12-03T12:42:41.000Z
Carl Icahn,@Carl_C_Icahn,Business Man,1534167900,672777402897063936,Very happy about this transaction: https://t.co/KruoDGnAQ1,2015-12-04T14:00:07.000Z
Carl Icahn,@Carl_C_Icahn,Business Man,1534167900,675366443500871684,"Should read this, especially if you are in the market:  “Like Icahn, SEC Sees 'Danger Ahead' in These Risky ETFs” https://t.co/2J3cLZ9gQL",2015-12-11T17:28:02.000Z
Carl Icahn,@Carl_C_Icahn,Business Man,1534167900,675366546605252608,"You should also read, “Junk-Bond Fear Gauge Nears 3-Year High After Third Avenue Freeze”: https://t.co/DiDtq2iFKA",2015-12-11T17:28:27.000Z
Carl Icahn,@Carl_C_Icahn,Business Man,1534167900,675367106817454080,If you haven’t seen ‘Danger Ahead’ watch it on https://t.co/4rVAcLBsH9. Unfortunately I believe the meltdown in High Yield is just beginning,2015-12-11T17:30:40.000Z
Carl Icahn,@Carl_C_Icahn,Business Man,1534167900,676247922363731969,"Regarding the termination of Charif Souki as CEO of Cheniere, we have made the following statement: https://t.co/Ls7E0Yv6v9",2015-12-14T03:50:43.000Z
Carl Icahn,@Carl_C_Icahn,Business Man,1534167900,676373780902649856,I wrote an op-ed in the @nytimes regarding repatriation.  You can read it here: https://t.co/fDYCWOnlpg,2015-12-14T12:10:50.000Z
Carl Icahn,@Carl_C_Icahn,Business Man,1534167900,678932085143379968,$PBY informed $IEP that our increased $16.50 bid is superior &amp; they intend to terminate Bridgestone deal. See filing https://t.co/AAR5v4xKRi,2015-12-21T13:36:37.000Z
