Cristiano Ronaldo,@critiano,Athlete,155659213,450644235981971457,"You asked: Ronaldo can you say hello? Im your #1 fan, in from México  http://t.co/ArUIEuv4nQ",2014-03-31T14:42:13.000Z
Cristiano Ronaldo,@critiano,Athlete,155659213,450644368144486400,You asked: Hello Cristiano. I'm a huge fan from maldives. Please say hi. http://t.co/9UR0AtPAxj,2014-03-31T14:42:44.000Z
Cristiano Ronaldo,@critiano,Athlete,155659213,450646999206207490,You asked: Can you say Hay? I am your #1 fan from Croatia. @69withjustinlol http://t.co/eKutueSpmP,2014-03-31T14:53:11.000Z
Cristiano Ronaldo,@critiano,Athlete,155659213,450678995198017536,Come support Portugal vs Ireland on June 10 at @MLStadium. It’s Portugal National Day. http://t.co/IrVnQPZNmg http://t.co/Sa8V91zO7o,2014-03-31T17:00:20.000Z
Cristiano Ronaldo,@critiano,Athlete,155659213,450912301936570368,Every challenge is a new chance! Be brave when you step on the pitch. http://t.co/zklIEWEN5H #riskeverything @nikefootball,2014-04-01T08:27:24.000Z
Cristiano Ronaldo,@critiano,Athlete,155659213,452046095036600320,Just to let you know that Round One of @GAMEbyRonaldo is running until &gt; May 1st &lt; Join at http://t.co/HRFXiaMed1 http://t.co/QpURWaU98D,2014-04-04T11:32:42.000Z
Cristiano Ronaldo,@critiano,Athlete,155659213,452046344115724288,You can also sign up using @GAMEbyRonaldo mobile apps. Download them at http://t.co/LgwDTXSqAv http://t.co/88vB7zMmRA Have fun!,2014-04-04T11:33:41.000Z
Cristiano Ronaldo,@critiano,Athlete,155659213,453190870997561344,Enter the #CR7emag competition to win a Meet&amp;Greet with me. Download it and take your chance! http://t.co/pkhEHkOgHL http://t.co/qVPAvXF5m5,2014-04-07T15:21:38.000Z
Cristiano Ronaldo,@critiano,Athlete,155659213,453837541243092992,Another step in the competition. The team is now on the Champions League semi-finals. http://t.co/bFW6uqr5fs,2014-04-09T10:11:16.000Z
Cristiano Ronaldo,@critiano,Athlete,155659213,453933334276894721,RT @VivaRonaldo: Let's all support this Portuguese Human Rights campaign on Facebook! http://t.co/lG5r3kcUrH,2014-04-09T16:31:55.000Z
Cristiano Ronaldo,@critiano,Athlete,155659213,453938339503042560,Check out my @nikefootball #Mercurial Vapor IXs http://t.co/i0CpT2USSR http://t.co/8EU0H1arPH,2014-04-09T16:51:48.000Z
Cristiano Ronaldo,@critiano,Athlete,155659213,454273352098930689,Have you seen the fan portrait of @ApoyoCR7 in my #CR7emag? Maybe I will choose you for the next issue. Check it out. http://t.co/M9p7zbmUNu,2014-04-10T15:03:01.000Z
Cristiano Ronaldo,@critiano,Athlete,155659213,454306935744233472,Congratulations @branditportugal . Keep up the good work. http://t.co/0g4hRpmnxL  http://t.co/qkyZTPueMX,2014-04-10T17:16:28.000Z
Cristiano Ronaldo,@critiano,Athlete,155659213,454622080307179520,"Flying with @Emirates is an amazing experience, you never know who you’re going to bump into. Watch and share: http://t.co/TzaC5Pxbfz",2014-04-11T14:08:45.000Z
Cristiano Ronaldo,@critiano,Athlete,155659213,455673667213877248,Welcome back Khedira!  http://t.co/8fwxnFv9q1,2014-04-14T11:47:22.000Z
Cristiano Ronaldo,@critiano,Athlete,155659213,455707249281753088,A big shout out for all @GAMEbyRonaldo players and teams playing on Round One. Good luck for this final stretch guys! http://t.co/XCxymTOpZL,2014-04-14T14:00:49.000Z
Cristiano Ronaldo,@critiano,Athlete,155659213,455714275089457152,Check the @GAMEbyRonaldo standings http://t.co/RtdieKqlHV What's your favourite team?Who will win? http://t.co/SIATgEvFRc,2014-04-14T14:28:44.000Z
Cristiano Ronaldo,@critiano,Athlete,155659213,456031554062778368,Tomorrow is the #FinalCopa del Rey. Let’s all support the team! Hala Madrid!  http://t.co/4tahjhyRRP,2014-04-15T11:29:29.000Z
Cristiano Ronaldo,@critiano,Athlete,155659213,456379116267110402,"RT @aarbeloa17: ¡Los refuerzos van de camino! ;)
¡¡HALA MADRID!! http://t.co/c6JfyevYis",2014-04-16T10:30:35.000Z
Cristiano Ronaldo,@critiano,Athlete,155659213,456553040988741633,What an exciting #FinalCopa! We are the Copa del Rey Champions. I'm proud of the team. Hala Madrid! http://t.co/yqLykmUbAu,2014-04-16T22:01:42.000Z
Cristiano Ronaldo,@critiano,Athlete,155659213,456562188149223425,First title of the season. #FinalCopa #champions http://t.co/iMg6HEJSfW,2014-04-16T22:38:02.000Z
Cristiano Ronaldo,@critiano,Athlete,155659213,456745671270232064,What an incredible night! Thanks to all the fans who celebrated with us. #CopadelRey http://t.co/gdklCrp9lu,2014-04-17T10:47:08.000Z
Cristiano Ronaldo,@critiano,Athlete,155659213,456815641651986433,Do you wanna know more about the touching story of 14 year old Dawid? http://t.co/9ptXodoLVx,2014-04-17T15:25:10.000Z
Cristiano Ronaldo,@critiano,Athlete,155659213,456815931306414080,He awoke from a coma while listening to reports of Real Madrid games and came to Madrid to meet me.  http://t.co/rLQiFgIoPo,2014-04-17T15:26:19.000Z
Cristiano Ronaldo,@critiano,Athlete,155659213,456816363000971264,Download the #CR7emag to check it out. Available in Android http://t.co/1RV43Kkn1w and iOS http://t.co/XcSbpkpEut,2014-04-17T15:28:02.000Z
Cristiano Ronaldo,@critiano,Athlete,155659213,458618337769971712,I've scored 14 goals in the Champions League. Can you do the same in CR Footy? Try it for free http://t.co/H9KsjZtCC6 http://t.co/kMLiARAjv7,2014-04-22T14:48:27.000Z
Cristiano Ronaldo,@critiano,Athlete,155659213,458638324203520000,You asked:Hello Cristiano!Could you please say hi to all madridistas here in Honduras?:) @jessiarita http://t.co/4dcJahSCAT,2014-04-22T16:07:52.000Z
Cristiano Ronaldo,@critiano,Athlete,155659213,458639117652623360,You asked: greetings from italy! @robertocolelli1 http://t.co/BY867ALt87,2014-04-22T16:11:01.000Z
Cristiano Ronaldo,@critiano,Athlete,155659213,458639399107174402,"You asked: I'm your #1 fan from England! Please could you possibly say ""hi Noah"" ... @noahjlyons http://t.co/OqrBd1Q3BC",2014-04-22T16:12:08.000Z
Cristiano Ronaldo,@critiano,Athlete,155659213,458640075530977280,You asked: Olá Cristiano ¿Como você está? Saudações da Argentina. Eu te amo ídolo @pato_sardelli01 http://t.co/SmeZWk0y9z,2014-04-22T16:14:49.000Z
Cristiano Ronaldo,@critiano,Athlete,155659213,458640284889669632,You asked: Eres un gran jugador pero aún mejor persona. Saludos desde Alicante :) http://t.co/Pnpk2TPumA,2014-04-22T16:15:39.000Z
Cristiano Ronaldo,@critiano,Athlete,155659213,458641972958625792,"You asked: Can you say hello to me ,please? I am from Bulgaria!!! http://t.co/dyNj55sAq4",2014-04-22T16:22:22.000Z
Cristiano Ronaldo,@critiano,Athlete,155659213,458912307423490048,Do you know Sportlobster? It’s a great new social network just for sports. Get the app and follow me here. http://t.co/Eg4C2TJsxf,2014-04-23T10:16:34.000Z
Cristiano Ronaldo,@critiano,Athlete,155659213,458980173296058368,You only become a giant by making them fall. #RiskEverything http://t.co/q5emYFofxO,2014-04-23T14:46:15.000Z
Cristiano Ronaldo,@critiano,Athlete,155659213,459284409611345920,"Good to be back on the pitch, specially with a win against Bayern. One step forward to the final. #RoadToLisbon http://t.co/aYS7mOaSHR",2014-04-24T10:55:11.000Z
Cristiano Ronaldo,@critiano,Athlete,155659213,459330288817274880,@VivaRonaldo Thanks guys.,2014-04-24T13:57:29.000Z
Cristiano Ronaldo,@critiano,Athlete,155659213,459361449987407872,Last days of Round One guys but this amazing championship has more to come! Stay tuned join at http://t.co/HRFXiaMed1 http://t.co/StYyWrSCCL,2014-04-24T16:01:19.000Z
Cristiano Ronaldo,@critiano,Athlete,155659213,459373385441869824,And even after May 1st you'll be able to continue playing on @GAMEbyRonaldo. So stay tuned at http://t.co/LSCjChaEww,2014-04-24T16:48:44.000Z
Cristiano Ronaldo,@critiano,Athlete,155659213,459715771930009600,Such an honour to be one of TIME's 100 most influential people. http://t.co/BCMj7q0V0u,2014-04-25T15:29:15.000Z
Cristiano Ronaldo,@critiano,Athlete,155659213,459760164758097921,Winner stays! http://t.co/qaf6ZH6Z0F @nikefootball #RiskEverything,2014-04-25T18:25:39.000Z
Cristiano Ronaldo,@critiano,Athlete,155659213,460750585340231683,Check out the gift I got from @TAGHeuer. This TAG Heuer Carrera really suits me! What do you think? http://t.co/zaKi6hlSzP,2014-04-28T12:01:14.000Z
Cristiano Ronaldo,@critiano,Athlete,155659213,461457709879947264,Living a dream - Lisbon here we go - thank you all for the amazing support #roadtoLisbon#HalaMadrid. http://t.co/iDWw1fJdtl,2014-04-30T10:51:06.000Z
Cristiano Ronaldo,@critiano,Athlete,155659213,462282503919636481,Go to http://t.co/TNKh5Ybdvy for your chance to win one of the 5 signed pairs of #CR7Underwear trunks. Good luck. http://t.co/IRkObPoMoK,2014-05-02T17:28:32.000Z
Cristiano Ronaldo,@critiano,Athlete,155659213,462684823417782272,O que é que eu e a Dona Inércia temos em comum? Descubram em http://t.co/O7HezUz2bq,2014-05-03T20:07:12.000Z
Cristiano Ronaldo,@critiano,Athlete,155659213,462921243550040064,Check out how @nikefootball revealed my new Flyknit Mercurial Superfly boots last week. http://t.co/rVxH0eXDt3 #riskeverything,2014-05-04T11:46:39.000Z
Cristiano Ronaldo,@critiano,Athlete,155659213,463335392553361408,A round of applause to International FC @IFC_FIVES for winning Round One of The GAME by Ronaldo. Congrats guys! http://t.co/agBwu49nED,2014-05-05T15:12:20.000Z
Cristiano Ronaldo,@critiano,Athlete,155659213,463344448412614656,"But stay tuned, because there's a lot more to come from @GAMEbyRonaldo You can join now at http://t.co/LSCjChaEww",2014-05-05T15:48:19.000Z
Cristiano Ronaldo,@critiano,Athlete,155659213,463688909260865538,"I’m pleased to see I have so many followers on Sportlobster! Stay tuned, I’ll be following some fans. Will it be you? http://t.co/Eg4C2TJsxf",2014-05-06T14:37:05.000Z
Cristiano Ronaldo,@critiano,Athlete,155659213,463770977961115648,Não imaginam a pergunta que a Dona Inércia me fez. Vejam em http://t.co/Ole5EkkrcS,2014-05-06T20:03:12.000Z
Cristiano Ronaldo,@critiano,Athlete,155659213,464795545207582721,There are only a few days left to win one of the 5 pairs of #CR7Underwear trunks signed by me! Go to http://t.co/Vlium6Y7de to enter!,2014-05-09T15:54:28.000Z
Cristiano Ronaldo,@critiano,Athlete,155659213,464858238127964160,Sabem o que quer dizer CR? Não é bem o que estão a pensar. A D. Inércia do BES diz-vos. http://t.co/EPrF7wRcp0,2014-05-09T20:03:35.000Z
Cristiano Ronaldo,@critiano,Athlete,155659213,465041245468127232,"I've been training with the best to take down aliens &amp; save the world. Stay tuned
 #GALAXY11 #GALAXYS5 @SamsungMobile http://t.co/mtJbofTqAo",2014-05-10T08:10:47.000Z
Cristiano Ronaldo,@critiano,Athlete,155659213,465133030768922624,I am pleased to see 95% of fans have predicted a win on Sportlobster. Have you made yours yet? http://t.co/Eg4C2TJsxf,2014-05-10T14:15:30.000Z
Cristiano Ronaldo,@critiano,Athlete,155659213,466543717336096768,Morning training session @RealMadrid  http://t.co/d6NJfswlRT,2014-05-14T11:41:04.000Z
Cristiano Ronaldo,@critiano,Athlete,155659213,466571814203031554,"Hey, @Falcao, how crazy was training today? Have you ever gone against an 8-arm goalie before? http://t.co/GqKBymkaXx",2014-05-14T13:32:43.000Z
Cristiano Ronaldo,@critiano,Athlete,155659213,466629267062030338,"Hey guys, have you checked out the different Fanzones on Sportlobster? Choose yours &amp; follow me http://t.co/Eg4C2TJsxf",2014-05-14T17:21:01.000Z
Cristiano Ronaldo,@critiano,Athlete,155659213,466954760206446592,Know how it feels to be a winner!Pre-register at http://t.co/qvWsCbE1mp and qualify to win a Team Shirt signed by me. http://t.co/lM0IUhJAwf,2014-05-15T14:54:25.000Z
Cristiano Ronaldo,@critiano,Athlete,155659213,467302798842150913,Great day shooting Rankin x Ronaldo for #CR7Underwear with @rankinphoto. Can't wait to show you the new collection! http://t.co/f9z67i6CDW,2014-05-16T13:57:23.000Z
Cristiano Ronaldo,@critiano,Athlete,155659213,467602411889360896,Proud to be an ambassador for @sportlobster! Football is my lobster - #WhatsYourLobster? http://t.co/Eg4C2TJsxf http://t.co/i9lYACl80d,2014-05-17T09:47:57.000Z
Cristiano Ronaldo,@critiano,Athlete,155659213,468058698968207361,"Hi guys, @VivaRonaldo is giving away 2 shirts signed by me! Check http://t.co/UPqous7vfv for details. #APorLaDecima http://t.co/MjB6ygOeyR",2014-05-18T16:01:04.000Z
Cristiano Ronaldo,@critiano,Athlete,155659213,468390157021089792,How fun it was to be part of this new commercial. Check out what happened behind the scenes. http://t.co/urSaitfD3X,2014-05-19T13:58:10.000Z
Cristiano Ronaldo,@critiano,Athlete,155659213,468392813101846528,"You asked: Hi Cristiano, I`m a big fan from Norway!  http://t.co/7AImrp67aW",2014-05-19T14:08:43.000Z
Cristiano Ronaldo,@critiano,Athlete,155659213,468393085471571969,You asked: Can you say hello to me.My name is Elbasan. http://t.co/rjLrrZrRA6,2014-05-19T14:09:48.000Z
Cristiano Ronaldo,@critiano,Athlete,155659213,468393223791312896,"You asked: Hola Cristiano, puedes saludarme 'Hola Tito'? http://t.co/UyMAMFIcs6",2014-05-19T14:10:21.000Z
Cristiano Ronaldo,@critiano,Athlete,155659213,468393969127542784,"You asked: Hi Cristiano! how are you? can you tell me ""Hello"" Sofia ? http://t.co/6mfqyXGhw4",2014-05-19T14:13:19.000Z
Cristiano Ronaldo,@critiano,Athlete,155659213,468394913617698816,You asked: Hi Ronaldo! I love you so much! Please say hello to me! I am from Turkey!  http://t.co/xpDH5Ppb67,2014-05-19T14:17:04.000Z
Cristiano Ronaldo,@critiano,Athlete,155659213,468395386391248896,"You asked: ¡Hello Cristiano! Can you greet me.
Your great fan from Mexico. http://t.co/bfYAsVsnkw",2014-05-19T14:18:57.000Z
Cristiano Ronaldo,@critiano,Athlete,155659213,468485886632804352,Brazil here we go! #ForçaPortugal http://t.co/obmHyrPSFq,2014-05-19T20:18:34.000Z
Cristiano Ronaldo,@critiano,Athlete,155659213,468713132928806912,Training for the final on Saturday! #APorLaDécima @realmadrid  http://t.co/Z72YgacX6A,2014-05-20T11:21:33.000Z
Cristiano Ronaldo,@critiano,Athlete,155659213,468761284285333505,Would u like to fly to the final in Brazil?Pre-register: http://t.co/qvWsCbE1mp &amp; qualify to win a signed Team Shirt. http://t.co/KM5VlsyeFP,2014-05-20T14:32:54.000Z
Cristiano Ronaldo,@critiano,Athlete,155659213,469119837948895232,Hey all @realmadrid fans! Come cheer us #APorLaDécima. Your support is our strenght.  http://t.co/qPVmohXb81,2014-05-21T14:17:39.000Z
Cristiano Ronaldo,@critiano,Athlete,155659213,469454681572655105,Saturday we’ll play #APorLaDécima. Cheer for the team and predict the result on Sportlobster http://t.co/4aMqGX2y84,2014-05-22T12:28:12.000Z
Cristiano Ronaldo,@critiano,Athlete,155659213,469571714972913664,Acabei de fazer as minhas previsões para o R. Madrid vs. A. Madrid no #VivaRonaldo. E tu? @VivaRonaldo http://t.co/ZQmCmauqWF,2014-05-22T20:13:15.000Z
Cristiano Ronaldo,@critiano,Athlete,155659213,469798491741761536,"In the biggest game against our closest rivals, there is only one option. #riskeverything http://t.co/yi5EdBw7bd",2014-05-23T11:14:23.000Z
Cristiano Ronaldo,@critiano,Athlete,155659213,469809225678741504,"Tomorrow will be a dream come true to play the final in Portugal, my welcoming country. http://t.co/kyfsGYcWG3 http://t.co/AG4Pymxsjz",2014-05-23T11:57:02.000Z
Cristiano Ronaldo,@critiano,Athlete,155659213,469937463562350592,Let's go team #APorLaDécima!  http://t.co/vkRzCNCFbp,2014-05-23T20:26:36.000Z
Cristiano Ronaldo,@critiano,Athlete,155659213,470339597147570177,La Décima is ours. Hala Madrid! #uclfinal #realmadrid #lisbon http://t.co/q0NPEFAJCD,2014-05-24T23:04:33.000Z
Cristiano Ronaldo,@critiano,Athlete,155659213,470850055873003520,We’re Champions of Europe! I’m living a dream! Thank you all! #halamadrid #UCLfinal #lisbon http://t.co/fJxbG49ET3 http://t.co/pw3qx8QX8P,2014-05-26T08:52:55.000Z
Cristiano Ronaldo,@critiano,Athlete,155659213,471286625889431552,"Play soon for an exclusive trip + seats FINAL Rio, Brazil!  Follow @TopWinGames &amp; register for a signed Team Shirt. http://t.co/dHLdBiUjLv",2014-05-27T13:47:42.000Z
Cristiano Ronaldo,@critiano,Athlete,155659213,471301199288107009,Thanks for the support @WayneRooney. Crazy days these last ones!,2014-05-27T14:45:36.000Z
Cristiano Ronaldo,@critiano,Athlete,155659213,471662554654461952,Taking a break to play the new #GALAXY11 Striker Soccer game. Who's got next? http://t.co/RyoDChFzIA http://t.co/3InIC2Amsv,2014-05-28T14:41:30.000Z
Cristiano Ronaldo,@critiano,Athlete,155659213,471739606845898752,Relaxing time. http://t.co/raVxPbnQoV,2014-05-28T19:47:41.000Z
Cristiano Ronaldo,@critiano,Athlete,155659213,471758168050401280,"Next week the National Team will be in the USA preparing the World Cup!First up, Mexico at Gillette Stadium, June 6th.Come support Portugal!",2014-05-28T21:01:26.000Z
Cristiano Ronaldo,@critiano,Athlete,155659213,471940088646348800,"Behind the scenes of the @TAGHeuer Shooting, guess which model I chose? http://t.co/CxGiE8uqqt",2014-05-29T09:04:20.000Z
Cristiano Ronaldo,@critiano,Athlete,155659213,472058454094647296,"Today, the Sun publishes an interview with me that I never gave. So its content is pure fiction.",2014-05-29T16:54:40.000Z
Cristiano Ronaldo,@critiano,Athlete,155659213,472097881558896640,"Here is the official song of the Portuguese National Team for the World Cup, performed by Kika. So uplifting! https://t.co/dd8pgpY1uB",2014-05-29T19:31:20.000Z
Cristiano Ronaldo,@critiano,Athlete,155659213,472336575364612096,Download the official song of the Portuguese National Team by @Kikamusicnet produced by @RedOne_Official http://t.co/PWgN0Oe9zq,2014-05-30T11:19:49.000Z
Cristiano Ronaldo,@critiano,Athlete,155659213,472372040578924545,"On June 3rd, play for an exclusive trip to Brazil: win top seats for the Final and much more. http://t.co/JEIdecR34r http://t.co/uvXJMMgWxi",2014-05-30T13:40:45.000Z
Cristiano Ronaldo,@critiano,Athlete,155659213,472391706907009024,"You asked: Olá, poderia mandar um abraço para uma grande fã do Brasil? :) http://t.co/swyeKUBQEV",2014-05-30T14:58:54.000Z
Cristiano Ronaldo,@critiano,Athlete,155659213,472391970397376512,"You asked: Hola idolo, como estas? Puedes saludarme? Me llamo Mayra y te apoyo desde Argentina idolo! http://t.co/d8n3uIdcvp",2014-05-30T14:59:57.000Z
Cristiano Ronaldo,@critiano,Athlete,155659213,472392133911904257,"You asked: Can you say hello to me?? 
My name is Maria :)  http://t.co/ysDCHUnsHE",2014-05-30T15:00:36.000Z
Cristiano Ronaldo,@critiano,Athlete,155659213,472392918171660288,You asked: Can you say hello to me?  My name is Narin and I am from Germany http://t.co/lx2CRb3xwh,2014-05-30T15:03:42.000Z
Cristiano Ronaldo,@critiano,Athlete,155659213,472393165211992064,"You asked: Say hello to me and my cousin Nicholas, we are huge friends! My name is Brianne :)  http://t.co/JRFEIHBbi0",2014-05-30T15:04:41.000Z
Cristiano Ronaldo,@critiano,Athlete,155659213,472393432334598144,"You asked: Can you say ""Ciao Chiara""?I'm italian :)  http://t.co/tFIb5fDaLq",2014-05-30T15:05:45.000Z
Cristiano Ronaldo,@critiano,Athlete,155659213,472393853962829824,"You asked: Hola Cris, saludos desde Ecuador, éxitos en el mundial, eres el mejor. http://t.co/T9aqKhOxBo",2014-05-30T15:07:26.000Z
Cristiano Ronaldo,@critiano,Athlete,155659213,472427746338299904,"Very soon @Sportlobster will reach a million users. To celebrate I will follow the millionth user, will it be you? http://t.co/Eg4C2TJsxf",2014-05-30T17:22:06.000Z
Cristiano Ronaldo,@critiano,Athlete,155659213,473037864616599552,"Were you one of the winners of my #CR7underwear competition? Check out!
http://t.co/iETJySmqKa",2014-06-01T09:46:30.000Z
Cristiano Ronaldo,@critiano,Athlete,155659213,473061196573474816,"Hey guys, check out the new cool wallpapers on my website. http://t.co/MGroCC4ZQO ",2014-06-01T11:19:12.000Z
Cristiano Ronaldo,@critiano,Athlete,155659213,473124692103274496,You've never seen me play like this! http://t.co/TI0lNisaBw @nikefootball #riskeverything,2014-06-01T15:31:31.000Z
Cristiano Ronaldo,@critiano,Athlete,155659213,473187313263329280,Happy to spend Children's Day with my son. http://t.co/jFVpmFWaZO,2014-06-01T19:40:21.000Z
Cristiano Ronaldo,@critiano,Athlete,155659213,473464275034722304,"Leaving Portugal to prepare for the WorldCup Brazil. With open arms to the world, go Portugal! http://t.co/e7lR3eCDzX http://t.co/5AOWhIIizp",2014-06-02T14:00:54.000Z
Cristiano Ronaldo,@critiano,Athlete,155659213,473482810519715840,A team representing a country! #ForçaPortugal http://t.co/a8ywntsZwm,2014-06-02T15:14:33.000Z
Cristiano Ronaldo,@critiano,Athlete,155659213,473855476019777536,Today Brazil game starts! You’ll be surprised on http://t.co/qvWsCbE1mp. All-inclusive trip to the Final. Go play it! http://t.co/RrFOjg8VBt,2014-06-03T15:55:23.000Z
Cristiano Ronaldo,@critiano,Athlete,155659213,473885182249160705,Congrats to @IFC_FIVES from London for winning Round One of @GAMEbyRonaldo!It was great meeting all of you in #Lisbon http://t.co/Omj7yY2K88,2014-06-03T17:53:26.000Z
Cristiano Ronaldo,@critiano,Athlete,155659213,473885518053507073,It was a pleasure to invite you to the game.All the best @IFC_FIVES and hope to see you for Round Two @GAMEbyRonaldo http://t.co/f8kJbjsDEA,2014-06-03T17:54:46.000Z
Cristiano Ronaldo,@critiano,Athlete,155659213,473885629047394304,"Round Two is on. If you’re a football player, sign up your team now on http://t.co/LSCjChaEww",2014-06-03T17:55:12.000Z
Cristiano Ronaldo,@critiano,Athlete,155659213,473886543640551424,RT @KingOfFive: @Cristiano @IFC_FIVES @ThecatPaul thanks for meeting us on Saturday your a great guy it was a special moment for us http://…,2014-06-03T17:58:51.000Z
Cristiano Ronaldo,@critiano,Athlete,155659213,473888551755845633,"RT @IFC_FIVES: THE CHEIF SCOUT SHOWING OFF HIS SILVERWARE
#AllHailDaCheifScout http://t.co/9wEn1egy9o",2014-06-03T18:06:49.000Z
Cristiano Ronaldo,@critiano,Athlete,155659213,474215851022110720,I'm driven to perfection. Are you? Show how by posting a 15s video or pic tagged #CR7DrivenToPerfection. Learn more http://t.co/csJmFznT9Z,2014-06-04T15:47:24.000Z
Cristiano Ronaldo,@critiano,Athlete,155659213,474519786597412864,"Check out the blog I wrote on Sportlobster, a personal message to my fans ahead of Brazil. Hope you like it! http://t.co/PlQgFRjaMj",2014-06-05T11:55:07.000Z
Cristiano Ronaldo,@critiano,Athlete,155659213,474602826677911552,Come support Portugal against Mexico tomorrow at Gillette Stadium #ForçaPortugal,2014-06-05T17:25:06.000Z
Cristiano Ronaldo,@critiano,Athlete,155659213,474917525864861696,The world is waiting.  I’m ready for 'The Last Game’ June 9th! @nikefootball #riskeverything http://t.co/wrgm8gYBsx,2014-06-06T14:15:36.000Z
Cristiano Ronaldo,@critiano,Athlete,155659213,475074652843556864,Força Portugal! http://t.co/yUJUpuQbv9,2014-06-07T00:39:58.000Z
Cristiano Ronaldo,@critiano,Athlete,155659213,475656397624184832,Do you want to see me singing with Anselmo Ralph? Check out http://t.co/E7NWTTYgOZ,2014-06-08T15:11:37.000Z
Cristiano Ronaldo,@critiano,Athlete,155659213,476033489029304320,Risk makes the game beautiful. http://t.co/WnJfvhjwIM @nikefootball #riskeverything,2014-06-09T16:10:02.000Z
Cristiano Ronaldo,@critiano,Athlete,155659213,476744996184674305,"Hello guys, we arrived in Brazil. Any fans from Brazil over here? http://t.co/q7UUO2Vk5f",2014-06-11T15:17:19.000Z
Cristiano Ronaldo,@critiano,Athlete,155659213,476755584671571968,Obrigado @LukinhasMendes7,2014-06-11T15:59:23.000Z
Cristiano Ronaldo,@critiano,Athlete,155659213,476756277037891584,Obrigado @CRonaldoFever pelo vosso apoio.,2014-06-11T16:02:08.000Z
Cristiano Ronaldo,@critiano,Athlete,155659213,476758468586926080,Muchas gracias a todos @CR7StrongChile,2014-06-11T16:10:51.000Z
Cristiano Ronaldo,@critiano,Athlete,155659213,476759551367462913,@CRonaldoNews muito obrigado e #ForçaPortugal,2014-06-11T16:15:09.000Z
Cristiano Ronaldo,@critiano,Athlete,155659213,476762377372065792,#ForçaPortugal. E obrigado @7cristianorb,2014-06-11T16:26:23.000Z
Cristiano Ronaldo,@critiano,Athlete,155659213,476770924587667456,I’m in Brazil. Want to come here and see the Final? Qualify for 4 signed team shirts here http://t.co/QcRcJwRgGt http://t.co/HZS2KjtG4P,2014-06-11T17:00:21.000Z
Cristiano Ronaldo,@critiano,Athlete,155659213,477052670197653504,"Insane first half against the aliens! @Falcao, we'll show them how we play football! #GALAXY11 http://t.co/z0FzRHz6gG http://t.co/pGJ4F1AcO0",2014-06-12T11:39:54.000Z
Cristiano Ronaldo,@critiano,Athlete,155659213,477119130626433024,"With my brothers @SRod7 y @euro , big things this year, ""Don't €xpect Nothing"". http://t.co/VT5piu27jc",2014-06-12T16:03:59.000Z
Cristiano Ronaldo,@critiano,Athlete,155659213,477128869968113664,"RT @CRonaldoNews: Brazil loves Portugal! @VivaRonaldo http://t.co/iS1UpUNIcp
[@edmacieldesa]",2014-06-12T16:42:41.000Z
Cristiano Ronaldo,@critiano,Athlete,155659213,477129505489059840,RT @PaulaLitaiff_: @Cristiano Sejam bem-vindos! Espero que gostem daqui! E boa sorte nos jogos! Estou torcendo muito por vocês! #ForçaPortu…,2014-06-12T16:45:13.000Z
Cristiano Ronaldo,@critiano,Athlete,155659213,477136937292398593,What a wonderful and warming reception we´re having in Campinas. Thank you everyone #forçaportugal http://t.co/QsUcMga4VZ,2014-06-12T17:14:45.000Z
Cristiano Ronaldo,@critiano,Athlete,155659213,477415523878465536,What a great first training session and day yesterday.  http://t.co/3HmGPTfzXb,2014-06-13T11:41:45.000Z
Cristiano Ronaldo,@critiano,Athlete,155659213,477475385488457728,RT @nikefootball: The #Mercurial Superfly designed by @Cristiano for his biggest fan @7cristianorb. Get yours: http://t.co/YO65Aym1gr http:…,2014-06-13T15:39:37.000Z
Cristiano Ronaldo,@critiano,Athlete,155659213,477513352647028736,Met brave #NYC kids who survived Superstorm Sandy and are helping other communities with the help of @SavetheChildren http://t.co/ROkDO7Y5nE,2014-06-13T18:10:29.000Z
