458618337769971712,2014-04-22T14:48:27.000Z,155659213,@critiano,Cristiano Ronaldo,Athlete,I've scored 14 goals in the Champions League. Can you do the same in CR Footy? Try it for free http://t.co/H9KsjZtCC6 http://t.co/kMLiARAjv7
458638324203520000,2014-04-22T16:07:52.000Z,155659213,@critiano,Cristiano Ronaldo,Athlete,You asked:Hello Cristiano!Could you please say hi to all madridistas here in Honduras?:) @jessiarita http://t.co/4dcJahSCAT
458639117652623360,2014-04-22T16:11:01.000Z,155659213,@critiano,Cristiano Ronaldo,Athlete,You asked: greetings from italy! @robertocolelli1 http://t.co/BY867ALt87
458639399107174402,2014-04-22T16:12:08.000Z,155659213,@critiano,Cristiano Ronaldo,Athlete,"You asked: I'm your #1 fan from England! Please could you possibly say ""hi Noah"" ... @noahjlyons http://t.co/OqrBd1Q3BC"
458640075530977280,2014-04-22T16:14:49.000Z,155659213,@critiano,Cristiano Ronaldo,Athlete,You asked: Olá Cristiano ¿Como você está? Saudações da Argentina. Eu te amo ídolo @pato_sardelli01 http://t.co/SmeZWk0y9z
458640284889669632,2014-04-22T16:15:39.000Z,155659213,@critiano,Cristiano Ronaldo,Athlete,You asked: Eres un gran jugador pero aún mejor persona. Saludos desde Alicante :) http://t.co/Pnpk2TPumA
458641972958625792,2014-04-22T16:22:22.000Z,155659213,@critiano,Cristiano Ronaldo,Athlete,"You asked: Can you say hello to me ,please? I am from Bulgaria!!! http://t.co/dyNj55sAq4"
458912307423490048,2014-04-23T10:16:34.000Z,155659213,@critiano,Cristiano Ronaldo,Athlete,Do you know Sportlobster? It’s a great new social network just for sports. Get the app and follow me here. http://t.co/Eg4C2TJsxf
458980173296058368,2014-04-23T14:46:15.000Z,155659213,@critiano,Cristiano Ronaldo,Athlete,You only become a giant by making them fall. #RiskEverything http://t.co/q5emYFofxO
459284409611345920,2014-04-24T10:55:11.000Z,155659213,@critiano,Cristiano Ronaldo,Athlete,"Good to be back on the pitch, specially with a win against Bayern. One step forward to the final. #RoadToLisbon http://t.co/aYS7mOaSHR"
459330288817274880,2014-04-24T13:57:29.000Z,155659213,@critiano,Cristiano Ronaldo,Athlete,@VivaRonaldo Thanks guys.
459361449987407872,2014-04-24T16:01:19.000Z,155659213,@critiano,Cristiano Ronaldo,Athlete,Last days of Round One guys but this amazing championship has more to come! Stay tuned join at http://t.co/HRFXiaMed1 http://t.co/StYyWrSCCL
459373385441869824,2014-04-24T16:48:44.000Z,155659213,@critiano,Cristiano Ronaldo,Athlete,And even after May 1st you'll be able to continue playing on @GAMEbyRonaldo. So stay tuned at http://t.co/LSCjChaEww
459715771930009600,2014-04-25T15:29:15.000Z,155659213,@critiano,Cristiano Ronaldo,Athlete,Such an honour to be one of TIME's 100 most influential people. http://t.co/BCMj7q0V0u
459760164758097921,2014-04-25T18:25:39.000Z,155659213,@critiano,Cristiano Ronaldo,Athlete,Winner stays! http://t.co/qaf6ZH6Z0F @nikefootball #RiskEverything
460750585340231683,2014-04-28T12:01:14.000Z,155659213,@critiano,Cristiano Ronaldo,Athlete,Check out the gift I got from @TAGHeuer. This TAG Heuer Carrera really suits me! What do you think? http://t.co/zaKi6hlSzP
461457709879947264,2014-04-30T10:51:06.000Z,155659213,@critiano,Cristiano Ronaldo,Athlete,Living a dream - Lisbon here we go - thank you all for the amazing support #roadtoLisbon#HalaMadrid. http://t.co/iDWw1fJdtl
462282503919636481,2014-05-02T17:28:32.000Z,155659213,@critiano,Cristiano Ronaldo,Athlete,Go to http://t.co/TNKh5Ybdvy for your chance to win one of the 5 signed pairs of #CR7Underwear trunks. Good luck. http://t.co/IRkObPoMoK
462684823417782272,2014-05-03T20:07:12.000Z,155659213,@critiano,Cristiano Ronaldo,Athlete,O que é que eu e a Dona Inércia temos em comum? Descubram em http://t.co/O7HezUz2bq
462921243550040064,2014-05-04T11:46:39.000Z,155659213,@critiano,Cristiano Ronaldo,Athlete,Check out how @nikefootball revealed my new Flyknit Mercurial Superfly boots last week. http://t.co/rVxH0eXDt3 #riskeverything
463335392553361408,2014-05-05T15:12:20.000Z,155659213,@critiano,Cristiano Ronaldo,Athlete,A round of applause to International FC @IFC_FIVES for winning Round One of The GAME by Ronaldo. Congrats guys! http://t.co/agBwu49nED
463344448412614656,2014-05-05T15:48:19.000Z,155659213,@critiano,Cristiano Ronaldo,Athlete,"But stay tuned, because there's a lot more to come from @GAMEbyRonaldo You can join now at http://t.co/LSCjChaEww"
463688909260865538,2014-05-06T14:37:05.000Z,155659213,@critiano,Cristiano Ronaldo,Athlete,"I’m pleased to see I have so many followers on Sportlobster! Stay tuned, I’ll be following some fans. Will it be you? http://t.co/Eg4C2TJsxf"
463770977961115648,2014-05-06T20:03:12.000Z,155659213,@critiano,Cristiano Ronaldo,Athlete,Não imaginam a pergunta que a Dona Inércia me fez. Vejam em http://t.co/Ole5EkkrcS
464795545207582721,2014-05-09T15:54:28.000Z,155659213,@critiano,Cristiano Ronaldo,Athlete,There are only a few days left to win one of the 5 pairs of #CR7Underwear trunks signed by me! Go to http://t.co/Vlium6Y7de to enter!
464858238127964160,2014-05-09T20:03:35.000Z,155659213,@critiano,Cristiano Ronaldo,Athlete,Sabem o que quer dizer CR? Não é bem o que estão a pensar. A D. Inércia do BES diz-vos. http://t.co/EPrF7wRcp0
465041245468127232,2014-05-10T08:10:47.000Z,155659213,@critiano,Cristiano Ronaldo,Athlete,"I've been training with the best to take down aliens &amp; save the world. Stay tuned
 #GALAXY11 #GALAXYS5 @SamsungMobile http://t.co/mtJbofTqAo"
465133030768922624,2014-05-10T14:15:30.000Z,155659213,@critiano,Cristiano Ronaldo,Athlete,I am pleased to see 95% of fans have predicted a win on Sportlobster. Have you made yours yet? http://t.co/Eg4C2TJsxf
466543717336096768,2014-05-14T11:41:04.000Z,155659213,@critiano,Cristiano Ronaldo,Athlete,Morning training session @RealMadrid  http://t.co/d6NJfswlRT
466571814203031554,2014-05-14T13:32:43.000Z,155659213,@critiano,Cristiano Ronaldo,Athlete,"Hey, @Falcao, how crazy was training today? Have you ever gone against an 8-arm goalie before? http://t.co/GqKBymkaXx"
466629267062030338,2014-05-14T17:21:01.000Z,155659213,@critiano,Cristiano Ronaldo,Athlete,"Hey guys, have you checked out the different Fanzones on Sportlobster? Choose yours &amp; follow me http://t.co/Eg4C2TJsxf"
466954760206446592,2014-05-15T14:54:25.000Z,155659213,@critiano,Cristiano Ronaldo,Athlete,Know how it feels to be a winner!Pre-register at http://t.co/qvWsCbE1mp and qualify to win a Team Shirt signed by me. http://t.co/lM0IUhJAwf
467302798842150913,2014-05-16T13:57:23.000Z,155659213,@critiano,Cristiano Ronaldo,Athlete,Great day shooting Rankin x Ronaldo for #CR7Underwear with @rankinphoto. Can't wait to show you the new collection! http://t.co/f9z67i6CDW
467602411889360896,2014-05-17T09:47:57.000Z,155659213,@critiano,Cristiano Ronaldo,Athlete,Proud to be an ambassador for @sportlobster! Football is my lobster - #WhatsYourLobster? http://t.co/Eg4C2TJsxf http://t.co/i9lYACl80d
468058698968207361,2014-05-18T16:01:04.000Z,155659213,@critiano,Cristiano Ronaldo,Athlete,"Hi guys, @VivaRonaldo is giving away 2 shirts signed by me! Check http://t.co/UPqous7vfv for details. #APorLaDecima http://t.co/MjB6ygOeyR"
468390157021089792,2014-05-19T13:58:10.000Z,155659213,@critiano,Cristiano Ronaldo,Athlete,How fun it was to be part of this new commercial. Check out what happened behind the scenes. http://t.co/urSaitfD3X
468392813101846528,2014-05-19T14:08:43.000Z,155659213,@critiano,Cristiano Ronaldo,Athlete,"You asked: Hi Cristiano, I`m a big fan from Norway!  http://t.co/7AImrp67aW"
468393085471571969,2014-05-19T14:09:48.000Z,155659213,@critiano,Cristiano Ronaldo,Athlete,You asked: Can you say hello to me.My name is Elbasan. http://t.co/rjLrrZrRA6
468393223791312896,2014-05-19T14:10:21.000Z,155659213,@critiano,Cristiano Ronaldo,Athlete,"You asked: Hola Cristiano, puedes saludarme 'Hola Tito'? http://t.co/UyMAMFIcs6"
468393969127542784,2014-05-19T14:13:19.000Z,155659213,@critiano,Cristiano Ronaldo,Athlete,"You asked: Hi Cristiano! how are you? can you tell me ""Hello"" Sofia ? http://t.co/6mfqyXGhw4"
468394913617698816,2014-05-19T14:17:04.000Z,155659213,@critiano,Cristiano Ronaldo,Athlete,You asked: Hi Ronaldo! I love you so much! Please say hello to me! I am from Turkey!  http://t.co/xpDH5Ppb67
468395386391248896,2014-05-19T14:18:57.000Z,155659213,@critiano,Cristiano Ronaldo,Athlete,"You asked: ¡Hello Cristiano! Can you greet me.
Your great fan from Mexico. http://t.co/bfYAsVsnkw"
468485886632804352,2014-05-19T20:18:34.000Z,155659213,@critiano,Cristiano Ronaldo,Athlete,Brazil here we go! #ForçaPortugal http://t.co/obmHyrPSFq
468713132928806912,2014-05-20T11:21:33.000Z,155659213,@critiano,Cristiano Ronaldo,Athlete,Training for the final on Saturday! #APorLaDécima @realmadrid  http://t.co/Z72YgacX6A
468761284285333505,2014-05-20T14:32:54.000Z,155659213,@critiano,Cristiano Ronaldo,Athlete,Would u like to fly to the final in Brazil?Pre-register: http://t.co/qvWsCbE1mp &amp; qualify to win a signed Team Shirt. http://t.co/KM5VlsyeFP
469119837948895232,2014-05-21T14:17:39.000Z,155659213,@critiano,Cristiano Ronaldo,Athlete,Hey all @realmadrid fans! Come cheer us #APorLaDécima. Your support is our strenght.  http://t.co/qPVmohXb81
469454681572655105,2014-05-22T12:28:12.000Z,155659213,@critiano,Cristiano Ronaldo,Athlete,Saturday we’ll play #APorLaDécima. Cheer for the team and predict the result on Sportlobster http://t.co/4aMqGX2y84
469571714972913664,2014-05-22T20:13:15.000Z,155659213,@critiano,Cristiano Ronaldo,Athlete,Acabei de fazer as minhas previsões para o R. Madrid vs. A. Madrid no #VivaRonaldo. E tu? @VivaRonaldo http://t.co/ZQmCmauqWF
469798491741761536,2014-05-23T11:14:23.000Z,155659213,@critiano,Cristiano Ronaldo,Athlete,"In the biggest game against our closest rivals, there is only one option. #riskeverything http://t.co/yi5EdBw7bd"
469809225678741504,2014-05-23T11:57:02.000Z,155659213,@critiano,Cristiano Ronaldo,Athlete,"Tomorrow will be a dream come true to play the final in Portugal, my welcoming country. http://t.co/kyfsGYcWG3 http://t.co/AG4Pymxsjz"
469937463562350592,2014-05-23T20:26:36.000Z,155659213,@critiano,Cristiano Ronaldo,Athlete,Let's go team #APorLaDécima!  http://t.co/vkRzCNCFbp
470339597147570177,2014-05-24T23:04:33.000Z,155659213,@critiano,Cristiano Ronaldo,Athlete,La Décima is ours. Hala Madrid! #uclfinal #realmadrid #lisbon http://t.co/q0NPEFAJCD
470850055873003520,2014-05-26T08:52:55.000Z,155659213,@critiano,Cristiano Ronaldo,Athlete,We’re Champions of Europe! I’m living a dream! Thank you all! #halamadrid #UCLfinal #lisbon http://t.co/fJxbG49ET3 http://t.co/pw3qx8QX8P
471286625889431552,2014-05-27T13:47:42.000Z,155659213,@critiano,Cristiano Ronaldo,Athlete,"Play soon for an exclusive trip + seats FINAL Rio, Brazil!  Follow @TopWinGames &amp; register for a signed Team Shirt. http://t.co/dHLdBiUjLv"
471301199288107009,2014-05-27T14:45:36.000Z,155659213,@critiano,Cristiano Ronaldo,Athlete,Thanks for the support @WayneRooney. Crazy days these last ones!
471662554654461952,2014-05-28T14:41:30.000Z,155659213,@critiano,Cristiano Ronaldo,Athlete,Taking a break to play the new #GALAXY11 Striker Soccer game. Who's got next? http://t.co/RyoDChFzIA http://t.co/3InIC2Amsv
471739606845898752,2014-05-28T19:47:41.000Z,155659213,@critiano,Cristiano Ronaldo,Athlete,Relaxing time. http://t.co/raVxPbnQoV
471758168050401280,2014-05-28T21:01:26.000Z,155659213,@critiano,Cristiano Ronaldo,Athlete,"Next week the National Team will be in the USA preparing the World Cup!First up, Mexico at Gillette Stadium, June 6th.Come support Portugal!"
471940088646348800,2014-05-29T09:04:20.000Z,155659213,@critiano,Cristiano Ronaldo,Athlete,"Behind the scenes of the @TAGHeuer Shooting, guess which model I chose? http://t.co/CxGiE8uqqt"
472058454094647296,2014-05-29T16:54:40.000Z,155659213,@critiano,Cristiano Ronaldo,Athlete,"Today, the Sun publishes an interview with me that I never gave. So its content is pure fiction."
472097881558896640,2014-05-29T19:31:20.000Z,155659213,@critiano,Cristiano Ronaldo,Athlete,"Here is the official song of the Portuguese National Team for the World Cup, performed by Kika. So uplifting! https://t.co/dd8pgpY1uB"
472336575364612096,2014-05-30T11:19:49.000Z,155659213,@critiano,Cristiano Ronaldo,Athlete,Download the official song of the Portuguese National Team by @Kikamusicnet produced by @RedOne_Official http://t.co/PWgN0Oe9zq
472372040578924545,2014-05-30T13:40:45.000Z,155659213,@critiano,Cristiano Ronaldo,Athlete,"On June 3rd, play for an exclusive trip to Brazil: win top seats for the Final and much more. http://t.co/JEIdecR34r http://t.co/uvXJMMgWxi"
472391706907009024,2014-05-30T14:58:54.000Z,155659213,@critiano,Cristiano Ronaldo,Athlete,"You asked: Olá, poderia mandar um abraço para uma grande fã do Brasil? :) http://t.co/swyeKUBQEV"
472391970397376512,2014-05-30T14:59:57.000Z,155659213,@critiano,Cristiano Ronaldo,Athlete,"You asked: Hola idolo, como estas? Puedes saludarme? Me llamo Mayra y te apoyo desde Argentina idolo! http://t.co/d8n3uIdcvp"
472392133911904257,2014-05-30T15:00:36.000Z,155659213,@critiano,Cristiano Ronaldo,Athlete,"You asked: Can you say hello to me?? 
My name is Maria :)  http://t.co/ysDCHUnsHE"
472392918171660288,2014-05-30T15:03:42.000Z,155659213,@critiano,Cristiano Ronaldo,Athlete,You asked: Can you say hello to me?  My name is Narin and I am from Germany http://t.co/lx2CRb3xwh
472393165211992064,2014-05-30T15:04:41.000Z,155659213,@critiano,Cristiano Ronaldo,Athlete,"You asked: Say hello to me and my cousin Nicholas, we are huge friends! My name is Brianne :)  http://t.co/JRFEIHBbi0"
472393432334598144,2014-05-30T15:05:45.000Z,155659213,@critiano,Cristiano Ronaldo,Athlete,"You asked: Can you say ""Ciao Chiara""?I'm italian :)  http://t.co/tFIb5fDaLq"
472393853962829824,2014-05-30T15:07:26.000Z,155659213,@critiano,Cristiano Ronaldo,Athlete,"You asked: Hola Cris, saludos desde Ecuador, éxitos en el mundial, eres el mejor. http://t.co/T9aqKhOxBo"
472427746338299904,2014-05-30T17:22:06.000Z,155659213,@critiano,Cristiano Ronaldo,Athlete,"Very soon @Sportlobster will reach a million users. To celebrate I will follow the millionth user, will it be you? http://t.co/Eg4C2TJsxf"
473037864616599552,2014-06-01T09:46:30.000Z,155659213,@critiano,Cristiano Ronaldo,Athlete,"Were you one of the winners of my #CR7underwear competition? Check out!
http://t.co/iETJySmqKa"
473061196573474816,2014-06-01T11:19:12.000Z,155659213,@critiano,Cristiano Ronaldo,Athlete,"Hey guys, check out the new cool wallpapers on my website. http://t.co/MGroCC4ZQO "
473124692103274496,2014-06-01T15:31:31.000Z,155659213,@critiano,Cristiano Ronaldo,Athlete,You've never seen me play like this! http://t.co/TI0lNisaBw @nikefootball #riskeverything
473187313263329280,2014-06-01T19:40:21.000Z,155659213,@critiano,Cristiano Ronaldo,Athlete,Happy to spend Children's Day with my son. http://t.co/jFVpmFWaZO
473464275034722304,2014-06-02T14:00:54.000Z,155659213,@critiano,Cristiano Ronaldo,Athlete,"Leaving Portugal to prepare for the WorldCup Brazil. With open arms to the world, go Portugal! http://t.co/e7lR3eCDzX http://t.co/5AOWhIIizp"
473482810519715840,2014-06-02T15:14:33.000Z,155659213,@critiano,Cristiano Ronaldo,Athlete,A team representing a country! #ForçaPortugal http://t.co/a8ywntsZwm
473855476019777536,2014-06-03T15:55:23.000Z,155659213,@critiano,Cristiano Ronaldo,Athlete,Today Brazil game starts! You’ll be surprised on http://t.co/qvWsCbE1mp. All-inclusive trip to the Final. Go play it! http://t.co/RrFOjg8VBt
473885182249160705,2014-06-03T17:53:26.000Z,155659213,@critiano,Cristiano Ronaldo,Athlete,Congrats to @IFC_FIVES from London for winning Round One of @GAMEbyRonaldo!It was great meeting all of you in #Lisbon http://t.co/Omj7yY2K88
473885518053507073,2014-06-03T17:54:46.000Z,155659213,@critiano,Cristiano Ronaldo,Athlete,It was a pleasure to invite you to the game.All the best @IFC_FIVES and hope to see you for Round Two @GAMEbyRonaldo http://t.co/f8kJbjsDEA
473885629047394304,2014-06-03T17:55:12.000Z,155659213,@critiano,Cristiano Ronaldo,Athlete,"Round Two is on. If you’re a football player, sign up your team now on http://t.co/LSCjChaEww"
473886543640551424,2014-06-03T17:58:51.000Z,155659213,@critiano,Cristiano Ronaldo,Athlete,RT @KingOfFive: @Cristiano @IFC_FIVES @ThecatPaul thanks for meeting us on Saturday your a great guy it was a special moment for us http://…
473888551755845633,2014-06-03T18:06:49.000Z,155659213,@critiano,Cristiano Ronaldo,Athlete,"RT @IFC_FIVES: THE CHEIF SCOUT SHOWING OFF HIS SILVERWARE
#AllHailDaCheifScout http://t.co/9wEn1egy9o"
474215851022110720,2014-06-04T15:47:24.000Z,155659213,@critiano,Cristiano Ronaldo,Athlete,I'm driven to perfection. Are you? Show how by posting a 15s video or pic tagged #CR7DrivenToPerfection. Learn more http://t.co/csJmFznT9Z
474519786597412864,2014-06-05T11:55:07.000Z,155659213,@critiano,Cristiano Ronaldo,Athlete,"Check out the blog I wrote on Sportlobster, a personal message to my fans ahead of Brazil. Hope you like it! http://t.co/PlQgFRjaMj"
474602826677911552,2014-06-05T17:25:06.000Z,155659213,@critiano,Cristiano Ronaldo,Athlete,Come support Portugal against Mexico tomorrow at Gillette Stadium #ForçaPortugal
474917525864861696,2014-06-06T14:15:36.000Z,155659213,@critiano,Cristiano Ronaldo,Athlete,The world is waiting.  I’m ready for 'The Last Game’ June 9th! @nikefootball #riskeverything http://t.co/wrgm8gYBsx
475074652843556864,2014-06-07T00:39:58.000Z,155659213,@critiano,Cristiano Ronaldo,Athlete,Força Portugal! http://t.co/yUJUpuQbv9
475656397624184832,2014-06-08T15:11:37.000Z,155659213,@critiano,Cristiano Ronaldo,Athlete,Do you want to see me singing with Anselmo Ralph? Check out http://t.co/E7NWTTYgOZ
476033489029304320,2014-06-09T16:10:02.000Z,155659213,@critiano,Cristiano Ronaldo,Athlete,Risk makes the game beautiful. http://t.co/WnJfvhjwIM @nikefootball #riskeverything
476744996184674305,2014-06-11T15:17:19.000Z,155659213,@critiano,Cristiano Ronaldo,Athlete,"Hello guys, we arrived in Brazil. Any fans from Brazil over here? http://t.co/q7UUO2Vk5f"
476755584671571968,2014-06-11T15:59:23.000Z,155659213,@critiano,Cristiano Ronaldo,Athlete,Obrigado @LukinhasMendes7
476756277037891584,2014-06-11T16:02:08.000Z,155659213,@critiano,Cristiano Ronaldo,Athlete,Obrigado @CRonaldoFever pelo vosso apoio.
476758468586926080,2014-06-11T16:10:51.000Z,155659213,@critiano,Cristiano Ronaldo,Athlete,Muchas gracias a todos @CR7StrongChile
476759551367462913,2014-06-11T16:15:09.000Z,155659213,@critiano,Cristiano Ronaldo,Athlete,@CRonaldoNews muito obrigado e #ForçaPortugal
476762377372065792,2014-06-11T16:26:23.000Z,155659213,@critiano,Cristiano Ronaldo,Athlete,#ForçaPortugal. E obrigado @7cristianorb
476770924587667456,2014-06-11T17:00:21.000Z,155659213,@critiano,Cristiano Ronaldo,Athlete,I’m in Brazil. Want to come here and see the Final? Qualify for 4 signed team shirts here http://t.co/QcRcJwRgGt http://t.co/HZS2KjtG4P
477052670197653504,2014-06-12T11:39:54.000Z,155659213,@critiano,Cristiano Ronaldo,Athlete,"Insane first half against the aliens! @Falcao, we'll show them how we play football! #GALAXY11 http://t.co/z0FzRHz6gG http://t.co/pGJ4F1AcO0"
477119130626433024,2014-06-12T16:03:59.000Z,155659213,@critiano,Cristiano Ronaldo,Athlete,"With my brothers @SRod7 y @euro , big things this year, ""Don't €xpect Nothing"". http://t.co/VT5piu27jc"
477128869968113664,2014-06-12T16:42:41.000Z,155659213,@critiano,Cristiano Ronaldo,Athlete,"RT @CRonaldoNews: Brazil loves Portugal! @VivaRonaldo http://t.co/iS1UpUNIcp
[@edmacieldesa]"
477129505489059840,2014-06-12T16:45:13.000Z,155659213,@critiano,Cristiano Ronaldo,Athlete,RT @PaulaLitaiff_: @Cristiano Sejam bem-vindos! Espero que gostem daqui! E boa sorte nos jogos! Estou torcendo muito por vocês! #ForçaPortu…
477136937292398593,2014-06-12T17:14:45.000Z,155659213,@critiano,Cristiano Ronaldo,Athlete,What a wonderful and warming reception we´re having in Campinas. Thank you everyone #forçaportugal http://t.co/QsUcMga4VZ
477415523878465536,2014-06-13T11:41:45.000Z,155659213,@critiano,Cristiano Ronaldo,Athlete,What a great first training session and day yesterday.  http://t.co/3HmGPTfzXb
477475385488457728,2014-06-13T15:39:37.000Z,155659213,@critiano,Cristiano Ronaldo,Athlete,RT @nikefootball: The #Mercurial Superfly designed by @Cristiano for his biggest fan @7cristianorb. Get yours: http://t.co/YO65Aym1gr http:…
477513352647028736,2014-06-13T18:10:29.000Z,155659213,@critiano,Cristiano Ronaldo,Athlete,Met brave #NYC kids who survived Superstorm Sandy and are helping other communities with the help of @SavetheChildren http://t.co/ROkDO7Y5nE
477863158875717632,2014-06-14T17:20:30.000Z,155659213,@critiano,Cristiano Ronaldo,Athlete,Check out what happened behind the scenes of my BESA campaign with Anselmo Ralph. https://t.co/JKI99BNMW1
478166980424630272,2014-06-15T13:27:46.000Z,155659213,@critiano,Cristiano Ronaldo,Athlete,Go get the 2 all-in tickets to the Final in Brazil!  http://t.co/QcRcJwRgGt http://t.co/McvEky8Bgz
478502678704971776,2014-06-16T11:41:43.000Z,155659213,@critiano,Cristiano Ronaldo,Athlete,"Hoje, quando a nossa epopeia finalmente começar, seremos muito mais do que 10 milhões... http://t.co/CxNgIG0a7a http://t.co/1AvvlOyYgv"
480025850608640000,2014-06-20T16:34:15.000Z,155659213,@critiano,Cristiano Ronaldo,Athlete,Help me and @FALCAO show those aliens who's boss! You could win big! #GALAXY11 http://t.co/o4yC9WUEO1
480069391602974721,2014-06-20T19:27:16.000Z,155659213,@critiano,Cristiano Ronaldo,Athlete,Listening to this song before the game in space... I'm going to fly on the field! #GALAXY11 http://t.co/asROcP0FFg
480424811538432001,2014-06-21T18:59:35.000Z,155659213,@critiano,Cristiano Ronaldo,Athlete,Already in Manaus. #forçaportugal #nationalteam #worldcup http://t.co/wawZ7T0arK
481880065492652032,2014-06-25T19:22:15.000Z,155659213,@critiano,Cristiano Ronaldo,Athlete,"Congratulations Fazil Tarriche.You won 2 tickets to the Final, Brazil!Be the next, last chance http://t.co/sJfQpcsnOA http://t.co/u1g6YwUbB5"
483601215230840832,2014-06-30T13:21:29.000Z,155659213,@critiano,Cristiano Ronaldo,Athlete,You asked: Can you send me a picture on you when you playing football in CF Androinha? http://t.co/akciAWNuHz
483601629007314944,2014-06-30T13:23:07.000Z,155659213,@critiano,Cristiano Ronaldo,Athlete,"You asked: Besides football, which other hobbies do you enjoy? http://t.co/UNv6q3NRv9"
483602033208229889,2014-06-30T13:24:44.000Z,155659213,@critiano,Cristiano Ronaldo,Athlete,You asked: Hello Cristiano. I'm your big fan from Russia. How are you? http://t.co/5PbV6ZcRyi
483602719190822912,2014-06-30T13:27:27.000Z,155659213,@critiano,Cristiano Ronaldo,Athlete,You asked: Can you say Hi? I'm your fan #1. I dream of seeing you again someday. Greetings from Paraguay http://t.co/abEu45BUdB
483603660727787520,2014-06-30T13:31:12.000Z,155659213,@critiano,Cristiano Ronaldo,Athlete,"You asked: Hi crisitiano, im a huge fan from canada, can you say Hi please?xxxxxxxx http://t.co/mCXinzRtWX"
483603968413941761,2014-06-30T13:32:25.000Z,155659213,@critiano,Cristiano Ronaldo,Athlete,"You asked: Hi, i'm your fan #1 in Paris, can you say me hello?  http://t.co/fjgpOVPTcL"
483604341144977408,2014-06-30T13:33:54.000Z,155659213,@critiano,Cristiano Ronaldo,Athlete,"You asked: Hi Cristiano,I'm from Italy,can you say'ciao Federica' please?💕 http://t.co/qmcRbmbjFV"
483605302873694209,2014-06-30T13:37:43.000Z,155659213,@critiano,Cristiano Ronaldo,Athlete,You asked: A hello to peru please? http://t.co/pSWhsNVovQ
483606686595555328,2014-06-30T13:43:13.000Z,155659213,@critiano,Cristiano Ronaldo,Athlete,"You asked: Hi Cristiano! I'm from Portugal. Can you say ""Hi Mariana"" to me?  http://t.co/rUTQdB9ydw"
483606983355170818,2014-06-30T13:44:24.000Z,155659213,@critiano,Cristiano Ronaldo,Athlete,"You asked: Hi, i'm your fan #1 in egypt , can you say me hello ? http://t.co/RxyyOUIxvx"
483607707652734978,2014-06-30T13:47:17.000Z,155659213,@critiano,Cristiano Ronaldo,Athlete,You asked: Please say 'Hello Jordannah' I'm from Wales and you're my idol :) http://t.co/511ZWDq5Np
483608081944031232,2014-06-30T13:48:46.000Z,155659213,@critiano,Cristiano Ronaldo,Athlete,"You asked: Your my idol, say ""hello Ciaran"" I'm from Ireland :) http://t.co/8se0EwgBzm"
483608590025232387,2014-06-30T13:50:47.000Z,155659213,@critiano,Cristiano Ronaldo,Athlete,"You asked: Por favor Cristiano me podrías decir ""hola Macarena"" me haría muy feliz.  http://t.co/KcttYB5E7W"
483608969634930688,2014-06-30T13:52:18.000Z,155659213,@critiano,Cristiano Ronaldo,Athlete,You asked: Please say 'Hello Ben' You are my favourite player of all time! http://t.co/AV0FZyXSBn
483642639636791296,2014-06-30T16:06:05.000Z,155659213,@critiano,Cristiano Ronaldo,Athlete,First winner Fazil Terriche will fly to Rio! You can be the next! Last chance! http://t.co/u6Nt0apHMv http://t.co/2Yuq1ThuE5
484362547429408768,2014-07-02T15:46:44.000Z,155659213,@critiano,Cristiano Ronaldo,Athlete,The second Topwinner who will fly to the Final in Rio is Anna Marcus. More games &amp; prizes: http://t.co/5GyKd3CIa1 http://t.co/7yFTfNqkzo
484681107536097280,2014-07-03T12:52:35.000Z,155659213,@critiano,Cristiano Ronaldo,Athlete,Starting the holidays playing with the sun in this landscape. Thank you for the support during all season. http://t.co/0BnVLx9o4Z
484743799319851008,2014-07-03T17:01:42.000Z,155659213,@critiano,Cristiano Ronaldo,Athlete,"My favorite #CR7DriventoPerfection video.Don't ever lose your drive @david_alexi,you never know where it'll take you http://t.co/sccLlTJcTj"
485060941554663424,2014-07-04T14:01:55.000Z,155659213,@critiano,Cristiano Ronaldo,Athlete,Happy to meet Dsquared brothers yesterday. http://t.co/P4LHFIvlIK http://t.co/K1JbACiXbK
