928623239110082560,2017-11-09T14:00:07.000Z,15506669,@JeffBezos,Jeff Bezos,Business Man,"Thank you to the 17,500 veterans and military spouses now working at Amazon. We set a goal last year to hire 25,000 of these leaders by 2021, and are on track to hire even more. #VeteransDay https://t.co/1tIiSZrRtQ"
929139251152699392,2017-11-11T00:10:34.000Z,15506669,@JeffBezos,Jeff Bezos,Business Man,"Thank you and your boys for your service, Casey! https://t.co/1OhL3D4ijJ"
930134795304148992,2017-11-13T18:06:30.000Z,15506669,@JeffBezos,Jeff Bezos,Business Man,Amazon Prime heads to Middle Earth. https://t.co/QowUmf8t3S https://t.co/YVciEX3u2t
932270037657726976,2017-11-19T15:31:12.000Z,15506669,@JeffBezos,Jeff Bezos,Business Man,"Ten years ago today, we launched the first-ever Kindle. Happy 10th birthday @AmazonKindle and thank you to all the Kindle readers and authors! https://t.co/qelfniBSK1"
936360685788733440,2017-11-30T22:25:58.000Z,15506669,@JeffBezos,Jeff Bezos,Business Man,"Of all the news coming out of AWS #reInvent this week, I hope you didn’t miss this one. Set a Guinness World Record for largest chicken wing eating competition! Nice! https://t.co/uSfmLOKTU0"
940792988095139841,2017-12-13T03:58:22.000Z,15506669,@JeffBezos,Jeff Bezos,Business Man,#NewShepard had a successful first flight of Crew Capsule 2.0 today. Complete with windows and our instrumented test dummy. He had a great ride. @BlueOrigin https://t.co/PZHXWXjuw9
941465587049406464,2017-12-15T00:31:02.000Z,15506669,@JeffBezos,Jeff Bezos,Business Man,"Full video of Mannequin Skywalker’s ride to space. Unlike him, you’ll be able to get out of your seat during the zero gee part of the flight. And ignore the pinging sound – it’s just from one of the experiments on this flight. #NewShepard @blueorigin https://t.co/dJ5VEeaWb6 https://t.co/qGQC1vfW7D"
941467037905272833,2017-12-15T00:36:48.000Z,15506669,@JeffBezos,Jeff Bezos,Business Man,First use of our landing pad bot #Blue2D2. @blueorigin https://t.co/Ht2P7yVwEs
946109222135128064,2017-12-27T20:03:11.000Z,15506669,@JeffBezos,Jeff Bezos,Business Man,Turns out our Amazon fulfillment center associates in Madrid can dance… And one got a big surprise at the end! Love it! https://t.co/7MufxruSXe
950156231414394881,2018-01-08T00:04:33.000Z,15506669,@JeffBezos,Jeff Bezos,Business Man,"Wishing best of luck tonight to THE MARVELOUS MRS MAISEL, Rachel Brosnahan, Kevin Bacon, and to the whole cast and crew of THE POST too! #GoldenGlobes https://t.co/UIJriZzmN6"
959796196247142400,2018-02-03T14:30:19.000Z,15506669,@JeffBezos,Jeff Bezos,Business Man,The stunning Perito Moreno Glacier in Patagonia. We’ve sent robotic probes to every planet in this solar system. Earth is BY FAR the best one. We go to space to save the Earth. @BlueOrigin #NoPlanB #GradatimFerociter https://t.co/8esV18orcJ
960521086298238976,2018-02-05T14:30:47.000Z,15506669,@JeffBezos,Jeff Bezos,Business Man,"Best of luck @SpaceX with the Falcon Heavy launch tomorrow – hoping for a beautiful, nominal flight! @BlueOrigin #GradatimFerociter"
961033484536971264,2018-02-07T00:26:52.000Z,15506669,@JeffBezos,Jeff Bezos,Business Man,@elonmusk @SpaceX @blueorigin Woohoo! 🚀🚀🚀
965957024109379602,2018-02-20T14:31:15.000Z,15506669,@JeffBezos,Jeff Bezos,Business Man,"Installation has begun—500 ft tall, all mechanical, powered by day/night thermal cycles, synchronized at solar noon, a symbol for long-term thinking—the #10000YearClock is coming together thx to the genius of Danny Hillis, Zander Rose &amp; the whole Clock team! Enjoy the video. https://t.co/FYIyaUIbdJ"
966312919079112705,2018-02-21T14:05:27.000Z,15506669,@JeffBezos,Jeff Bezos,Business Man,Happy to announce that Amazon Studios is adapting Iain M. Banks’ amazing Culture series — a huge personal favorite — as a TV series. Can’t wait! https://t.co/wgEmv65Pm3 https://t.co/NhCGUyRt2L
972561435036344320,2018-03-10T19:54:50.000Z,15506669,@JeffBezos,Jeff Bezos,Business Man,Kirk or Picard? Picard! #FinalFrontier #GoBoldly https://t.co/mEohTVuKIs
973696994332983299,2018-03-13T23:07:08.000Z,15506669,@JeffBezos,Jeff Bezos,Business Man,"New test video of Blue’s 550K lbf thrust, ox-rich staged combustion, LNG-fueled BE-4 engine. The test is a mixture ratio sweep at 65% power level and 114 seconds in duration. Methane (or LNG) has proved to be an outstanding fuel choice. @BlueOrigin #GradatimFerociter https://t.co/zWV0jWXIvx"
974344409377460224,2018-03-15T17:59:44.000Z,15506669,@JeffBezos,Jeff Bezos,Business Man,Thank you to the @NatReconOfc for having me over to speak. You don’t want to even imagine the world without these professionals doing the job they do. https://t.co/f3cHWbKwjq
975847153468768256,2018-03-19T21:31:06.000Z,15506669,@JeffBezos,Jeff Bezos,Business Man,Taking my new dog for a walk at the #MARS2018 conference. #BostonDynamics https://t.co/vE6CXrvV3o
981311629022314496,2018-04-03T23:24:58.000Z,15506669,@JeffBezos,Jeff Bezos,Business Man,Horrible and truly tragic day for YouTube and Google. We are wishing all our very best for the injured and all those affected.
985300754134007809,2018-04-14T23:36:20.000Z,15506669,@JeffBezos,Jeff Bezos,Business Man,I made pancakes on this rainy Seattle morning for @ciara and @DangeRussWilson. These guys are as fun as they are talented. Inspiring too. And Russ and I ate our weight in pancakes! #funfriends https://t.co/MWST7oXbVs
985664806567927808,2018-04-15T23:42:57.000Z,15506669,@JeffBezos,Jeff Bezos,Business Man,Very comfortable on my kids’ giant panda doing email and putting final touches on this year’s annual shareholder letter. About to take the kids to see Rampage... https://t.co/OrmMpV4VGj
985682558405885952,2018-04-16T00:53:29.000Z,15506669,@JeffBezos,Jeff Bezos,Business Man,I love Dwayne Johnson @TheRock. Still working on my smolder https://t.co/8GmuZIyFwK https://t.co/WyckQV6rrY
986016459351515136,2018-04-16T23:00:17.000Z,15506669,@JeffBezos,Jeff Bezos,Business Man,"Great reporting requires patience, grit and a willingness to follow a story wherever it leads, whether Alabama or Moscow. Proud of @washingtonpost #Pulitzer winners! And big congrats to the @nytimes, as well! #DemocracyDiesInDarkness https://t.co/MBMWhh1cQR"
986547483743436801,2018-04-18T10:10:23.000Z,15506669,@JeffBezos,Jeff Bezos,Business Man,"At @BestBuy catching up with CEO Hubert Joly and announcing our collaboration on the next generation of smart TVs. Couldn’t ask for a better partner, and the product is killer. Full Alexa integration: “Alexa, watch ABC” or “Alexa, watch Westworld.” #FireTVEdition https://t.co/Dsq8VBOSA7"
987494749559926784,2018-04-21T00:54:29.000Z,15506669,@JeffBezos,Jeff Bezos,Business Man,Honored to speak at @TheBushCenter Forum on Leadership tonight with Ken Hersh. The spirit of former First Lady Barbara Bush was very much felt at the event. https://t.co/E4TJR9KKs9
988154007813173248,2018-04-22T20:34:09.000Z,15506669,@JeffBezos,Jeff Bezos,Business Man,"Dog sledding above the Arctic Circle in Norway. Jim Lovell says it’s not that you go to heaven when you die, but “you go to heaven when you’re born.” Earth is the best planet in our solar system. We go to space to save the Earth. @BlueOrigin #NoPlanB #GradatimFerociter #EarthDay https://t.co/q0Y9A4KSLm"
989851170545029120,2018-04-27T12:58:04.000Z,15506669,@JeffBezos,Jeff Bezos,Business Man,"Launch preparations are underway for New Shepard’s 8th test flight, as we continue our progress toward human spaceflight. Currently targeting Sunday 4/29 with launch window opening up at 830am CDT. Livestream info to come. @BlueOrigin #GradatimFerociter https://t.co/zAYpAGWB8C"
990663519900184577,2018-04-29T18:46:03.000Z,15506669,@JeffBezos,Jeff Bezos,Business Man,"Apogee of 351,000 feet (66 miles, 107 kilometers), and that’s the altitude we’ve been targeting for operations. One step closer. #GradatimFerociter @BlueOrigin"
990692677963284480,2018-04-29T20:41:55.000Z,15506669,@JeffBezos,Jeff Bezos,Business Man,The lucky boots worked again. Huge kudos and thanks to the entire @BlueOrigin team. #GradatimFerociter https://t.co/P9cUqRNbYv
990755397542723584,2018-04-30T00:51:08.000Z,15506669,@JeffBezos,Jeff Bezos,Business Man,Highlights from today’s mission. Don’t miss the Nerf ball doing a few backflips in zero gravity. #GradatimFerociter @BlueOrigin https://t.co/YxlJRt0MXc
991799694664679425,2018-05-02T22:00:48.000Z,15506669,@JeffBezos,Jeff Bezos,Business Man,😀 @ConanOBrien @BlueOrigin https://t.co/x3BiCpaLQA
992765968182001665,2018-05-05T14:00:26.000Z,15506669,@JeffBezos,Jeff Bezos,Business Man,"Love this quote. It’s been on my fridge for years, and I see it every time I open the door. #Emerson https://t.co/kN8HjM4bOI"
995680729106341888,2018-05-13T15:02:39.000Z,15506669,@JeffBezos,Jeff Bezos,Business Man,"You shaped us, you protected us, you let us fall, you picked us up, and you LOVED us, always and unconditionally. Thank you for everything. I love you, Mom. https://t.co/Z8YGMO55C9"
996609529323245568,2018-05-16T04:33:22.000Z,15506669,@JeffBezos,Jeff Bezos,Business Man,Tom Wolfe was an amazing journalist and author. Thank you for showing us all what it took to have “The Right Stuff”. https://t.co/ObMeU4S92S
1001187602622439427,2018-05-28T19:45:00.000Z,15506669,@JeffBezos,Jeff Bezos,Business Man,I’m enjoying this day with my kids but also remembering. Remembering the many sons and daughters who have given up their lives for us and for our sons and daughters. #MemorialDay #HireVets #HireMilitarySpouses https://t.co/mdSr0Ylapx
1007077455146860544,2018-06-14T01:49:10.000Z,15506669,@JeffBezos,Jeff Bezos,Business Man,https://t.co/phDTXHElBp
1008348645605797890,2018-06-17T14:00:25.000Z,15506669,@JeffBezos,Jeff Bezos,Business Man,"My dad came here from Cuba all by himself without speaking English when he was 16 years old, and has been kicking ass ever since. Thank you for all the love and heart, Dad! https://t.co/nuavG0yEtM"
1013467826999267328,2018-07-01T17:02:13.000Z,15506669,@JeffBezos,Jeff Bezos,Business Man,Wishing @SpecialOlympics tennis competitor (and Amazonian!) Leonard Flowers luck in the @2018USAGames this week! Great event and we’re proud to be a presenting sponsor. #ChooseToInclude https://t.co/kx6igcmb6e
1019641106533937152,2018-07-18T17:52:38.000Z,15506669,@JeffBezos,Jeff Bezos,Business Man,Crew Capsule looks great even after it was pushed hard by the escape test. Astronauts would have had an exhilarating ride and safe landing. Great engineering and the lucky boots worked again @BlueOrigin #GradatimFerociter https://t.co/ireJ3rWEvs
1019737114093629441,2018-07-19T00:14:08.000Z,15506669,@JeffBezos,Jeff Bezos,Business Man,"Appreciate the support, Mr. Vice President. I’m thrilled to report from West Texas that the team nailed it today #launchlandrepeat https://t.co/yiIB7zTtde"
1019742477018730496,2018-07-19T00:35:27.000Z,15506669,@JeffBezos,Jeff Bezos,Business Man,Super proud of the entire Blue Team who came together and made it happen #nevergetsold #gradatimferociter https://t.co/f6e2pdnwGn
1040253796293795842,2018-09-13T15:00:06.000Z,15506669,@JeffBezos,Jeff Bezos,Business Man,https://t.co/2GlgjztK1u
1042108453295013888,2018-09-18T17:49:51.000Z,15506669,@JeffBezos,Jeff Bezos,Business Man,"Incredible work from the whole @MaiselTV team for 8 #Emmys wins, including Outstanding Comedy Series. Woohoo! https://t.co/mfAwDkVX6s"
1045423889856192512,2018-09-27T21:24:13.000Z,15506669,@JeffBezos,Jeff Bezos,Business Man,Big win for @BlueOrigin today! And a big thank you to @ulalaunch for choosing our BE-4 engine. Excited to be a part of Vulcan’s mission to space. #21stCenturyEngine #AllAmericanEngine #GradatimFerociter https://t.co/K0Szt3jesi
1047152109508997121,2018-10-02T15:51:32.000Z,15506669,@JeffBezos,Jeff Bezos,Business Man,"Thank you @SenSanders. We’re excited about this, and also hope others will join in. https://t.co/kasWkkOhWo"
1050136574090825728,2018-10-10T21:30:44.000Z,15506669,@JeffBezos,Jeff Bezos,Business Man,"Thank you to the @usairforce for your confidence in the @BlueOrigin team and our #NewGlenn rocket. We are proud to serve the national security space community and are committed to providing safe, reliable access to space for the nation. #GradatimFerociter https://t.co/AeO3xXhnUi"
1051983010722013184,2018-10-15T23:47:49.000Z,15506669,@JeffBezos,Jeff Bezos,Business Man,Very sad to hear of Paul Allen’s passing. His passion for invention and pushing forward inspired so many. He was relentless to the end. My heart goes out to Paul’s family and friends.
1054739581533188096,2018-10-23T14:21:27.000Z,15506669,@JeffBezos,Jeff Bezos,Business Man,Amazon just won The American Foundation for the Blind’s Helen Keller award! Huge kudos to the whole team on working so hard to make our products accessible to the vision impaired! @afb1921 https://t.co/qh6HkQkekB
1058012110947373057,2018-11-01T15:05:18.000Z,15506669,@JeffBezos,Jeff Bezos,Business Man,"Yep, that’s me. I was lucky to be exposed to tech and coding at a young age. Inspired a lifelong love of invention. I hope the new Amazon Future Engineer program does the same for some kids today. https://t.co/xNUdyVMOnb https://t.co/RPZEiIHSap"
1062120332251684864,2018-11-12T23:09:55.000Z,15506669,@JeffBezos,Jeff Bezos,Business Man,"Had the privilege today of unveiling our newest Amazon Air 767 - ""Valor"" - named in honor of the thousands of Amazonian veterans and military spouses delivering for our customers every day. #VeteransDay #AmazonWarriors https://t.co/bKHDQgb1TN"
1064882081249951744,2018-11-20T14:04:07.000Z,15506669,@JeffBezos,Jeff Bezos,Business Man,Excited to announce the first annual grants from the Bezos Day 1 Families Fund. $97.5 million to 24 organizations doing needle-moving work on family homelessness. Congrats to the recipients – we know you’ll spend the money wisely and with heart. https://t.co/aF4Src09zC https://t.co/MMCil3l2cw
1080261240423964672,2019-01-02T00:35:24.000Z,15506669,@JeffBezos,Jeff Bezos,Business Man,"I have outstanding news to ring in 2019. Former Alexa VP &amp; long-time Amazonian Mike George has agreed to lead the Day 1 Academies Fund. Mike is a true builder who knows how to start from scratch, and he’ll bring tremendous energy, grit, and passion to the job. Thank you, Mike! https://t.co/K01N1NZ8ag"
1083004911380393985,2019-01-09T14:17:46.000Z,15506669,@JeffBezos,Jeff Bezos,Business Man,https://t.co/Gb10BDb0x0
1092255287472320512,2019-02-04T02:55:28.000Z,15506669,@JeffBezos,Jeff Bezos,Business Man,"Grateful for the journalists at the @washingtonpost and around the world who do the work, no matter the risk or dangers they face.
#democracydiesindarkness #SuperBowlAd https://t.co/faO74lvSs5 https://t.co/37PLrNLJe0"
1093643321732464646,2019-02-07T22:51:01.000Z,15506669,@JeffBezos,Jeff Bezos,Business Man,"I’ve written a post about developments with the National Enquirer and its parent company, AMI. You can find it here: https://t.co/G1ykJAPPwy"
1107991131147534336,2019-03-19T13:04:05.000Z,15506669,@JeffBezos,Jeff Bezos,Business Man,"Thank you @FestoAG, but bigger please…. I want to get on! #ThinkBig #MARS2019 https://t.co/uXqvkf623B"
1113851382698635264,2019-04-04T17:10:38.000Z,15506669,@JeffBezos,Jeff Bezos,Business Man,RT @mackenziebezos: https://t.co/OJWn3OOLS6
1113851402965487616,2019-04-04T17:10:43.000Z,15506669,@JeffBezos,Jeff Bezos,Business Man,https://t.co/oFGWPkK3dB
1116317620670582789,2019-04-11T12:30:35.000Z,15506669,@JeffBezos,Jeff Bezos,Business Man,"Been an honor &amp; pleasure having Tom Alberg on Amazon’s Board. Tom joined in 1996 and has been with us ever since - over 22 years. I’ll miss his sound judgment, deep well of business &amp; life experience, and his quick wit. He's a smart business person and even better human. Thx Tom!"
1124115283554078720,2019-05-03T00:55:43.000Z,15506669,@JeffBezos,Jeff Bezos,Business Man,Congrats to the whole @blueorigin team! https://t.co/71S53Ucl5l
1126620848931131394,2019-05-09T22:51:56.000Z,15506669,@JeffBezos,Jeff Bezos,Business Man,"RT @blueorigin: Today, our founder shared our vision to go to space to benefit Earth. We must return to the Moon—this time to stay. We’re r…"
1126634588560748545,2019-05-09T23:46:32.000Z,15506669,@JeffBezos,Jeff Bezos,Business Man,"Blue Origin is building the infrastructure needed to unleash the next generation of dreamers. I met these young people today, and the future is in great hands. #BlueMoon @clubforfuture https://t.co/F2zPM5PngM"
1127573586716385280,2019-05-12T13:57:47.000Z,15506669,@JeffBezos,Jeff Bezos,Business Man,"I’m lucky enough to call her my mom. She’s kind, patient, supportive, and has always encouraged me to stay curious. Happy Mother’s Day, Mom! https://t.co/n1UZV3muZe"
1128409227481964544,2019-05-14T21:18:19.000Z,15506669,@JeffBezos,Jeff Bezos,Business Man,"We’re investing $1.5 billion in our new air hub to get you your packages faster. Three million square feet, and it’s going to create 2,000 jobs. And if you’re guessing that driving a front loader was fun, you’re right! #amazon #prime https://t.co/Cud4orKrC4"
1128828279329181696,2019-05-16T01:03:29.000Z,15506669,@JeffBezos,Jeff Bezos,Business Man,"At the Statue of Liberty, where my dad’s being honored with a Liberty Star as part of the new museum’s opening. When he came here from Cuba at 16, not only was he all alone, but he only spoke Spanish. His grit, determination, and optimism are inspiring. #StatueofLibertyMuseum https://t.co/DFhR3Dbf7p"
1129010348286046208,2019-05-16T13:06:57.000Z,15506669,@JeffBezos,Jeff Bezos,Business Man,My dad’s journey to the U.S. shows how people come together to help each other. We got a chance to celebrate him last night for the opening of the Statue of Liberty’s new museum. This is his story. https://t.co/VdOtlPY953 https://t.co/E4C1KPho2u
1131446048386240513,2019-05-23T06:25:33.000Z,15506669,@JeffBezos,Jeff Bezos,Business Man,Great annual shareholder meeting today. #Amazon https://t.co/g9keKvGyq0
1133007488721117184,2019-05-27T13:50:10.000Z,15506669,@JeffBezos,Jeff Bezos,Business Man,Grateful on this #MemorialDay to the fallen servicemen and women — and their families — for the ultimate sacrifice they made in defending and supporting our nation. The flag in the picture is on display on the factory wall at @BlueOrigin to remind us every day. https://t.co/6Qir3sk3mt
1133366998874804224,2019-05-28T13:38:44.000Z,15506669,@JeffBezos,Jeff Bezos,Business Man,"MacKenzie is going to be amazing and thoughtful and effective at philanthropy, and I’m proud of her. Her letter is so beautiful. Go get ‘em MacKenzie. https://t.co/S2gLLBQyRQ"
1136474105220407298,2019-06-06T03:25:16.000Z,15506669,@JeffBezos,Jeff Bezos,Business Man,".@AmazonreMARS is all about bringing the best and brightest together, so it’s fitting that I got to meet Leo — one of the first 100 recipients of the #AmazonFutureEngineer scholarship. I have no doubt Leo is going to be an inventor of tomorrow. https://t.co/vhQzZzA4kl"
1136489170841546752,2019-06-06T04:25:07.000Z,15506669,@JeffBezos,Jeff Bezos,Business Man,Leo’s story is amazing and so is his mom. #AmazonFutureEngineer https://t.co/QQPKg3GZ2T
1136707086933299200,2019-06-06T18:51:03.000Z,15506669,@JeffBezos,Jeff Bezos,Business Man,Got a chance to scout some of the cool tech at the first #reMARS event. @HaptX @Rivian @hseas @wyssinstitute https://t.co/bvG5afbn50
1138206602043936769,2019-06-10T22:09:35.000Z,15506669,@JeffBezos,Jeff Bezos,Business Man,My mom’s incredible story. Wow. So grateful. So proud. #Grit https://t.co/msi2nHqikf
1140285639071416320,2019-06-16T15:50:56.000Z,15506669,@JeffBezos,Jeff Bezos,Business Man,"Happy Father’s Day. You’re there for me always, and I feel it. I love you, Dad. https://t.co/o85JWRSTBn"
1141520394022576128,2019-06-20T01:37:25.000Z,15506669,@JeffBezos,Jeff Bezos,Business Man,First hotfire of our #BE7 lunar landing engine just yesterday at Marshall Space Flight Center. Data looks great and hardware is in perfect condition. Test went full planned duration – 35 seconds. Kudos to the whole @BlueOrigin team and grateful to @NASA_Marshall for all the help! https://t.co/cTjjrngumY
1141770282773831681,2019-06-20T18:10:23.000Z,15506669,@JeffBezos,Jeff Bezos,Business Man,"So much fun with Caroline Kennedy yesterday at the #JFKSpaceSummit. Her father’s Rice speech still inspires. We choose to do these things “not because they are easy, but because they are hard.” #Apollo50 https://t.co/ZmyBDxzK4V"
1145345436846157824,2019-06-30T14:56:46.000Z,15506669,@JeffBezos,Jeff Bezos,Business Man,#Pride https://t.co/mYq5XuA9Ks
1157489682118086656,2019-08-03T03:13:39.000Z,15506669,@JeffBezos,Jeff Bezos,Business Man,RT @blueorigin: BE-4 continues to rack up time on the test stand. Here’s a great shot of our full power engine test today #GradatimFerocite…
1166798278375030784,2019-08-28T19:42:42.000Z,15506669,@JeffBezos,Jeff Bezos,Business Man,"Had a great meeting with Mike George. We’re hard at work building Day 1 Academies, and Mike has been busy learning from the best in the field. Here are a few pictures from his listening tour – visiting the smart and kind early educators from schools across the country. https://t.co/ty1ngS2JCA"
1167125742401941504,2019-08-29T17:23:55.000Z,15506669,@JeffBezos,Jeff Bezos,Business Man,.@BlueOrigin founded nonprofit @clubforfuture to inspire youth to pursue careers in #STEM + visualize life in space. We asked students to send postcards w/their dreams and we’d send the cards above the Kármán line to space and back. We’ve received thousands - they’re so inspiring https://t.co/5fxHoD8DJm
1170036283315388416,2019-09-06T18:09:22.000Z,15506669,@JeffBezos,Jeff Bezos,Business Man,"Rooting for team India. Good luck, India! #Chandrayaan2 https://t.co/iWWSqPs4nz"
1170697204845039616,2019-09-08T13:55:38.000Z,15506669,@JeffBezos,Jeff Bezos,Business Man,Season 2 streams November 1. Can’t wait. #JackRyan https://t.co/THDtDjGIpQ
1171060934753734656,2019-09-09T14:00:58.000Z,15506669,@JeffBezos,Jeff Bezos,Business Man,We're sending two Amazon Air planes packed with tens of thousands of Amazon-donated and customer-donated relief items to support those impacted by #HurricaneDorian in the Bahamas. Thanks to all the teams who are making this possible. https://t.co/iY86RGh9AX https://t.co/Y3DHueJaXf
1171872387492528128,2019-09-11T19:45:24.000Z,15506669,@JeffBezos,Jeff Bezos,Business Man,"Today, we announced that we added 24 schools in #Nashville to our #AmazonFutureEngineer program. Loved celebrating the great news by building robots with students from Madison Middle School. https://t.co/PAjMfl4pEw"
1172517558336905218,2019-09-13T14:29:04.000Z,15506669,@JeffBezos,Jeff Bezos,Business Man,"Visited the amazing @Nia_House Montessori in Nashville with @mike_m_george. Learned a lot that’s going to help Day 1 Academies. By the way, “Nia” means “purpose” in Swahili. Very cool. https://t.co/OhSQeD5jls"
1173728216550260736,2019-09-16T22:39:48.000Z,15506669,@JeffBezos,Jeff Bezos,Business Man,Shout out to the new Amazonians who let me drop by their New Hire Orientation today. Incredible to welcome so many smart and passionate people from all over the world. I’m looking forward to our #AmazonCareerDay events tomorrow! https://t.co/JM6CF1uoRW
1173973723189108736,2019-09-17T14:55:21.000Z,15506669,@JeffBezos,Jeff Bezos,Business Man,"Yesterday the first Amazon Air plane loaded with relief items arrived in Nassau, Bahamas to help victims of #HurricaneDorian. The cargo weight was 72,728 lbs, with approx. 19,300 items on board. Huge thanks to the teams across Amazon who made this happen. https://t.co/iY86RGh9AX https://t.co/YFvC8Xl6mW"
1174704799645720586,2019-09-19T15:20:23.000Z,15506669,@JeffBezos,Jeff Bezos,Business Man,"Super excited about The Climate Pledge. Impossible to do this without @CFigueres. So grateful to you, Christiana. #ClimatePledge #Paris10YearsEarly https://t.co/E9hkaLat5V"
1175208903321124864,2019-09-21T00:43:31.000Z,15506669,@JeffBezos,Jeff Bezos,Business Man,"RT @JayCarney: If you can’t compete with lower prices and better services, then secretly fund phony “grassroots” attack campaigns. #Ugly. h…"
1175854166066913280,2019-09-22T19:27:34.000Z,15506669,@JeffBezos,Jeff Bezos,Business Man,"Good luck to @RachelBros, Phoebe Waller-Bridge, the @MaiselTV and @Fleabag teams, and all @PrimeVideo shows up for #Emmys tonight! https://t.co/mTTj82hfeK"
1176310291300093952,2019-09-24T01:40:02.000Z,15506669,@JeffBezos,Jeff Bezos,Business Man,"A record year of #Emmy wins for @PrimeVideo - fantastic work. Huge congrats to the winners and teams behind @Fleabag, @MaiselTV, and A Very English Scandal! https://t.co/KS2NLZpY88"
1176489837517344769,2019-09-24T13:33:30.000Z,15506669,@JeffBezos,Jeff Bezos,Business Man,"Thank you to our customers who donated relief items for a second Amazon Air plane of humanitarian aid. Together, more than 400,000 Amazon-donated &amp; customer-donated items have been provided to those affected by #HurricaneDorian in the Bahamas &amp; the US. https://t.co/NAcnQs4mx9 https://t.co/01jh0Y5bZr"
1186367004371906560,2019-10-21T19:41:50.000Z,15506669,@JeffBezos,Jeff Bezos,Business Man,"Dropped in on an #AmazonFutureEngineer class at Dunbar H.S. in D.C. today. We’re committed to bringing more resources to kids from underserved communities, and I’m proud to say we’re now funding computer science in more than 2,000 high schools across the U.S. #NextGeneration https://t.co/HrFdIfrSDf"
1186752897083760641,2019-10-22T21:15:14.000Z,15506669,@JeffBezos,Jeff Bezos,Business Man,"It’s time to go back to the Moon, this time to stay. @LockheedMartin @northropgrumman @DraperLab @blueorigin #gradatimferociter https://t.co/SMEUdriJhh"
