1300842856974819328,2020-09-01T17:08:00.000Z,939091,@JoeBiden,Joe Biden,Politician,We need a president who will lower the temperature and bring the country together — not one who raises it and tears us further apart. https://t.co/e6aFLx9iqU
1300868022740156417,2020-09-01T18:48:00.000Z,939091,@JoeBiden,Joe Biden,Politician,.@DrBiden and I send our best wishes to members of the Jain faith concluding the holy observance of Paryushan and Das Lakshan. May we all find peace and reconciliation in our lives. Michhami Dukkaddam and Kshamavani!
1300891426876612608,2020-09-01T20:21:00.000Z,939091,@JoeBiden,Joe Biden,Politician,"Together, we’re going to build back better than before and set our nation on a new path. https://t.co/OQHsy12ODf"
1300919864295436288,2020-09-01T22:14:00.000Z,939091,@JoeBiden,Joe Biden,Politician,"If I’m elected president, I promise you that America will be better prepared to deal with any threats that come our way.

That starts with restoring the PREDICT program that President Trump ended. https://t.co/7jDkOaLc8P"
1300939997059493888,2020-09-01T23:34:00.000Z,939091,@JoeBiden,Joe Biden,Politician,"For far too long, discriminatory policies like redlining have kept Black Americans from having the same opportunities as white Americans.

That’s got to change: https://t.co/ycM5gKCGyV https://t.co/mmb0u5kqZq"
1301162966255980545,2020-09-02T14:20:00.000Z,939091,@JoeBiden,Joe Biden,Politician,"Donald Trump is determined to instill fear and divide us, but what he doesn't understand is that fear never builds the future — hope does. https://t.co/3DFE6R6CWQ"
1301186118621290498,2020-09-02T15:52:00.000Z,939091,@JoeBiden,Joe Biden,Politician,"Last month we raised $364.5 million — 95% of the donations from grassroots supporters like you and the majority online.

Working people are powering our campaign — and I’m grateful.

We’ve got a long way to go to close the fundraising gap and win — but we can do it. Together."
1301189337850277892,2020-09-02T16:04:47.000Z,939091,@JoeBiden,Joe Biden,Politician,"This campaign is powered by grassroots supporters like you — and every dollar counts to close the fundraising gap with the Trump campaign. $5, $10, $15, whatever you can, chip in today: https://t.co/pHQWesk2AR"
1301208423036407808,2020-09-02T17:20:37.000Z,939091,@JoeBiden,Joe Biden,Politician,President Trump has failed to address COVID-19 — and now our students and educators are paying the price. Tune in as I discuss my plan to safely and effectively reopen schools: https://t.co/ntofl4zV7v
1301219337865433097,2020-09-02T18:04:00.000Z,939091,@JoeBiden,Joe Biden,Politician,"We all want students back in the classroom, but President Trump hasn't done the work to make sure schools can reopen safely and effectively.

@KamalaHarris and I will be ready on day 1 with a roadmap for reopening. https://t.co/yJswM3PliF"
1301237205617135617,2020-09-02T19:15:00.000Z,939091,@JoeBiden,Joe Biden,Politician,Donald Trump and Betsy DeVos are the worst possible people to lead our nation’s schools through this pandemic.
1301267404253786114,2020-09-02T21:15:00.000Z,939091,@JoeBiden,Joe Biden,Politician,"We’re just over two months from Election Day. But in many states, you don’t have to wait until November to make your voice heard.

Head to https://t.co/Hy8C4mIL2M and make a plan to vote early today."
1301285020448034817,2020-09-02T22:25:00.000Z,939091,@JoeBiden,Joe Biden,Politician,"If we give Donald Trump another four years in the White House, our planet may never recover. https://t.co/LmOUXuBqPQ"
1301302636881342466,2020-09-02T23:35:00.000Z,939091,@JoeBiden,Joe Biden,Politician,"They're rooting for chaos and violence because they think it helps them win a second term.

Now ask yourself, is that really who you think should be running the country? https://t.co/rXf0O5u0WC"
1301316478889680897,2020-09-03T00:30:00.000Z,939091,@JoeBiden,Joe Biden,Politician,"I’ve released 21 years of my tax returns. 

What are you hiding, @realDonaldTrump? https://t.co/aQs6Hlox0P"
1301322769045557250,2020-09-03T00:55:00.000Z,939091,@JoeBiden,Joe Biden,Politician,"Time and time again, President Trump has refused to stand up to Putin. His silence on the poisoning of Mr. Navalny is just the latest example.

As president, I'll do what Trump won't: hold the Putin regime accountable for its crimes. https://t.co/z11YyV6lq0"
1301535924111761408,2020-09-03T15:02:00.000Z,939091,@JoeBiden,Joe Biden,Politician,"I've always believed we're at our best when we act as one America. It's time for us to come together, propel our nation across this turbulent threshold, and build a better future for all."
1301560082933530625,2020-09-03T16:38:00.000Z,939091,@JoeBiden,Joe Biden,Politician,"Right now, classrooms should be humming with excitement for a new year and students’ hopes for their futures.

Instead, many are silent and empty because President Trump didn’t do his job.

America’s families are paying the price for his failures."
1301594146390466562,2020-09-03T18:53:21.000Z,939091,@JoeBiden,Joe Biden,Politician,"It’s time we come together as a nation to heal and address the challenges we face. Tune in to our community conversation in Kenosha, Wisconsin: https://t.co/5Vda70tPCu"
1301638096992206850,2020-09-03T21:48:00.000Z,939091,@JoeBiden,Joe Biden,Politician,"We need a president who will work to lower the temperature — not raise it. A president who will bring people together and find solutions to the challenges we face.

That's what I went to Kenosha to do today, and it's what I'll do every day in the White House. https://t.co/dNenwVZjUg"
1301657977821241344,2020-09-03T23:07:00.000Z,939091,@JoeBiden,Joe Biden,Politician,This is our moment to root out systemic racism and ensure justice finally rings out for all in America. https://t.co/mXzAZ9VZfR
1301666282589347841,2020-09-03T23:40:00.000Z,939091,@JoeBiden,Joe Biden,Politician,"Folks, today marks two months until Election Day. That means we have just two months to do everything we can to beat Donald Trump and restore the soul of this nation.

Chip in to help us win in November: https://t.co/UjC7yoIpU4"
1301677355526770689,2020-09-04T00:24:00.000Z,939091,@JoeBiden,Joe Biden,Politician,The President has a duty to set an example. https://t.co/OwiCo345Ph https://t.co/9bkSknbOds
1301686419421888512,2020-09-04T01:00:01.000Z,939091,@JoeBiden,Joe Biden,Politician,"In 2016, President Trump promised to reduce the trade deficit and said: ""You will see a drop like you've never seen before.""

The reality? It's the highest it's been in 12 years.

American workers can't afford another four years of his failed leadership. https://t.co/3CGY4Hym8o"
1301697991481458688,2020-09-04T01:46:00.000Z,939091,@JoeBiden,Joe Biden,Politician,"Here’s my promise to you: If I have the honor of serving as the next commander in chief, I will ensure that our American heroes know that I will have their back and honor their sacrifice. Always. https://t.co/wMFHHscD51"
1301913914922299393,2020-09-04T16:04:00.000Z,939091,@JoeBiden,Joe Biden,Politician,"Mr. President, if you don’t respect our troops, you can’t lead them. https://t.co/hcX9hGgdm5"
1301923209969836035,2020-09-04T16:40:56.000Z,939091,@JoeBiden,Joe Biden,Politician,"RT @TeamJoe: Every day we are thankful for our veterans and fallen soldiers who paid the ultimate sacrifice for our freedom.

@JoeBiden und…"
1301926526925983744,2020-09-04T16:54:07.000Z,939091,@JoeBiden,Joe Biden,Politician,Tune in as I discuss how our economic crisis has been worsened by President Trump's failure to get COVID-19 under control: https://t.co/YeDBBOntHe
1301990708920844291,2020-09-04T21:09:09.000Z,939091,@JoeBiden,Joe Biden,Politician,"I'm grateful for everyone who found work in August and found that glimmer of hope — but there is real cause for concern in this morning's jobs report.

The pace of job gains in August was slower than in July. And significantly slower than May or June."
1301990709910794243,2020-09-04T21:09:09.000Z,939091,@JoeBiden,Joe Biden,Politician,"The fact is we're more than six months into this pandemic, and:

- 11.5 million Americans don't have their jobs back
- Almost 30 million are on unemployment
- We're down 720,000 manufacturing jobs
- Nearly 1 in 6 small businesses have closed their doors"
1301990711013838849,2020-09-04T21:09:09.000Z,939091,@JoeBiden,Joe Biden,Politician,"Now is not the time for a victory lap, Mr. President. Just because your wealthy friends and donors are doing well doesn't mean everyone else is.

Get off the golf course. Call the leaders of Congress to the White House. And make a deal that delivers for working people."
1302033703539937285,2020-09-05T00:00:00.000Z,939091,@JoeBiden,Joe Biden,Politician,"Every day Donald Trump proves how morally unfit he is to lead our nation.

In 60 days, we have to vote him out. https://t.co/EteeruIOm6"
1302302977953271808,2020-09-05T17:50:00.000Z,939091,@JoeBiden,Joe Biden,Politician,Our nation’s veterans speak for themselves. https://t.co/ai5Y1MzCaQ
1302325123802824704,2020-09-05T19:18:00.000Z,939091,@JoeBiden,Joe Biden,Politician,"Mr. President, enough with the weekend golf trips and erratic tweets. It's time for you to get to work and control the spread of this virus. https://t.co/SfsEQMgc5z"
1302343746756005891,2020-09-05T20:32:00.000Z,939091,@JoeBiden,Joe Biden,Politician,"Nicaraguan asylum seekers fleeing oppression deserve to have their cases heard. Instead, they’re being deported back into the tyrannical grip of Daniel Ortega without a chance to pursue their claims.

President Trump’s cruelty truly knows no bounds. https://t.co/FxhjCUXkZ8"
1302371428994412544,2020-09-05T22:22:00.000Z,939091,@JoeBiden,Joe Biden,Politician,"As president, I will:

- Call for nationwide mask mandates
- Implement widespread testing
- Accelerate the development of treatments and vaccines

I’m ready to work on day one to contain the spread of this virus and get our country back on track."
1302396094886813698,2020-09-06T00:00:01.000Z,939091,@JoeBiden,Joe Biden,Politician,"The economy wasn’t working for folks long before this virus hit. That’s why @KamalaHarris and I won’t just build back to the way things were — we’re going to build back better.

We’re going to make sure everyone has a fair shot to get ahead. https://t.co/rt5RD9Fdi0"
1302615789313417217,2020-09-06T14:33:00.000Z,939091,@JoeBiden,Joe Biden,Politician,Be a patriot. Wear a mask. https://t.co/LrXyfxphuD
1302649007991214081,2020-09-06T16:45:00.000Z,939091,@JoeBiden,Joe Biden,Politician,It’s time we reward work — not just wealth.
1302675432144351234,2020-09-06T18:30:00.000Z,939091,@JoeBiden,Joe Biden,Politician,We know what President Trump thinks of our nation's veterans. Here is what they think of him. https://t.co/QX910VyP0u
1302705631938347009,2020-09-06T20:30:00.000Z,939091,@JoeBiden,Joe Biden,Politician,"We all want our schools to reopen — but we need to do it in a way that puts the health and safety of our students and educators first.

Here's how @KamalaHarris and I will reopen our schools safely and effectively: https://t.co/yJswM3PliF"
1302732055214653441,2020-09-06T22:15:00.000Z,939091,@JoeBiden,Joe Biden,Politician,"Donald Trump promised to be ""the greatest jobs president God ever created.""

But in reality, he's on track to become the first president in modern history to leave office with fewer jobs than when he entered.

American workers can't take four more years of his failed leadership."
1302763609194467328,2020-09-07T00:20:23.000Z,939091,@JoeBiden,Joe Biden,Politician,"Time and again, the president has refused to provide Puerto Rico with much-needed resources. He’s repeatedly insulted Puerto Ricans and this latest action is another example of his disrespect for the island. 

This ends when I’m elected president. https://t.co/FitVSFl8bS"
1302769803925487616,2020-09-07T00:45:00.000Z,939091,@JoeBiden,Joe Biden,Politician,We need to restore honor and decency to the White House.
1302969877154668544,2020-09-07T14:00:01.000Z,939091,@JoeBiden,Joe Biden,Politician,"Today, we honor the generations of union workers who fought for the rights, power, wages, and benefits that built and sustained the great American middle class. #LaborDay https://t.co/gTqE9tYUKd"
1303001581437165570,2020-09-07T16:06:00.000Z,939091,@JoeBiden,Joe Biden,Politician,"The 40-hour workweek
Minimum wage
Overtime pay
Health care 
Workplace safety protections

They’re all because of unions — and it’s time we recognize that."
1303011396041486340,2020-09-07T16:45:00.000Z,939091,@JoeBiden,Joe Biden,Politician,"Together, we can build a future that reflects working people’s courage and ambition. One that not only offers good jobs — but the dignity, equity, shared prosperity, and common purpose due to every American. https://t.co/FDLGMKCgWD"
1303036310177951747,2020-09-07T18:24:00.000Z,939091,@JoeBiden,Joe Biden,Politician,"For years, President Trump and Republicans have waged a war on America's labor unions. 

It will end on my watch.

I'll sign the PRO Act — making it easier for workers to organize and collectively bargain — and be the strongest labor president workers have ever had."
1303056694360944640,2020-09-07T19:45:00.000Z,939091,@JoeBiden,Joe Biden,Politician,"It's not enough to just thank our essential workers — we need to pay them. As president, I’ll:

- Raise the minimum wage to $15
- End the tipped minimum wage
- End the sub-minimum wage for people with disabilities
- Ensure everyone has strong benefits"
1303079343766331393,2020-09-07T21:15:00.000Z,939091,@JoeBiden,Joe Biden,Politician,"Wall Street didn't build this country — the middle class did. And unions built the middle class.

Donald Trump doesn't understand that. We need a president who does."
1303098219337981954,2020-09-07T22:30:00.000Z,939091,@JoeBiden,Joe Biden,Politician,"As president, I’ll make record investments in American industry and create millions of good-paying, union jobs.

We’re going to make sure the future is made in America — and built by union workers. https://t.co/rt5RD9Fdi0"
1303123383840890880,2020-09-08T00:10:00.000Z,939091,@JoeBiden,Joe Biden,Politician,"Mr. President — If you’re so good at making deals, then why does your trade deal cost American workers so much pain while letting China off the hook for its biggest trade abuses? https://t.co/mL8a67CTAw"
1303334776959651840,2020-09-08T14:10:00.000Z,939091,@JoeBiden,Joe Biden,Politician,"At our best, America has always been generous, kind, and optimistic. We treat each other with dignity, give hate no safe harbor, and leave no one behind.

I believe we can be that nation once again."
1303370008832155648,2020-09-08T16:30:00.000Z,939091,@JoeBiden,Joe Biden,Politician,"This economy may be working great for Donald Trump and his wealthy friends — but it's not working for the rest of America.

It's time we change that."
1303392660699451392,2020-09-08T18:00:00.000Z,939091,@JoeBiden,Joe Biden,Politician,"Unlike Donald Trump, I'll listen to the experts and heed their advice — especially when it comes to matters of health and safety.

You should expect nothing less from your president. https://t.co/RwF1BQtJAh"
1303413042470776832,2020-09-08T19:21:00.000Z,939091,@JoeBiden,Joe Biden,Politician,"On this feast day of Cuba’s patron saint la Virgen de la Caridad del Cobre, Jill and I pray that the love and compassion “Cachita” inspires will fill the hearts of Cubans and believers around the world. https://t.co/Vn1FoFV4Uo"
1303423093176774657,2020-09-08T20:00:56.000Z,939091,@JoeBiden,Joe Biden,Politician,"Just months ago, Donald Trump was planning to allow oil and gas drilling off the coast of Florida.
 
Now, with 56 days until the election, he conveniently says that he changed his mind. Unbelievable.
 
You don't have to guess where I stand: I oppose new offshore drilling. https://t.co/oxfQNIymBh"
1303435439978803202,2020-09-08T20:50:00.000Z,939091,@JoeBiden,Joe Biden,Politician,I can tell you few people know me as well as @BarackObama and @KamalaHarris do. https://t.co/LwkVSCglGS
1303460102649843717,2020-09-08T22:28:00.000Z,939091,@JoeBiden,Joe Biden,Politician,"Every single American worker deserves the chance to join a union. As president, I’ll strengthen our labor unions and ensure workers can bargain for the pay, benefits, and workplace protections they deserve. https://t.co/Yqd8D5SzbQ"
1303467287610036224,2020-09-08T22:56:33.000Z,939091,@JoeBiden,Joe Biden,Politician,RT @KamalaHarris: Let me tell you about Joe. https://t.co/EPowSeTGep
1303487030052007936,2020-09-09T00:15:00.000Z,939091,@JoeBiden,Joe Biden,Politician,Donald Trump is incapable of providing the leadership this moment requires.
1303495440701313025,2020-09-09T00:48:25.000Z,939091,@JoeBiden,Joe Biden,Politician,"A safe and effective COVID-19 vaccine could save countless lives. We need one as soon as possible.

But while I see a vaccine as a product of science, President Trump sees it as a political tool.

Politics should play no role in this. The Administration must answer the following:"
1303495441875640321,2020-09-09T00:48:25.000Z,939091,@JoeBiden,Joe Biden,Politician,"1: What criteria will be used to ensure a vaccine meets the scientific standard of safety and efficacy?

The FDA must clarify what criteria it will use, and President Trump must commit to respecting the independent judgment of the non-political professional staff at the FDA."
1303495442924212224,2020-09-09T00:48:26.000Z,939091,@JoeBiden,Joe Biden,Politician,"2: Who will validate that the Administration’s decision to greenlight a COVID-19 vaccine is driven by science and not political motivation?
 
We must hear uncensored statements on efficacy and safety from @FDACBER, the @US_FDA vaccine advisory committee, and Dr. Fauci."
1303495444018929665,2020-09-09T00:48:26.000Z,939091,@JoeBiden,Joe Biden,Politician,"3: What is the plan to allocate and distribute vaccines to Americans cost-free, safely, equitably, and without politics?
 
President Trump should release a detailed distribution plan to ensure every American — not just the wealthy and well-connected — receives the vaccine."
1303495445717512192,2020-09-09T00:48:26.000Z,939091,@JoeBiden,Joe Biden,Politician,"Given his track record, no one can take Trump’s word alone on a COVID-19 vaccine. But with satisfactory answers to these questions, every American can have confidence in a safe and effective COVID-19 vaccine. https://t.co/074K1HD9wf"
1303699681420087296,2020-09-09T14:20:00.000Z,939091,@JoeBiden,Joe Biden,Politician,"President Obama and I rescued the auto industry and helped Michigan's economy come roaring back.

Donald Trump squandered it — and hardworking Michiganders are paying the price every day. https://t.co/kXjyPbsj8s"
1303718557201690624,2020-09-09T15:35:00.000Z,939091,@JoeBiden,Joe Biden,Politician,RT @KamalaHarris: The images we’re seeing from the West Coast are absolutely horrifying. I’m eternally grateful for our brave firefighters…
1303729880211759104,2020-09-09T16:20:00.000Z,939091,@JoeBiden,Joe Biden,Politician,"The right to vote is the most sacred American right there is — exercise it. 

Make your voice heard this November. https://t.co/Hy8C4n0lUk"
1303750335345733632,2020-09-09T17:41:17.000Z,939091,@JoeBiden,Joe Biden,Politician,"I’m in Warren, Michigan, to discuss how a Biden-Harris administration will ensure the future is made in America — by America’s workers. Tune in now: https://t.co/OzJ3Vnc8kd"
1303756807895220226,2020-09-09T18:07:00.000Z,939091,@JoeBiden,Joe Biden,Politician,"Donald Trump knew.

He lied to us for months.

And while a deadly disease ripped through our nation, he failed to do his job — on purpose.

It was a life or death betrayal of the American people. https://t.co/WDmVUvmmJk"
1303789774851907584,2020-09-09T20:18:00.000Z,939091,@JoeBiden,Joe Biden,Politician,"I promise you that if I’m elected, I’ll always tell you the truth.

I’ll listen to the experts and do everything I can to contain this virus.

And I’ll always put your health and safety first — no matter the political cost."
1303807139203493888,2020-09-09T21:27:00.000Z,939091,@JoeBiden,Joe Biden,Politician,"Roberto Clemente was an incredible baseball player. He was a barrier breaker and a humanitarian. As he rose to fame, he lifted the Black and Latino communities with him.

I may be a Phillies fan, but I’m always proud to honor the legacy of #21. https://t.co/ZWSfIBUD0p"
1303826768525131776,2020-09-09T22:45:00.000Z,939091,@JoeBiden,Joe Biden,Politician,"If Donald Trump had acted just two weeks earlier, 54,000 lives could have been spared in March and April alone. 

Instead, he downplayed the threat and refused to take action — costing lives and sending our economy into a tailspin.

It’s an unjustifiable dereliction of duty."
1303839351671980032,2020-09-09T23:35:00.000Z,939091,@JoeBiden,Joe Biden,Politician,You deserve a president who tells you the truth.
1303867788759568384,2020-09-10T01:28:00.000Z,939091,@JoeBiden,Joe Biden,Politician,"Donald Trump knew that COVID-19 was dangerous. He knew it was deadly. And he purposely downplayed it.

Now, nearly 200,000 Americans are dead.

It’s unconscionable. https://t.co/SLqqhmWy8E"
1304051499358662656,2020-09-10T13:38:00.000Z,939091,@JoeBiden,Joe Biden,Politician,"I got to meet Lou Brock back in March. I joked that I had really just come to St. Louis to see him—and let me tell you, our meeting was a real highlight. Lou was a true legend and a man of integrity. Jill and I are keeping his loved ones in our prayers during this difficult time. https://t.co/ZStoBAnk7V"
1304085725009248256,2020-09-10T15:54:00.000Z,939091,@JoeBiden,Joe Biden,Politician,Donald Trump said he didn't want to tell the truth and create a panic. So he did nothing and created a disaster.
1304096798060019713,2020-09-10T16:38:00.000Z,939091,@JoeBiden,Joe Biden,Politician,How many more people have to suffer because of President Trump's lies? https://t.co/m2spzGCKgd
1304114917352456192,2020-09-10T17:50:00.000Z,939091,@JoeBiden,Joe Biden,Politician,"The images coming out of California, Oregon, Washington, and other Western states are truly horrifying. If you’re in an impacted area, please heed the warnings from your local authorities and stay safe. Jill and I are keeping you all in our prayers. https://t.co/39vcORJEBX"
1304130016955990017,2020-09-10T18:50:00.000Z,939091,@JoeBiden,Joe Biden,Politician,"To everyone struggling right now, I want you to know that you are not alone. You’re seen, you’re heard, and you’re loved. 

If you need help, please don’t hesitate to visit https://t.co/tPKtlFFCIY. 

Better days lie ahead, I promise. #WorldSuicidePreventionDay"
1304147637201854464,2020-09-10T20:00:01.000Z,939091,@JoeBiden,Joe Biden,Politician,"Make no mistake: Climate change is already here — and we’re witnessing its devastating effects every single day. 

We have to get President Trump out of the White House and treat this crisis like the existential threat that it is. https://t.co/NXzkpaRVsY"
1304158957687263235,2020-09-10T20:45:00.000Z,939091,@JoeBiden,Joe Biden,Politician,Do your part. Wear a mask. https://t.co/pdnEecS49Q
1304171037240619008,2020-09-10T21:33:00.000Z,939091,@JoeBiden,Joe Biden,Politician,"Donald Trump is holding a rally in Michigan today—while also refusing to fully fund their National Guard.

These are frontline workers against COVID-19, responsible for testing and distributing food and medical supplies.

Michiganders need a pandemic response—not a pep rally. https://t.co/UkEqVv9zXe"
1304209289456672768,2020-09-11T00:05:00.000Z,939091,@JoeBiden,Joe Biden,Politician,"More than 1,000 people died from COVID yesterday.

@realDonaldTrump watched eight hours of TV.

If I’m president, you might not always agree with me. But I promise you I will always show up and fight for you. https://t.co/HvVJLS83TZ"
1304219355404791808,2020-09-11T00:45:00.000Z,939091,@JoeBiden,Joe Biden,Politician,Donald Trump said he wanted to be a cheerleader for the country. We didn't need a cheerleader. We needed a president.
1304450463920779264,2020-09-11T16:03:20.000Z,939091,@JoeBiden,Joe Biden,Politician,"As a nation, we must never forget those we lost on 9/11 and the incredible bravery of our first responders. Though the wounds of that day will never fully heal, the spirit of Americans recovered as it always does — unbowed by the efforts of those who strike against it. https://t.co/Ogn7Sbvq1Q"
1304473044916875264,2020-09-11T17:33:04.000Z,939091,@JoeBiden,Joe Biden,Politician,"Nineteen years ago, our nation was tested by an unspeakable act of cowardice and hate. Nearly 3,000 lives were cut short: a once-unthinkable toll which tore open the hearts of Americans in every corner of the country. https://t.co/6rAF0dAd1Y"
1304473047110475776,2020-09-11T17:33:05.000Z,939091,@JoeBiden,Joe Biden,Politician,"This year, we mark the anniversary of 9/11 in the midst of another crisis that compels us to summon the best of the American people in the face of unconscionable, inconceivable loss — a crisis that has already taken nearly 200,000 Americans."
1304473048771420165,2020-09-11T17:33:05.000Z,939091,@JoeBiden,Joe Biden,Politician,"Now, as then, our heroes are ordinary people doing extraordinary things: nurses and doctors; delivery drivers and grocery clerks; public transit workers and educators; regular Americans thrust into courageous acts of sacrifice and service."
1304473050075860997,2020-09-11T17:33:05.000Z,939091,@JoeBiden,Joe Biden,Politician,"And now, as then, we owe it to them to come together as a nation — so that Americans can once again do what we did so bravely nineteen years ago: turn from tragedy to purpose, rebuild our lives, and begin, in time, to heal."
1304563623998570496,2020-09-11T23:33:00.000Z,939091,@JoeBiden,Joe Biden,Politician,Always remember. https://t.co/BwaBSo8LFq
