1321499468571684864,2020-10-28T17:10:00.000Z,939091,@JoeBiden,Joe Biden,Politician,It’s simple: Donald Trump thinks health care is a privilege. I think it is your right.
1321507018516156419,2020-10-28T17:40:00.000Z,939091,@JoeBiden,Joe Biden,Politician,"As president, I'll build on Obamacare to ensure every single American has access to quality, affordable health care.

Here's how: https://t.co/34NCSYhO2C"
1321512059029213185,2020-10-28T18:00:02.000Z,939091,@JoeBiden,Joe Biden,Politician,"Thank you for your support, @HamillHimself. May the force be with us this election season. https://t.co/GlgnKz8q96"
1321522117754658816,2020-10-28T18:40:00.000Z,939091,@JoeBiden,Joe Biden,Politician,It’s hard to believe it’s been a year since we lost my friend Senator Kay Hagan. Kay was a relentless champion for North Carolina and a fierce defender of its citizens. May her legacy continue to inspire a new generation of leaders to follow in her steps. https://t.co/hl9Pi3Y2fi
1321532184285642753,2020-10-28T19:20:00.000Z,939091,@JoeBiden,Joe Biden,Politician,"Today we celebrate the 80th anniversary of Oxi Day. Greeks inspired the free world when they resisted Mussolini’s invading army — and that courageous spirit lives on today, reminding us we too must stand up and do our part to safeguard our democracy."
1321537217441996800,2020-10-28T19:40:00.000Z,939091,@JoeBiden,Joe Biden,Politician,We voted. https://t.co/LjaPBB69wC
1321554078376226818,2020-10-28T20:47:00.000Z,939091,@JoeBiden,Joe Biden,Politician,"Melanie, thank you for sharing your story and for the sacrifices you've made to keep us all safe. They are not in vain.

On Tuesday, we need to vote out Donald Trump and treat the climate crisis like the existential threat it is. https://t.co/dCKIBGlmoo"
1321563893001408512,2020-10-28T21:26:00.000Z,939091,@JoeBiden,Joe Biden,Politician,"You can't make this up: Yesterday, the White House science office put out a statement listing ""ending the COVID-19 pandemic"" as the top accomplishment of President Trump's first term. 
https://t.co/46VkWJE0GN"
1321576224624414721,2020-10-28T22:15:00.000Z,939091,@JoeBiden,Joe Biden,Politician,"It’s not political.

It’s patriotic.

Wear a mask. Period."
1321586217956397058,2020-10-28T22:54:42.000Z,939091,@JoeBiden,Joe Biden,Politician,"We have just six more days left in this election — and the American people have the power in their hands to put our country on a vastly different path.

Make your plan to vote today: https://t.co/uoiVh9ZqzI"
1321600635222052866,2020-10-28T23:52:00.000Z,939091,@JoeBiden,Joe Biden,Politician,The future of our planet is on the ballot. https://t.co/fWtwYOmycR
1321606423495823361,2020-10-29T00:15:00.000Z,939091,@JoeBiden,Joe Biden,Politician,"I believe in science.

Donald Trump doesn't.

It's that simple, folks."
1321617748527513602,2020-10-29T01:00:00.000Z,939091,@JoeBiden,Joe Biden,Politician,"The stakes in this election couldn’t be higher — and with just six days left, we can’t let up.

Chip in to help us get the job done on Tuesday: https://t.co/5xqcSEyaYf"
1321622781210087425,2020-10-29T01:20:00.000Z,939091,@JoeBiden,Joe Biden,Politician,"Folks, if you haven’t returned your absentee ballot yet, it’s important you do so as soon as possible.

Head to https://t.co/eoxT07d7QB to learn more about how to return your ballot."
1321627814345560065,2020-10-29T01:40:00.000Z,939091,@JoeBiden,Joe Biden,Politician,"The election is underway across the country, and we need your help to spread the word on social media. Sign up to help, and let’s win this thing: https://t.co/Yys11DiWVm"
1321807498492354561,2020-10-29T13:34:00.000Z,939091,@JoeBiden,Joe Biden,Politician,"""History says, don't hope
On this side of the grave.
But then, once in a lifetime
The longed-for tidal wave
Of justice can rise up,
And hope and history rhyme.""
- Seamus Heaney https://t.co/7nB1ytYlvm"
1321823864213721094,2020-10-29T14:39:02.000Z,939091,@JoeBiden,Joe Biden,Politician,"GDP rose last quarter, but visits to food banks haven’t slowed, and poverty has grown. We’re on track for the worst economic downturn in over 70 years, and Donald Trump is on track to be the first president since Herbert Hoover to leave office with less jobs than when he came in."
1321823865165778944,2020-10-29T14:39:02.000Z,939091,@JoeBiden,Joe Biden,Politician,"Success in a Biden-Harris Administration will not be measured just by the stock market or GDP growth, but by the extent to which growth is raising the pay, dignity, and economic security of our working families—especially those who have been left behind. https://t.co/HQZ8UbUb3f"
1321829393099034629,2020-10-29T15:01:00.000Z,939091,@JoeBiden,Joe Biden,Politician,5 days. Let’s bring this home.
1321844492362633216,2020-10-29T16:01:00.000Z,939091,@JoeBiden,Joe Biden,Politician,.@KamalaHarris and I won't just build back to the way things were before these crises — we're going to build back better and create a new American economy. Watch as my friend @JulianCastro explains. https://t.co/AdGKICs6Tf
1321858836626579456,2020-10-29T16:58:00.000Z,939091,@JoeBiden,Joe Biden,Politician,"Latinas are the heart of our communities — and on Latina Equal Pay Day, we call attention to the fact that they earn only 54 cents for every dollar a white man makes.

A Biden-Harris Administration will build back better for Latinas by taking overdue action to ensure equal pay."
1321863115680567297,2020-10-29T17:15:00.000Z,939091,@JoeBiden,Joe Biden,Politician,"I join Israelis in honoring Prime Minister Yitzhak Rabin z""l, 25 years after his assassination. He led a life of service to his country and its security — and bravely gave his life pursuing peace. I was honored to call him a friend."
1321878691081723904,2020-10-29T18:16:53.000Z,939091,@JoeBiden,Joe Biden,Politician,"We’re just five days from Election Day –– and everything is on the line. Tune in as we get out the vote in Broward County, Florida. https://t.co/VgqrLETyZC"
1321889541343641601,2020-10-29T19:00:00.000Z,939091,@JoeBiden,Joe Biden,Politician,"My Catholic faith drilled into me a core truth — that every person on earth is equal in rights and dignity. As president, these are the principles that will shape all that I do, and my faith will continue to serve as my anchor, as it has my entire life. https://t.co/DRsQ2cA9m1"
1321895830173945856,2020-10-29T19:25:00.000Z,939091,@JoeBiden,Joe Biden,Politician,Jill and I are keeping the French people in our prayers following the horrific terror attack in Nice — which targeted innocents in a house of worship. A Biden-Harris administration will work with our allies and partners to prevent extremist violence in all forms.
1321900863351238659,2020-10-29T19:45:00.000Z,939091,@JoeBiden,Joe Biden,Politician,"Las latinas son el corazón de nuestras comunidades y hoy en el Día de la equidad salarial de la mujer latina, reconocemos el hecho de que solo ganan 54 centavos por cada dólar que gana un hombre blanco.

Mi administración luchará para asegurar la igualdad salarial que se merecen."
1321904638992396288,2020-10-29T20:00:00.000Z,939091,@JoeBiden,Joe Biden,Politician,Donald Trump is on track to become the worst jobs president in modern American history. https://t.co/gmjwbHeuOS
1321910929806819328,2020-10-29T20:25:00.000Z,939091,@JoeBiden,Joe Biden,Politician,".@KamalaHarris y yo no solo reconstruiremos las cosas como eran antes de estas crisis, sino que reconstruiremos un mejor país que antes, para crear una nueva economía estadounidense. Mira la explicación de mi amigo @JulianCastro. https://t.co/11usNr3tfv"
1321915963399352321,2020-10-29T20:45:00.000Z,939091,@JoeBiden,Joe Biden,Politician,"Christen — tell your grandmother I’m incredibly grateful to have her support, and thank you for helping her cast her ballot. https://t.co/zRKbAPvqgF"
1321926461054423040,2020-10-29T21:26:43.000Z,939091,@JoeBiden,Joe Biden,Politician,"The future of our country is on the ballot — and you get to decide what it looks like.

Vote: https://t.co/eoxT07d7QB"
1321933578897248256,2020-10-29T21:55:00.000Z,939091,@JoeBiden,Joe Biden,Politician,"Enough of the lies.

Vote him out: https://t.co/eoxT07uII9 https://t.co/iTdiPVy8FA"
1321942639109918720,2020-10-29T22:31:00.000Z,939091,@JoeBiden,Joe Biden,Politician,"You have my word: if I have the honor of serving as your president, I will do everything in my power to defeat COVID-19.

Here’s my plan to get it done: https://t.co/zUWDfi0yQ8"
1321949962494636032,2020-10-29T23:00:06.000Z,939091,@JoeBiden,Joe Biden,Politician,"Here’s the bottom line: When we vote, things get better. Tune in as we hold a get out the vote rally in Tampa Bay, Florida. https://t.co/rJ2nbiDlOE"
1321960506425450496,2020-10-29T23:42:00.000Z,939091,@JoeBiden,Joe Biden,Politician,This election is about so much more than policy. The character of our country is on the ballot. And @KamalaHarris and I will work every day to bring this country back together — fighting as hard for those who don’t support us as those who do. https://t.co/IIhhcxDeL2
1321967552965218305,2020-10-30T00:10:00.000Z,939091,@JoeBiden,Joe Biden,Politician,"Now more than ever, we need a president who will choose compassion over cruelty."
1321983911057129472,2020-10-30T01:15:00.000Z,939091,@JoeBiden,Joe Biden,Politician,"This storm will pass, and a new day will come. https://t.co/PewrMRuRXx"
1322168741111672832,2020-10-30T13:29:27.000Z,939091,@JoeBiden,Joe Biden,Politician,"4 days to prevent another 4 years.

Vote: https://t.co/eoxT07d7QB"
1322194045612032002,2020-10-30T15:10:00.000Z,939091,@JoeBiden,Joe Biden,Politician,"They say never read the comments –– well, I did anyway. https://t.co/f6WagAxkNb"
1322196873487286276,2020-10-30T15:21:14.000Z,939091,@JoeBiden,Joe Biden,Politician,"RT @TeamJoe: Today is the last day to vote early in person for @JoeBiden and @KamalaHarris in these states: 

✅Arizona 
✅Georgia
✅Nevada 
✅…"
1322209648418672642,2020-10-30T16:12:00.000Z,939091,@JoeBiden,Joe Biden,Politician,"Folks, deadlines to vote early in-person are arriving across the country. Don’t wait until November 3rd to cast your ballot — head to https://t.co/eoxT07d7QB to find all the information you need to vote today. https://t.co/3YmUK1Mggr"
1322215436524670976,2020-10-30T16:35:00.000Z,939091,@JoeBiden,Joe Biden,Politician,"After campaigning in 2016 to lift up the ‘forgotten man,’ President Trump has completely lost sight of working people. 

I promise you this: I never will. https://t.co/mbcxYtv80U"
1322229277887238145,2020-10-30T17:30:00.000Z,939091,@JoeBiden,Joe Biden,Politician,Donald Trump is wholly unfit to serve as commander in chief. But don’t just take my word for it... https://t.co/TnxcPvwSul
1322234732235513856,2020-10-30T17:51:40.000Z,939091,@JoeBiden,Joe Biden,Politician,"There’s no challenge we can’t overcome when we stand united. With just four days to go, tune in as we get out the vote in Iowa. https://t.co/0O9S2J9Tw6"
1322247900286513152,2020-10-30T18:44:00.000Z,939091,@JoeBiden,Joe Biden,Politician,"You have the power to silence him.

Vote: https://t.co/eoxT07uII9 https://t.co/zIJUQEWlyx"
1322254443644026880,2020-10-30T19:10:00.000Z,939091,@JoeBiden,Joe Biden,Politician,"I'm not going to shut down the country.

I'm not going to shut down the economy.

I'm going to shut down the virus."
1322270801370902528,2020-10-30T20:15:00.000Z,939091,@JoeBiden,Joe Biden,Politician,"Let me be clear: Hardworking Americans should not be paying more in federal income taxes than Amazon or Netflix.

It’s time for big corporations to finally pay their fair share."
1322278350933688320,2020-10-30T20:45:00.000Z,939091,@JoeBiden,Joe Biden,Politician,"Jill and I send our prayers to the people of Greece and Turkey following today’s earthquake. We’re grateful for the brave rescuers saving others, and for the governments of Greece and Turkey putting aside their differences to support each other."
1322282861093744640,2020-10-30T21:02:55.000Z,939091,@JoeBiden,Joe Biden,Politician,We are in a battle for the soul of the nation –– your voice and vote can make all the difference. Tune in as I speak live from Minnesota. https://t.co/9F5riiRKo9
1322299741804195841,2020-10-30T22:10:00.000Z,939091,@JoeBiden,Joe Biden,Politician,Alfonso came here with a dream. And now he’s been robbed of his future. Enough is enough. https://t.co/wrASsVVNHX
1322304775740887042,2020-10-30T22:30:00.000Z,939091,@JoeBiden,Joe Biden,Politician,Jill and I are praying for all those impacted by Hurricane Zeta. The entire nation stands with you as you rebuild and recover.
1322312941891395585,2020-10-30T23:02:27.000Z,939091,@JoeBiden,Joe Biden,Politician,"RT @ericswalwell: Up there's the finish line. 
Our future is worth our fight.

Thank you, @taylorswift13, for voicing what #OnlyTheYoung ca…"
1322320377943527424,2020-10-30T23:32:00.000Z,939091,@JoeBiden,Joe Biden,Politician,"More than 9 million cases of COVID-19 have been now confirmed in the United States — and more than 228,000 Americans have lost their lives.

It is as severe an indictment of a president’s record as one can possibly imagine, and it is utterly disqualifying."
1322329396263354368,2020-10-31T00:07:50.000Z,939091,@JoeBiden,Joe Biden,Politician,Your vote will help determine the future of our country. I’m in Wisconsin to urge folks to use that power. Tune in. https://t.co/UOPVdn58z0
1322342775518457856,2020-10-31T01:01:00.000Z,939091,@JoeBiden,Joe Biden,Politician,"This Domestic Violence Awareness Month, I recommit to ensuring domestic violence is treated like the crime it is, and to ensuring survivors receive the support they need. I've spent my entire career fighting domestic abuse — and will continue that fight as president. #DVAM"
1322347053670825984,2020-10-31T01:18:00.000Z,939091,@JoeBiden,Joe Biden,Politician,"Love will always win. Congratulations, @S10Bird and @mPinoe! https://t.co/isj9Q2R3R8"
1322356364828569602,2020-10-31T01:55:00.000Z,939091,@JoeBiden,Joe Biden,Politician,"From the climate crisis to student debt and gun violence — there's so much on the line in this election, and young people have the power to own the outcome.

So vote, and let's build a better future together: https://t.co/eoxT07uII9 https://t.co/YDClI2GvBw"
1322365174288797696,2020-10-31T02:30:00.000Z,939091,@JoeBiden,Joe Biden,Politician,Let me be clear: Anyone who is responsible for plunging and ensnaring America in this crisis — anyone who could do so without an ounce of shame or a shred of empathy — should not be president. https://t.co/Rps7MFavJX
1322372724220600320,2020-10-31T03:00:00.000Z,939091,@JoeBiden,Joe Biden,Politician,Alfonso vino aquí con un sueño. Y su futuro ha sido robado. Ya es suficiente. https://t.co/VHGK9dYNRA
1322380775715598336,2020-10-31T03:32:00.000Z,939091,@JoeBiden,Joe Biden,Politician,"Moody’s Analytics projects that my plan will create 18.6 million jobs — over 7 million more jobs than President Trump’s plan.

We’re going to build back better and ensure everyone has a fair shot to get ahead. https://t.co/rt5RD9Fdi0"
1322493526878253057,2020-10-31T11:00:02.000Z,939091,@JoeBiden,Joe Biden,Politician,"This is your chance to be a part of history.

Vote: https://t.co/eoxT07uII9 https://t.co/4bH8iawiSE"
1322504843244744704,2020-10-31T11:45:00.000Z,939091,@JoeBiden,Joe Biden,Politician,"I believe every American deserves to retire with dignity.

https://t.co/mVwdWJ1owh https://t.co/iyekmiUqvP"
1322512392937525249,2020-10-31T12:15:00.000Z,939091,@JoeBiden,Joe Biden,Politician,"The future of this country is in your hands.

Make a plan to vote now. https://t.co/uoiVh9ZqzI"
1322519943167021056,2020-10-31T12:45:00.000Z,939091,@JoeBiden,Joe Biden,Politician,"President Trump still has no plan to address COVID-19.

He quit on you, on your family, on America. He just wants us to grow numb to the horrors of the death toll and the pain.

We cannot afford another four years of his failed leadership."
1322531268152729601,2020-10-31T13:30:00.000Z,939091,@JoeBiden,Joe Biden,Politician,"Every single American deserves access to regular, reliable, and free COVID-19 testing. Period."
1322536634085187588,2020-10-31T13:51:19.000Z,939091,@JoeBiden,Joe Biden,Politician,"RT @TeamJoe: 🚨3 days until Election Day🚨 

It’s not too late to volunteer with our campaign. 

See how to get involved this weekend!  

htt…"
1322543347236438016,2020-10-31T14:18:00.000Z,939091,@JoeBiden,Joe Biden,Politician,Be a patriot. Wear a mask. https://t.co/o2v9xP24A9
1322551400191135744,2020-10-31T14:50:00.000Z,939091,@JoeBiden,Joe Biden,Politician,"The urgency of this election couldn’t be greater — and the stakes couldn’t be higher. 

Don’t wait: go to https://t.co/eoxT07d7QB and vote early today."
1322561466357211136,2020-10-31T15:30:00.000Z,939091,@JoeBiden,Joe Biden,Politician,"3 days.

Stay empowered, stay optimistic, stay united."
1322569017412997122,2020-10-31T16:00:00.000Z,939091,@JoeBiden,Joe Biden,Politician,Who let all these people into my basement? https://t.co/E17SPqmXib
1322585061452034048,2020-10-31T17:03:45.000Z,939091,@JoeBiden,Joe Biden,Politician,"Folks, we’re just three days from Election Day — and what you do between now and when polls close on Tuesday will determine the course of our country for generations to come. 

Sign up to help us get voters to the polls: https://t.co/WSKsQEip4U"
1322588817795260418,2020-10-31T17:18:41.000Z,939091,@JoeBiden,Joe Biden,Politician,RT @springsteen: This is @joebiden’s hometown. This is more than where he’s from. This is who he’s for. https://t.co/6ZSK3dXY4H
1322598107809394689,2020-10-31T17:55:36.000Z,939091,@JoeBiden,Joe Biden,Politician,"With just three days to go, @BarackObama and I are back together on the campaign trail in Michigan. Tune in. https://t.co/8jqYUvbTz9"
1322613077997740032,2020-10-31T18:55:05.000Z,939091,@JoeBiden,Joe Biden,Politician,"RT @TeamJoe: Voting Update! Early vote hours have been extended in Douglas County, NE to 5:00 PM today. 

Find your early voting location a…"
1322613559491284994,2020-10-31T18:57:00.000Z,939091,@JoeBiden,Joe Biden,Politician,"If you’re planning to vote early in-person, today is your last day to do so in many states. Head to https://t.co/eoxT07d7QB to find all the information you need to cast your ballot. https://t.co/CL7abyUo5p"
1322620606098137088,2020-10-31T19:25:00.000Z,939091,@JoeBiden,Joe Biden,Politician,President Obama and I left President Trump a playbook on how to deal with pandemics. He flat-out ignored it. And we're suffering every day because of it.
1322623616568168448,2020-10-31T19:36:58.000Z,939091,@JoeBiden,Joe Biden,Politician,"RT @BarackObama: Don't boo — vote! Happy Halloween, everybody. https://t.co/XdZz4dh82T https://t.co/A28ZuxPf4i"
1322631427297476608,2020-10-31T20:08:00.000Z,939091,@JoeBiden,Joe Biden,Politician,".@BarackObama already voted, but he knows there's still more work to be done before Election Day.

Sign up to join him: https://t.co/UIiNehABm6 https://t.co/8qgmrxEDny"
1322639650029293569,2020-10-31T20:40:40.000Z,939091,@JoeBiden,Joe Biden,Politician,"RT @DrBiden: Is your ballot still sitting at home? I’m asking you to:

• Fill it out.
• Sign it.
• Seal it.
• Deliver it. https://t.co/CDGl…"
1322640738648313856,2020-10-31T20:45:00.000Z,939091,@JoeBiden,Joe Biden,Politician,"As president, I will choose: 

Hope, not fear.
Peace, not violence.
Generosity, not greed.
 
I’ll appeal to the best in us, not the worst."
1322646873081966593,2020-10-31T21:09:22.000Z,939091,@JoeBiden,Joe Biden,Politician,"There is too much at stake on Tuesday to sit this election out. Tune in as @BarackObama, @StevieWonder, and I get out the vote in Detroit, Michigan. https://t.co/ihywYiR6lc"
1322678924485296129,2020-10-31T23:16:44.000Z,939091,@JoeBiden,Joe Biden,Politician,"RT @TeamJoe: At the young age of 102, Pearl Wachman talks about the remarkable story of American progress and how we must mobilize and vote…"
1322679745662881798,2020-10-31T23:20:00.000Z,939091,@JoeBiden,Joe Biden,Politician,"Presidents lead by example.

Mask up. https://t.co/eSvTmjmaYK"
1322685282165026817,2020-10-31T23:42:00.000Z,939091,@JoeBiden,Joe Biden,Politician,"I want to extend my prayers and condolences to the Chaldean Assyrian Community this 10th anniversary of Our Lady of Deliverance church massacre in Baghdad. The right to worship is fundamental, and as Americans we should be proud that people from around the world find a home here."
1322688553650827264,2020-10-31T23:55:00.000Z,939091,@JoeBiden,Joe Biden,Politician,Happy Halloween! https://t.co/i2BT7k0xdI
1322692328591552512,2020-11-01T00:10:00.000Z,939091,@JoeBiden,Joe Biden,Politician,"Tonight marks our last end-of-month fundraising deadline — and it’s our most important one yet.

With three days until Election Day, we can’t afford to fall short.

If you’re able, please chip in to help us reach our goal: https://t.co/avjGKglNpD"
1322695600106659840,2020-11-01T00:23:00.000Z,939091,@JoeBiden,Joe Biden,Politician,President Trump doesn’t care about you. He doesn’t even care about his own supporters. https://t.co/HUbImXyRtY
1322699878196301832,2020-11-01T00:40:00.000Z,939091,@JoeBiden,Joe Biden,Politician,"You’re absolutely right, Brayden — no one should ever underestimate the American people. https://t.co/aCsdIWmF62"
1322705178622070784,2020-11-01T01:01:03.000Z,939091,@JoeBiden,Joe Biden,Politician,"Vote for equality.
Vote for the planet.
Vote for justice.
Vote for the future.
 
https://t.co/eoxT07d7QB"
1322709944509124613,2020-11-01T01:20:00.000Z,939091,@JoeBiden,Joe Biden,Politician,"Together, we can end the last four years of chaos.

https://t.co/eoxT07d7QB https://t.co/V2EMJnkqSC"
1322714977715785729,2020-11-01T01:40:00.000Z,939091,@JoeBiden,Joe Biden,Politician,"Un número récord de latinos son elegibles para votar en esta elección, así que ve a votar para lograr que tu voz se escuche. No dejes que los demás decidan por ti.

https://t.co/eeAbclJjDY https://t.co/vOsq6xw2eX"
1322721017811345410,2020-11-01T02:04:00.000Z,939091,@JoeBiden,Joe Biden,Politician,"The hard truth is that under President Trump, we’ve become weaker, sicker, poorer, more divided, and more violent."
1322725547504328704,2020-11-01T02:22:00.000Z,939091,@JoeBiden,Joe Biden,Politician,We can and will solve the climate crisis — together. https://t.co/3KbdJ5s5Z6
1322730450293587968,2020-11-01T02:41:29.000Z,939091,@JoeBiden,Joe Biden,Politician,"The character of our nation is on the ballot.

Vote: https://t.co/eoxT07d7QB"
1322735117387943939,2020-11-01T03:00:01.000Z,939091,@JoeBiden,Joe Biden,Politician,"To all the heroes who have served in our armed forces, and the families and caregivers who sacrificed alongside them, I promise I’ll always have your back. https://t.co/TrvHFeMHK1"
1322740143741005825,2020-11-01T03:20:00.000Z,939091,@JoeBiden,Joe Biden,Politician,"The words of a president matter. And time and time again, Donald Trump has callously used his to incite violence, stoke the flames of hatred and division, and drive us further apart.

It’s time for it to end."
1322746435071139840,2020-11-01T03:45:00.000Z,939091,@JoeBiden,Joe Biden,Politician,".@BarackObama and I have seen the office of the presidency up close, we know what the job entails, and there's too much at stake to give Donald Trump another four years.

Vote: https://t.co/eoxT07uII9 https://t.co/7imuWqlZSN"
1322751468827541510,2020-11-01T04:05:00.000Z,939091,@JoeBiden,Joe Biden,Politician,"The issues we’re facing are far bigger than any political party.

It’s why I’ll be a president for all Americans — Democrats, Republicans, and Independents alike — because I believe we must work together if we’re going to get anything done."
1322757759591436288,2020-11-01T04:30:00.000Z,939091,@JoeBiden,Joe Biden,Politician,Vote like your health care is on the ballot — because it is. https://t.co/eoxT07d7QB
1322865972819251200,2020-11-01T11:40:00.000Z,939091,@JoeBiden,Joe Biden,Politician,"As president, I’ll build an economy that rewards work — not just wealth."
1322871257902145536,2020-11-01T12:01:00.000Z,939091,@JoeBiden,Joe Biden,Politician,Let’s put dogs back in the White House. https://t.co/7pBihksfXT
1322876039144636417,2020-11-01T12:20:00.000Z,939091,@JoeBiden,Joe Biden,Politician,"We have in our hands the ultimate power: the power of the vote.

Don’t let it go to waste. Make your plan to vote today. https://t.co/uoiVh9ZqzI"
1322881072363917312,2020-11-01T12:40:00.000Z,939091,@JoeBiden,Joe Biden,Politician,"We need to:

Build bridges, not walls.
Open our arms, not clench our fists.
Focus on the ties that bind us together, not tear each other apart.

We need to be what we are at our best: One America."
1322886357535150081,2020-11-01T13:01:00.000Z,939091,@JoeBiden,Joe Biden,Politician,Jodie –– you have my word: I will always stand up for you and the millions of Americans with pre-existing conditions. https://t.co/p7VxJVFf9G
1322892363350577154,2020-11-01T13:24:52.000Z,939091,@JoeBiden,Joe Biden,Politician,"Return your ballot today, folks.

https://t.co/eoxT07d7QB"
1322896675040456704,2020-11-01T13:42:00.000Z,939091,@JoeBiden,Joe Biden,Politician,"Right now:
 
- Almost 23 million Americans are on unemployment
- Nearly 1 in 5 small businesses have closed their doors
- Millions of people are at risk of being evicted
 
We simply can’t afford another four years of Donald Trump."
1322901204943491073,2020-11-01T14:00:00.000Z,939091,@JoeBiden,Joe Biden,Politician,"My faith has been a source of immeasurable solace in times of grief and a daily inspiration to fight against the abuse of power in all its forms. As president, it will continue to serve as my anchor, as it has my entire life. https://t.co/C5OqUaJKWd"
1322907244871102464,2020-11-01T14:24:00.000Z,939091,@JoeBiden,Joe Biden,Politician,I promise you this: I’ll end Donald Trump’s chaos and end this crisis.
