1384645067672104961,2021-04-20T23:08:04.000Z,939091,@JoeBiden,Joe Biden,Politician,RT @WhiteHouse: Live: President Biden and Vice President Harris address the nation on the verdict in the trial of Derek Chauvin. https://t.…
1384648033024020485,2021-04-20T23:19:51.000Z,939091,@JoeBiden,Joe Biden,Politician,"RT @POTUS: Today, a jury in Minnesota found former Minneapolis Police Officer Derek Chauvin guilty of murdering George Floyd.
 
The verdict…"
1384907441264025604,2021-04-21T16:30:38.000Z,939091,@JoeBiden,Joe Biden,Politician,"RT @POTUS: The guilty verdict does not bring back George Floyd. But through the family’s pain, they are finding purpose so George’s legacy…"
1385281546932916224,2021-04-22T17:17:12.000Z,939091,@JoeBiden,Joe Biden,Politician,RT @POTUS: America is back. We rejoined the Paris Agreement and are ready to rally the world to tackle the climate crisis. Let’s do this.
1385281605757964288,2021-04-22T17:17:26.000Z,939091,@JoeBiden,Joe Biden,Politician,"RT @WhiteHouse: Before taking office, President Biden set a bold goal of 100 million shots in his first 100 days.
 
After reaching the goal…"
1385624057916362752,2021-04-23T15:58:13.000Z,939091,@JoeBiden,Joe Biden,Politician,Heading back to Georgia with @DrBiden next Thursday to mark 100 days of our administration and thank folks for helping us build back better as a nation. See you soon!
1385996697180979201,2021-04-24T16:38:57.000Z,939091,@JoeBiden,Joe Biden,Politician,Let’s close the digital divide once and for all. Our American Jobs Plan will make sure every American has access to high-speed internet. https://t.co/Ru1NSfN7C0
1386076233147076608,2021-04-24T21:55:00.000Z,939091,@JoeBiden,Joe Biden,Politician,"RT @POTUS: Before I took office, I promised help was on the way. Just three months in, I’m proud to say help is here. We’ve delivered over…"
1386405977348472834,2021-04-25T19:45:17.000Z,939091,@JoeBiden,Joe Biden,Politician,"RT @POTUS: Just as India sent assistance to the United States as our hospitals were strained early in the pandemic, we are determined to he…"
1386426190861197313,2021-04-25T21:05:37.000Z,939091,@JoeBiden,Joe Biden,Politician,"Get vaccinated, America."
1386757820834586626,2021-04-26T19:03:23.000Z,939091,@JoeBiden,Joe Biden,Politician,"RT @POTUS: Today, we’re launching a new program funded by the American Rescue Plan to provide nutrition assistance to more than 30 million…"
1386805471084941312,2021-04-26T22:12:44.000Z,939091,@JoeBiden,Joe Biden,Politician,"The American Jobs Plan will strengthen unions, help protect workers, and rebuild our economy. https://t.co/sHNa1eRfiB"
1387127637164822529,2021-04-27T19:32:54.000Z,939091,@JoeBiden,Joe Biden,Politician,"RT @POTUS: I believe no one should work full time and still live in poverty. That’s why today, I raised the minimum wage to $15 an hour for…"
1387154433985888260,2021-04-27T21:19:23.000Z,939091,@JoeBiden,Joe Biden,Politician,"With the first 100 days of our administration under our belt, America is getting back on track—all thanks to the support of grassroots volunteers. Help us keep the momentum going by joining our Week of Action: https://t.co/alyMSnBATt"
1387421807158890507,2021-04-28T15:01:50.000Z,939091,@JoeBiden,Joe Biden,Politician,"Before tonight’s joint address to Congress, join @DrBiden and Mayor @KeishaBottoms for a call to thank our grassroots supporters. Sign up here to join them: https://t.co/tF9AJStpL6"
1387476414098780165,2021-04-28T18:38:49.000Z,939091,@JoeBiden,Joe Biden,Politician,"RT @POTUS: To make tonight’s joint address accessible for all Americans, every White House livestream will have American Sign Language (ASL…"
1387572764740145157,2021-04-29T01:01:41.000Z,939091,@JoeBiden,Joe Biden,Politician,"Together, we’re getting back on track. Tune in now for our administration’s first joint address to Congress. https://t.co/WWjl35N2Em"
1387577532510310401,2021-04-29T01:20:38.000Z,939091,@JoeBiden,Joe Biden,Politician,"RT @POTUS: 100 days ago, America’s house was on fire. We had to act, so we:

- Passed the American Rescue Plan
- Administered over 200 mill…"
1387585909378461702,2021-04-29T01:53:55.000Z,939091,@JoeBiden,Joe Biden,Politician,"RT @POTUS: Trickle-down economics has never worked.

It’s time to grow the economy from the bottom up and middle out."
1387591082918260740,2021-04-29T02:14:29.000Z,939091,@JoeBiden,Joe Biden,Politician,"RT @POTUS: If we are to truly restore the soul of America, then we need to protect the sacred right to vote.

Congress should pass H.R. 1 a…"
1387800729281236997,2021-04-29T16:07:32.000Z,939091,@JoeBiden,Joe Biden,Politician,100 days in—and America is getting back on track.
1387861106966806536,2021-04-29T20:07:27.000Z,939091,@JoeBiden,Joe Biden,Politician,"In Georgia with @DrBiden to celebrate the successes of the first 100 days of the Biden-Harris administration. Jobs are coming back, folks are getting vaccinated, and better days are ahead. Tune in. 
https://t.co/v1B30kekja"
1388204128074076161,2021-04-30T18:50:30.000Z,939091,@JoeBiden,Joe Biden,Politician,RT @POTUS: Join me at Philadelphia’s 30th Street Station as we celebrate Amtrak’s 50th Anniversary. https://t.co/HuPetlGvaU
1388262351967825928,2021-04-30T22:41:52.000Z,939091,@JoeBiden,Joe Biden,Politician,"Thank you, Georgia, for everything. https://t.co/1Ci4pFJ4os"
1388533738934579201,2021-05-01T16:40:15.000Z,939091,@JoeBiden,Joe Biden,Politician,We’ve never been more optimistic about the future of America. https://t.co/EBHlCb2P84
1388540850167287811,2021-05-01T17:08:31.000Z,939091,@JoeBiden,Joe Biden,Politician,"RT @POTUS: This May, during Asian American and Native Hawaiian/Pacific Islander Heritage Month, we recognize the history and achievements o…"
1388557988932333574,2021-05-01T18:16:37.000Z,939091,@JoeBiden,Joe Biden,Politician,"RT @TheDemocrats: Elections make a difference. Thank you, Georgia. https://t.co/hKn1vIIr7Y"
1388581577714720772,2021-05-01T19:50:21.000Z,939091,@JoeBiden,Joe Biden,Politician,Democracy can deliver for the American people. https://t.co/UZ4BDIVoPf
1388957075703803906,2021-05-02T20:42:27.000Z,939091,@JoeBiden,Joe Biden,Politician,"America is on the move again. 

We are choosing hope over fear. 
Truth over lies. 
Light over darkness. 

There’s nothing we cannot do if we do it together."
1389212356736126976,2021-05-03T13:36:50.000Z,939091,@JoeBiden,Joe Biden,Politician,RT @POTUS: Teachers are an extraordinary force for good in our nation — I’m lucky enough to be married to one and have seen firsthand how h…
1389328881652572166,2021-05-03T21:19:52.000Z,939091,@JoeBiden,Joe Biden,Politician,"Georgia, when you sent @Ossoff and @ReverendWarnock to the Senate, you made history. Thank you. https://t.co/47KY4Tm9hv"
1389656643852451847,2021-05-04T19:02:17.000Z,939091,@JoeBiden,Joe Biden,Politician,RT @POTUS: Our goal by July 4th is to have 70% of adult Americans with at least one shot — and 160 million Americans fully vaccinated. It’s…
1390016508559077380,2021-05-05T18:52:15.000Z,939091,@JoeBiden,Joe Biden,Politician,"RT @POTUS: If we want our economy to recover in a way that deals everyone in, then our restaurants need a seat at the table — with the Amer…"
1390345049716805632,2021-05-06T16:37:45.000Z,939091,@JoeBiden,Joe Biden,Politician,RT @WhiteHouse: This week we launched the Restaurant Revitalization Fund to provide direct relief to restaurants and other hard-hit food es…
1390698029376843789,2021-05-07T16:00:22.000Z,939091,@JoeBiden,Joe Biden,Politician,RT @POTUS: Tune in as I discuss the April jobs report. https://t.co/BUZiB5w1gj
1390763244713922561,2021-05-07T20:19:31.000Z,939091,@JoeBiden,Joe Biden,Politician,"Since the beginning of our administration, the economy has added more than 1.5 million jobs. 

We’ve still got work to do, but America is moving in the right direction. https://t.co/B0bNPXNSKe"
1391036614361616389,2021-05-08T14:25:47.000Z,939091,@JoeBiden,Joe Biden,Politician,RT @POTUS: I am proud of the people I go to work with at the White House every day — but my pride can’t hold a candle to that of their moth…
1391058805509742599,2021-05-08T15:53:58.000Z,939091,@JoeBiden,Joe Biden,Politician,Nearly 90% of the infrastructure jobs created in the American Jobs Plan don't require a college degree. It’s a blue-collar blueprint to build America.
1391422726389309447,2021-05-09T16:00:04.000Z,939091,@JoeBiden,Joe Biden,Politician,"To moms everywhere, wishing you a safe and happy Mother’s Day. 

Share your favorite quote from your mother below. https://t.co/6gZ1siDh5y"
1391501156183068678,2021-05-09T21:11:43.000Z,939091,@JoeBiden,Joe Biden,Politician,RT @POTUS: This has been an extraordinarily tough year for moms across this country. To all the moms who have carried us through this pande…
1391796788055711753,2021-05-10T16:46:27.000Z,939091,@JoeBiden,Joe Biden,Politician,"The American Families Plan addresses four of the biggest challenges facing American families:
✅Access to a good education, including universal Pre-K
✅Quality, affordable child care
✅Up to 12 weeks of paid family and medical leave
✅Money directly into the pockets of families"
1392184052128657414,2021-05-11T18:25:18.000Z,939091,@JoeBiden,Joe Biden,Politician,RT @POTUS: We’re working hard to ensure transportation is less of a barrier when it comes to getting a COVID-19 vaccine. And I’m excited to…
1392226915973488642,2021-05-11T21:15:37.000Z,939091,@JoeBiden,Joe Biden,Politician,"We’re vaccinating the nation. We’re creating hundreds of thousands of jobs. We’re delivering real results people can see and feel in their own lives.
  
That’s the essence of America. That’s democracy in action."
1392584115619303425,2021-05-12T20:55:00.000Z,939091,@JoeBiden,Joe Biden,Politician,"RT @POTUS: Tomorrow we will cross 250 million vaccine shots administered since we took office. 

It’s a truly remarkable achievement for th…"
1392589979851841538,2021-05-12T21:18:18.000Z,939091,@JoeBiden,Joe Biden,Politician,Getting a COVID-19 vaccine has never been easier. Go to https://t.co/EwdQ2dFHwG to find a location near you.
1392887195418120192,2021-05-13T16:59:20.000Z,939091,@JoeBiden,Joe Biden,Politician,RT @POTUS: My Administration has mobilized a whole-of-government response to get more fuel quickly and safely to where it is needed and to…
1392907845578940419,2021-05-13T18:21:24.000Z,939091,@JoeBiden,Joe Biden,Politician,"RT @WhiteHouse: Big news from the CDC: If you’re fully vaccinated, you do not need to wear a mask – indoors or outdoors, in most settings.…"
1392932580027248645,2021-05-13T19:59:41.000Z,939091,@JoeBiden,Joe Biden,Politician,"Today is a great day for America in our long battle with COVID-19. 

Just a few hours ago, the CDC announced they are no longer recommending that fully vaccinated people need to wear masks."
1392934633814253573,2021-05-13T20:07:50.000Z,939091,@JoeBiden,Joe Biden,Politician,Getting vaccinated is easier than ever. You can find a vaccine site near you by texting your ZIP code to 438829.
1392935976125833226,2021-05-13T20:13:10.000Z,939091,@JoeBiden,Joe Biden,Politician,"After a year of hard work and so much sacrifice, the rule is now simple: get vaccinated or wear a mask until you do."
1392958441807912962,2021-05-13T21:42:27.000Z,939091,@JoeBiden,Joe Biden,Politician,"This was made possible by the extraordinary success we’ve had in vaccinating so many Americans, so quickly. https://t.co/gTwM6Tp7lF"
1392979240681881603,2021-05-13T23:05:05.000Z,939091,@JoeBiden,Joe Biden,Politician,The CDC announced that they are no longer recommending that fully vaccinated people need to wear masks. https://t.co/pFhJEtBepq
1393291157816365059,2021-05-14T19:44:32.000Z,939091,@JoeBiden,Joe Biden,Politician,"RT @POTUS: This is our moment to build an economy that works for everyone — not just the super-wealthy and giant corporations. 
 
Let’s get…"
1393580530021588994,2021-05-15T14:54:24.000Z,939091,@JoeBiden,Joe Biden,Politician,"RT @POTUS: I know folks have a lot of questions about COVID-19, the vaccines, and the latest mask guidance. So, we had the nation’s top exp…"
1394396502697680900,2021-05-17T20:56:47.000Z,939091,@JoeBiden,Joe Biden,Politician,"RT @POTUS: On this International Day Against Homophobia, Transphobia, and Biphobia, the message from the United States is clear: everyone d…"
1394426550733443079,2021-05-17T22:56:11.000Z,939091,@JoeBiden,Joe Biden,Politician,The light at the end of the tunnel is growing brighter every day. https://t.co/McB4q1bqX4
1394459502011891712,2021-05-18T01:07:07.000Z,939091,@JoeBiden,Joe Biden,Politician,"In the battle against the COVID-19 pandemic, our nation is going to be the arsenal of vaccines for the rest of the world. https://t.co/LwU7Olic2V"
1394674549703286791,2021-05-18T15:21:39.000Z,939091,@JoeBiden,Joe Biden,Politician,"Help spread the word: From May 24 until July 4, Uber and Lyft will offer everyone in America free rides to and from COVID-19 vaccination sites."
1394775653162098691,2021-05-18T22:03:24.000Z,939091,@JoeBiden,Joe Biden,Politician,"RT @POTUS: Being at Ford’s Rouge Electric Vehicle Center today brought me home. For more than thirty years, my Dad managed car dealerships…"
1394792535923507200,2021-05-18T23:10:29.000Z,939091,@JoeBiden,Joe Biden,Politician,Text your ZIP code to 438829 to find COVID-19 vaccination locations near you.
1395125579284983810,2021-05-19T21:13:52.000Z,939091,@JoeBiden,Joe Biden,Politician,"We’re counting on you to roll up your sleeve, get vaccinated, and work together to change the course of this pandemic. 

Go to https://t.co/EwdQ2dFHwG to find the nearest place you can get a COVID-19 vaccine."
1395183696769077248,2021-05-20T01:04:49.000Z,939091,@JoeBiden,Joe Biden,Politician,"Our country is moving in the right direction, but there’s still work to do to dig our way out of an economic collapse.

We must pass the American Jobs Plan to create millions of good-paying jobs rebuilding our country’s infrastructure."
1395469725493342210,2021-05-20T20:01:23.000Z,939091,@JoeBiden,Joe Biden,Politician,"RT @POTUS: Incidents of hate against Asian Americans have seen a shocking spike over the last year. It’s wrong — and it’s un-American.
 
To…"
1395499181226266625,2021-05-20T21:58:26.000Z,939091,@JoeBiden,Joe Biden,Politician,"There are millions of Americans who, through no fault of their own, have been knocked flat on their back this past year. We’re determined to give them a fighting chance. That’s why we’ve been focused on vaccinating the nation and getting our economy running again."
1395772093422317579,2021-05-21T16:02:53.000Z,939091,@JoeBiden,Joe Biden,Politician,"Folks, let’s beat this virus once and for all. 
🔍 Visit https://t.co/EwdQ2dFHwG
💬 Text your ZIP code to 438829
📞 Call 1 (800) 232-0233

Together, #WeCanDoThis."
1396140096269824008,2021-05-22T16:25:12.000Z,939091,@JoeBiden,Joe Biden,Politician,"The American Families Plan is a once-in-a-generation investment in the foundations of middle-class prosperity: education, health care, and child care."
1396539256298954756,2021-05-23T18:51:19.000Z,939091,@JoeBiden,Joe Biden,Politician,"RT @POTUS: Since we took office, hunger rates have dropped 43% among adults. They’re at their lowest rates since the start of the pandemic.…"
1396579064777953285,2021-05-23T21:29:30.000Z,939091,@JoeBiden,Joe Biden,Politician,"More than 20,000 pharmacies coast to coast are now offering walk-in vaccinations with no appointment necessary. Find a location near you at https://t.co/EwdQ2dFHwG."
1396849087845179394,2021-05-24T15:22:29.000Z,939091,@JoeBiden,Joe Biden,Politician,"RT @POTUS: The recent attacks on the Jewish community are despicable, and they must stop. I condemn this hateful behavior at home and abroa…"
1396886878045970434,2021-05-24T17:52:39.000Z,939091,@JoeBiden,Joe Biden,Politician,"The American Rescue Plan is helping get us out of this crisis and back on track—but we can’t stop now. 

We must pass the American Jobs Plan to deliver millions of good-paying jobs."
1396938703109492741,2021-05-24T21:18:35.000Z,939091,@JoeBiden,Joe Biden,Politician,"After meeting with experts and scientists, our administration has set an ambitious goal of having 70% of the U.S. adult population receive at least one dose of vaccine by July 4. 

It’s a big goal, but we are already doing a remarkable job—together, we’ll get through this."
1397249167286841347,2021-05-25T17:52:15.000Z,939091,@JoeBiden,Joe Biden,Politician,"RT @POTUS: It’s been one year since George Floyd was murdered. In that time, George’s family has shown extraordinary courage. Last month’s…"
1397297809410433027,2021-05-25T21:05:32.000Z,939091,@JoeBiden,Joe Biden,Politician,"Across the country, we have failed to properly invest in infrastructure for half a century. The American Jobs Plan will get millions of Americans good-paying union jobs repairing our country’s crumbling infrastructure.

It’s a blue-collar blueprint to rebuild America."
1397655816426119173,2021-05-26T20:48:08.000Z,939091,@JoeBiden,Joe Biden,Politician,"Enjoyed meeting with Maria and Dreamers this month. Dreamers are Americans, and we are fighting for them. https://t.co/3Hfa0xNnFN"
1397694754528313350,2021-05-26T23:22:52.000Z,939091,@JoeBiden,Joe Biden,Politician,"RT @POTUS: We are still awaiting many of the details of this latest mass shooting in San Jose, but there are some things we know for sure.…"
1397980959723696137,2021-05-27T18:20:08.000Z,939091,@JoeBiden,Joe Biden,Politician,RT @POTUS: Tune in as I deliver remarks on our economic progress and share my vision for the future. https://t.co/h5ULW6rjJ7
1398039819947741185,2021-05-27T22:14:02.000Z,939091,@JoeBiden,Joe Biden,Politician,The Biden economic plan is working. https://t.co/boXNRUWEvi
1398083579075350528,2021-05-28T01:07:55.000Z,939091,@JoeBiden,Joe Biden,Politician,"This is our moment to rebuild an economy from the bottom up and the middle out—not trickle down.

This is our moment to rebuild an economy that rewards work, not just wealth.

This is our moment to rebuild an economy that works for the backbone of this country."
1398293173349277704,2021-05-28T15:00:46.000Z,939091,@JoeBiden,Joe Biden,Politician,RT @POTUS: America is on the move again. We’ve turned the tide on a once-in-a-century pandemic and a once-in-a-generation economic crisis.…
1398335999349035012,2021-05-28T17:50:56.000Z,939091,@JoeBiden,Joe Biden,Politician,"To put it simply, America's coming back. https://t.co/SYN7NZkH91"
1398385137402843137,2021-05-28T21:06:12.000Z,939091,@JoeBiden,Joe Biden,Politician,"Before we took office, the economy added back 60,000 jobs per month. It’s now adding back 500,000 jobs per month.

In fact, we've created 1.5 million jobs—more jobs than have ever been created in the first three months of any president in our nation's history."
1398663242675806212,2021-05-29T15:31:17.000Z,939091,@JoeBiden,Joe Biden,Politician,"Grassroots supporters made it possible for us to pass the American Rescue Plan and start getting our country back on track—but our work is far from over. Please consider chipping in to support Democrats running for office in 2021, 2022, and beyond.
https://t.co/XfbPPFvKr8"
1399370630039052292,2021-05-31T14:22:11.000Z,939091,@JoeBiden,Joe Biden,Politician,RT @POTUS: Tune in as we honor our fallen heroes at the 153rd National Memorial Day Observance. https://t.co/p9DJ1LparL
1399444224102305792,2021-05-31T19:14:38.000Z,939091,@JoeBiden,Joe Biden,Politician,"RT @POTUS: On Memorial Day, we honor and reflect upon the courage, integrity, and selfless dedication of the members of our Armed Forces wh…"
1399734647463071745,2021-06-01T14:28:40.000Z,939091,@JoeBiden,Joe Biden,Politician,"RT @POTUS: 100 years ago, the thriving Black community of Greenwood in Tulsa, Oklahoma was ruthlessly attacked by a white supremacist mob—a…"
1400145643881091072,2021-06-02T17:41:49.000Z,939091,@JoeBiden,Joe Biden,Politician,Congratulations to Congresswoman-elect @MelanieforNM on your victory last night. Your grit and determination will help deliver real results for all New Mexicans. #NM01 is in good hands.
1400196973542653952,2021-06-02T21:05:47.000Z,939091,@JoeBiden,Joe Biden,Politician,"RT @POTUS: Today, we are announcing a month-long effort to get 70% of adult Americans vaccinated. It will take everyone doing their part so…"
1400198463955083268,2021-06-02T21:11:42.000Z,939091,@JoeBiden,Joe Biden,Politician,What happened in Tulsa 100 years ago was not a riot—it was a massacre. https://t.co/V305EfjQLZ
1400254337914449923,2021-06-03T00:53:44.000Z,939091,@JoeBiden,Joe Biden,Politician,It’s going to take everyone working together to get 70% of adult Americans vaccinated. https://t.co/UIb8GlS8EU
1400562637491126274,2021-06-03T21:18:48.000Z,939091,@JoeBiden,Joe Biden,Politician,RT @POTUS: Unemployment claims are down 50% and 64% of adults are vaccinated since I took office. That’s progress. https://t.co/Ih9yrK5azD
1400570532966420483,2021-06-03T21:50:11.000Z,939091,@JoeBiden,Joe Biden,Politician,This is the United States of America. There's not a single thing beyond our capacity when we act together.
1400814403566587918,2021-06-04T13:59:14.000Z,939091,@JoeBiden,Joe Biden,Politician,"RT @POTUS: Today’s jobs report shows historic progress for American families and the American economy. We added 559,000 jobs in May, create…"
1400913089164365831,2021-06-04T20:31:22.000Z,939091,@JoeBiden,Joe Biden,Politician,Unemployment is at its lowest level since the pandemic started. Our plan is working. And we’re not going to let up now. https://t.co/wqkS8Sbs6U
1400956951559823363,2021-06-04T23:25:40.000Z,939091,@JoeBiden,Joe Biden,Politician,"Now is the time to build on the foundation we've laid. Because while the progress we’ve made is undeniable, it is not assured. That's why we need the American Jobs Plan and the American Families Plan—let's make those investments today to be able to continue to succeed tomorrow."
1401231536423329793,2021-06-05T17:36:46.000Z,939091,@JoeBiden,Joe Biden,Politician,"After decades of disinvestment, our roads, bridges, and water systems are crumbling.

We must pass the American Jobs Plan. Together, we will rebuild our country’s infrastructure and create millions of good-paying union jobs in the process."
1401243444127879170,2021-06-05T18:24:05.000Z,939091,@JoeBiden,Joe Biden,Politician,RT @POTUS: Great news folks: we hit record-high health care enrollment. 31 million people now have coverage through the Affordable Care Act…
1401310832882077696,2021-06-05T22:51:52.000Z,939091,@JoeBiden,Joe Biden,Politician,We’re counting on you to get vaccinated: https://t.co/EwdQ2dFHwG.
1401579915577806849,2021-06-06T16:41:06.000Z,939091,@JoeBiden,Joe Biden,Politician,"RT @POTUS: I met with survivors of the Tulsa Massacre this week to help fill the silence. Because in silence, wounds deepen. And, as painfu…"
1401632881332699138,2021-06-06T20:11:34.000Z,939091,@JoeBiden,Joe Biden,Politician,"In the competition for the 21st century, the future will be built right here in America."
1401992264516308995,2021-06-07T19:59:38.000Z,939091,@JoeBiden,Joe Biden,Politician,"The United States is the only industrialized country in the world with no national paid family leave policy. It’s a disgrace. 

We must pass the American Families Plan."
1402323753758085128,2021-06-08T17:56:51.000Z,939091,@JoeBiden,Joe Biden,Politician,"RT @POTUS: Folks, the Delta variant — a highly infectious COVID-19 strain — is spreading rapidly among young people between 12 and 20 years…"
1402391817065308168,2021-06-08T22:27:19.000Z,939091,@JoeBiden,Joe Biden,Politician,"We said from the very beginning: there’s no chance for our economy to come back unless we beat the pandemic. And now, after more than a year of darkness, we’re emerging into the light.

Get your vaccine and do your part to help get our country back on track."
1402620803154317315,2021-06-09T13:37:13.000Z,939091,@JoeBiden,Joe Biden,Politician,RT @POTUS: I’m on my way to the U.K. and Europe today for the first foreign trip of my presidency. I know that democracies can rally togeth…
1402700112292425736,2021-06-09T18:52:22.000Z,939091,@JoeBiden,Joe Biden,Politician,"LGBTQ+ rights are human rights. As we celebrate this month, we won’t rest until full equality for LGBTQ+ Americans is finally achieved and codified into law. The Senate must pass the Equality Act."
1403021672735719429,2021-06-10T16:10:08.000Z,939091,@JoeBiden,Joe Biden,Politician,"RT @POTUS: On my first foreign trip, we’re going to make it clear — the United States and the democracies of the world are standing togethe…"
1403037362670743559,2021-06-10T17:12:29.000Z,939091,@JoeBiden,Joe Biden,Politician,"COVID-19 vaccines are free. Get vaccinated, folks."
1403092050292129796,2021-06-10T20:49:47.000Z,939091,@JoeBiden,Joe Biden,Politician,"RT @POTUS: Today, I’m announcing that the United States will donate half a billion new Pfizer vaccines to 92 low- and lower middle-income c…"
1403431826035720196,2021-06-11T19:19:56.000Z,939091,@JoeBiden,Joe Biden,Politician,RT @POTUS: Diplomacy is back. https://t.co/27D316PAqB
1403761926539251718,2021-06-12T17:11:38.000Z,939091,@JoeBiden,Joe Biden,Politician,"RT @POTUS: Five years ago, we suffered the deadliest attack affecting the LGBTQ+ community in our history. Within minutes, Pulse Nightclub…"
1403777473800773635,2021-06-12T18:13:25.000Z,939091,@JoeBiden,Joe Biden,Politician,"The COVID-19 vaccine is free, but lack of access to child care can be a barrier. That’s why four of our nation’s largest child care providers are offering free care for parents and caregivers getting vaccinated from now until July 4: https://t.co/nAUPgjxTWI"
