1505997701305016336,2022-03-21T20:00:06.000Z,1754641,@nytimesbusiness,NYT Business,News,"“Deeper, more diversified international markets remain our best bet for supply resilience.” https://t.co/70aUuc2nol"
1506005256857133056,2022-03-21T20:30:08.000Z,1754641,@nytimesbusiness,NYT Business,News,"Until fairly recently, if you lived anywhere other than San Francisco, it was possible to go days or even weeks without hearing about cryptocurrency. Now, suddenly, it’s inescapable. https://t.co/xY6IqU9jRh"
1506012824883154950,2022-03-21T21:00:12.000Z,1754641,@nytimesbusiness,NYT Business,News,"Thanks to years of investment from local universities, government agencies and business leaders and Canada’s liberal immigration policies, Toronto is now the third-largest tech hub in North America. https://t.co/K9wOENpmx5"
1506045753256460293,2022-03-21T23:11:03.000Z,1754641,@nytimesbusiness,NYT Business,News,"The plane that crashed in a mountainous area of southern China was carrying 132 people aboard, and rescuers who went to the crash site face mountainous terrain and harsh conditions. https://t.co/w0kaKnEYPr"
1506053295739133954,2022-03-21T23:41:01.000Z,1754641,@nytimesbusiness,NYT Business,News,"The invasion of Ukraine has created odd bedfellows as the satellite internet provider OneWeb plans to launch on rockets of SpaceX, OneWeb’s biggest competitor so far. https://t.co/XG4Vo5EmrH"
1506062109465104386,2022-03-22T00:16:02.000Z,1754641,@nytimesbusiness,NYT Business,News,"OneWeb officials said they did not know the fate of the 36 satellites that were to be launched by a Russian rocket before it was canceled: “They were removed from the faring, and I do not personally know whether they are still in Kazakhstan or not.” https://t.co/bSsJSpXi8Z"
1506068654420787202,2022-03-22T00:42:03.000Z,1754641,@nytimesbusiness,NYT Business,News,"Toronto is the third-largest tech hub in North America, trailing only New York and Silicon Valley, @cademetz reports. https://t.co/UeWsPKOfGP"
1506075709965488131,2022-03-22T01:10:05.000Z,1754641,@nytimesbusiness,NYT Business,News,"A wire transfer controlled by a U.S. hedge fund reveals an operation intended to mask the source of funds from an oligarch with ties close to Vladimir Putin, @mattgoldstein26 and @davidenrich write. https://t.co/ydGpr8lron"
1506084513411223558,2022-03-22T01:45:04.000Z,1754641,@nytimesbusiness,NYT Business,News,"When @kevinroose couldn’t find a sober, dispassionate explanation of what crypto actually is, he created one. https://t.co/mPOAkBFpjc"
1506090550239322112,2022-03-22T02:09:03.000Z,1754641,@nytimesbusiness,NYT Business,News,The world’s largest oil company is expected to increase capital spending to as much as $50 billion in 2022 from $31.9 billion in 2021. https://t.co/LDqLSlctIf
1506098098086584320,2022-03-22T02:39:03.000Z,1754641,@nytimesbusiness,NYT Business,News,"Companies are rushing forward with offers of employment for Ukrainian refugees. Despite the good will, there are challenges, @LizAldermanNYT and @PatcohenNYT write. https://t.co/UNybe7zsYP"
1506107154129895427,2022-03-22T03:15:02.000Z,1754641,@nytimesbusiness,NYT Business,News,"Days after the Federal Reserve raised interest rates by a quarter point, its chair is foreshadowing a potentially more aggressive path, @jeannasmialek reports. https://t.co/Ra23DM6rrp"
1506118861694853123,2022-03-22T04:01:33.000Z,1754641,@nytimesbusiness,NYT Business,News,"The way one hedge fund received a Russian investor’s money shows the challenges facing the U.S. as it tracks down the assets of oligarchs, @mattgoldstein26 and @davidenrich. https://t.co/PQJXPXpZWX"
1506125094774620164,2022-03-22T04:26:19.000Z,1754641,@nytimesbusiness,NYT Business,News,"“Everyone points to Miami as the next tech hub because it offers low taxes. But it offers little else from a tech point of view,” a venture capitalist said on a visit to Toronto. https://t.co/SzyosmXRDt"
1506128972303716355,2022-03-22T04:41:44.000Z,1754641,@nytimesbusiness,NYT Business,News,"“Our people are not afraid that they will lose their own jobs, because we have enough for everyone,” a Lithuanian labor official said. https://t.co/qJ1zlWUibh"
1506132848583000068,2022-03-22T04:57:08.000Z,1754641,@nytimesbusiness,NYT Business,News,"“If we conclude that it is appropriate to move more aggressively by raising the federal funds rate by more than 25 basis points at a meeting or meetings, we will do so,” the Federal Reserve chair said. https://t.co/dk9zRtqPZH"
1506142572099551233,2022-03-22T05:35:46.000Z,1754641,@nytimesbusiness,NYT Business,News,"Aramco said it would move into shale drilling by developing a large gas field in eastern Saudi Arabia, @stanleyreed12 writes. https://t.co/0mlSzQixMW"
1506225436736507911,2022-03-22T11:05:03.000Z,1754641,@nytimesbusiness,NYT Business,News,"Facing criticism from politicians and environmentalists, the cryptocurrency mining industry has embarked on a rebranding effort to challenge the view that its electricity-guzzling computers are harmful to the climate. https://t.co/AxUfioEugw"
1506234001459134466,2022-03-22T11:39:05.000Z,1754641,@nytimesbusiness,NYT Business,News,"A 90-minute immersive experience inspired by ""Bridgerton"" is Netflix’s most ambitious real-world event to date, aiming to encourage the kind of water-cooler buzz that streaming services have struggled to create. https://t.co/YWBMjSLCtw"
1506241555035828226,2022-03-22T12:09:05.000Z,1754641,@nytimesbusiness,NYT Business,News,"China Evergrande, the giant embattled property developer, will not be able to publish its annual financial results on time, the company said on Tuesday. The annual statement had been due by March 31. https://t.co/Xd003J7eEs"
1506248077203677188,2022-03-22T12:35:00.000Z,1754641,@nytimesbusiness,NYT Business,News,Image identification and other A.I. tools are terrible at tagging information involving Indigenous culture. Is there a solution? https://t.co/QzcuXMAEuj
1506254401845051394,2022-03-22T13:00:08.000Z,1754641,@nytimesbusiness,NYT Business,News,"A single Bitcoin transaction now requires more than 2,000 kilowatt-hours of electricity, or enough energy to power the average American household for 73 days, researchers estimate. https://t.co/ODPcHIza8z"
1506261964762320907,2022-03-22T13:30:12.000Z,1754641,@nytimesbusiness,NYT Business,News,In today’s DealBook newsletter: The debate over the S.E.C.’s sweeping proposal on climate risks; the coalition pushing back on rules for swaps; the latest upheaval at Boeing; and more. https://t.co/VcAn9eUawu
1506269521904087041,2022-03-22T14:00:13.000Z,1754641,@nytimesbusiness,NYT Business,News,"Pfizer said on Tuesday that it has agreed to sell up to four million treatment courses of its Covid-19 pills for use in 95 lower-income countries that are home to about four billion people, with the first supplies expected to become available next month. https://t.co/o84mfyM8uZ"
1506277057118052372,2022-03-22T14:30:10.000Z,1754641,@nytimesbusiness,NYT Business,News,"China Evergrande blamed “drastic changes” to its business last year for the delay, adding that it would take its auditor a longer time to sift through the paperwork. The annual statement had been due by March 31. https://t.co/h71prohcFZ"
1506284653535285255,2022-03-22T15:00:21.000Z,1754641,@nytimesbusiness,NYT Business,News,"The Queen’s Ball: A Bridgerton Experience, is an immersive, Instagram-ready confection held in the ballrooms of the Millennium Biltmore Hotel in downtown LA and tailor made for die-hard fans of the global Netflix hit. https://t.co/PyLw9da7pD"
1506292159539986437,2022-03-22T15:30:11.000Z,1754641,@nytimesbusiness,NYT Business,News,"China Eastern Airlines Flight 5735, a Boeing 737-800 plane, was making a short trip between two cities in southern China, cruising at an altitude of more than 29,000 feet, when it violently plunged to the ground. Here’s what we know about the crash. https://t.co/zKIwnI8tdk"
1506299748084555795,2022-03-22T16:00:20.000Z,1754641,@nytimesbusiness,NYT Business,News,"Wealthy foreign investors have long been able to move money into American funds using secretive, roundabout setups. Now, as countries impose sanctions on those close to Vladimir Putin, hunting down these fortunes could pose significant challenges. https://t.co/g0dwb8Ul0s"
1506307280148615181,2022-03-22T16:30:16.000Z,1754641,@nytimesbusiness,NYT Business,News,"RT @nytimes: Artificial intelligence tools struggle to identify information involving Indigenous cultures and Native communities, often pro…"
1506314841367191559,2022-03-22T17:00:18.000Z,1754641,@nytimesbusiness,NYT Business,News,"Mark Schoofs, who became the BuzzFeed News EIC in 2020, said in an email to staff members that he would be stepping down and that the “next phase” for the site was to accelerate its timeline to become profitable and that it would need to shrink to do so. https://t.co/WZKZm6IK2t"
1506322368817516549,2022-03-22T17:30:13.000Z,1754641,@nytimesbusiness,NYT Business,News,"In Bitcoin’s early years, a crypto enthusiast could mine coins by running software on a laptop. But as digital assets have become more popular, the amount of power necessary to generate Bitcoin has soared. https://t.co/E27wHF87oX"
1506329941541113857,2022-03-22T18:00:18.000Z,1754641,@nytimesbusiness,NYT Business,News,"The crash of a Boeing jet in China on Monday is the latest crisis for the American plane manufacturer, raising the prospect of renewed regulatory scrutiny and confronting the company with another catastrophe involving its planes. https://t.co/6qMW0tATiF"
1506337462410530820,2022-03-22T18:30:12.000Z,1754641,@nytimesbusiness,NYT Business,News,Toronto is by some measures the hottest tech market in North America -- not those other cities you may have been hearing about. https://t.co/X7ZWm2TheM
1506345063672172553,2022-03-22T19:00:24.000Z,1754641,@nytimesbusiness,NYT Business,News,"Today in On Tech, @shiraovide looks at lessons from the long marriage of technology and imagination in Hollywood and beyond. https://t.co/EGZO0974W4"
1506352583262224392,2022-03-22T19:30:17.000Z,1754641,@nytimesbusiness,NYT Business,News,"Tesla officially began making cars in Europe on Tuesday, opening an assembly plant in a critical market where Elon Musk, the company’s chief executive, plans to build 500,000 electric vehicles a year. https://t.co/clyq1iGcQY"
1506360143633653760,2022-03-22T20:00:19.000Z,1754641,@nytimesbusiness,NYT Business,News,"After years of dithering about investing so much in the natural gas infrastructure, Germany is also accelerating plans to build its own terminals for receiving liquefied natural gas, another fossil fuel. https://t.co/3ZmdkMBlOh"
1506367651219709956,2022-03-22T20:30:09.000Z,1754641,@nytimesbusiness,NYT Business,News,"Last month, a study in the journal Joule found that Bitcoin mining worldwide may be responsible for about 65 megatons of carbon dioxide a year, comparable to the emissions of Greece. https://t.co/XSCXbr0EOS"
1506372610732576768,2022-03-22T20:49:52.000Z,1754641,@nytimesbusiness,NYT Business,News,"Starbucks workers at a store in Seattle, the company’s hometown, voted 9 to 0 to unionize. It was the seventh company-owned U.S. store to do so. https://t.co/FGSgaVOkf8"
1506375274354688013,2022-03-22T21:00:27.000Z,1754641,@nytimesbusiness,NYT Business,News,This 90-minute experience is Netflix’s most ambitious real-world event to date. The streaming giant hopes it will serve as a marketing tool for “Bridgerton” and appeal to the show’s primarily female fan base. https://t.co/wKNjBjz76U
1506405871185801223,2022-03-22T23:02:02.000Z,1754641,@nytimesbusiness,NYT Business,News,"“Security of our energy supply stands above everything else at the moment,” Germany’s economic minister has said. https://t.co/hWWv0fyuMj"
1506414942546710533,2022-03-22T23:38:04.000Z,1754641,@nytimesbusiness,NYT Business,News,"MacKenzie Scott, who promised in 2019 that she would give her fortune away “until the safe is empty,” has donated $436 million to Habitat for Humanity International and its 84 affiliates, the organization said Tuesday. https://t.co/5x2U3Oab6W"
1506425032972582916,2022-03-23T00:18:10.000Z,1754641,@nytimesbusiness,NYT Business,News,Should mask rules on airplanes be suspended? No-mask proponents point out that they’re not required in most other indoor areas. Others want a more careful approach on airplanes. Here’s a look at the confusing state of mask wear in the sky. @heathertal https://t.co/W4ge3lH12x https://t.co/K5UsNmU8dy
1506438851287564292,2022-03-23T01:13:05.000Z,1754641,@nytimesbusiness,NYT Business,News,"Embarking on a rebranding effort, the five largest publicly traded crypto mining companies say they are building or already operating plants powered by renewable energy, @yaffebellany writes. https://t.co/gDcBt4uBmk"
1506447655253258242,2022-03-23T01:48:04.000Z,1754641,@nytimesbusiness,NYT Business,News,"The Queen’s Ball: A Bridgerton Experience is made for die-hard fans of the global Netflix hit. It is also the streaming giant’s most ambitious real-world event to date, @nicsperling reports. https://t.co/AMqF13uaeD"
1506455955122315266,2022-03-23T02:21:02.000Z,1754641,@nytimesbusiness,NYT Business,News,"As Russia’s attack on Ukraine grinds on and energy prices soar, the painful trade-offs of managing Europe’s dependence on fossil fuels have crystallized as never before, @PatcohenNYT and @stanleyreed12 report. https://t.co/2jOKtqy8Nr"
1506481066776961027,2022-03-23T04:00:50.000Z,1754641,@nytimesbusiness,NYT Business,News,"@nicsperling notes that in addition to The Queen’s Ball, Netflix has teamed up with Bloomingdale’s for a pop-up shop both online and at the flagship Manhattan store. https://t.co/EBbDfVt39l"
1506491079490740227,2022-03-23T04:40:37.000Z,1754641,@nytimesbusiness,NYT Business,News,“A lot of those renewable energy producers are still a little bit skeptical of cryptocurrency. The crypto miners don’t have the credit profiles to sign 10- or 15-year deals.” https://t.co/WryQXfybD0
1506494958550884357,2022-03-23T04:56:02.000Z,1754641,@nytimesbusiness,NYT Business,News,@PatcohenNYT and @stanleyreed12 write that the crisis in Ukraine has inspired Europe to reach toward clean energy sources more quickly. But efforts also risk pitching it backward. https://t.co/QYFrSKWU1K
1506587335164629007,2022-03-23T11:03:06.000Z,1754641,@nytimesbusiness,NYT Business,News,China lowered its divorce rate with a rule that forces couples to undergo a 30-day “cooling off” period before finalizing their separation. Now the country needs to reckon with a decline in marriages to face its demographic crisis. https://t.co/tFURqOOWzG
1506596639418499076,2022-03-23T11:40:04.000Z,1754641,@nytimesbusiness,NYT Business,News,"Stewart Brand, considered by many to be one of the U.S.'s pre-eminent futurists, has long had an eerie knack for being able to spot trends early on. Here's what he sees on the horizon. https://t.co/eODDSi5Ph2"
1506602180765261833,2022-03-23T12:02:05.000Z,1754641,@nytimesbusiness,NYT Business,News,The Education Department announced that it will hold companies that own certain private colleges financially responsible for taxpayers’ losses if their schools defraud students or abruptly shut down. https://t.co/Hq9aWYdxaA
1506610483951980546,2022-03-23T12:35:05.000Z,1754641,@nytimesbusiness,NYT Business,News,"For some workers, the pandemic presented an opportunity to change course. 

These are the stories of six people who transformed their careers during the past two years. https://t.co/CcHZF9ttCB"
1506616770957819916,2022-03-23T13:00:04.000Z,1754641,@nytimesbusiness,NYT Business,News,"As war has raged in Ukraine, the Kremlin’s talking points and some right-wing discourse in the U.S. — fueled by those on the far right — have coalesced. Together, they have created an alternate reality. https://t.co/yjKLX6ZRif"
1506624327516663824,2022-03-23T13:30:06.000Z,1754641,@nytimesbusiness,NYT Business,News,In today’s DealBook newsletter: @stephengandel on what markets are saying about the risk of recession; @el72champs on the latest moves to ban U.S. lawmakers from trading stocks; @m_delamerced on a big bet in San Francisco on luxury office space; and more. https://t.co/ChFo2m3VWZ
1506631935841513485,2022-03-23T14:00:20.000Z,1754641,@nytimesbusiness,NYT Business,News,"Vanessa Barboni Hallik started Another Tomorrow as a digital business, relying on social media and search engine advertising to reach potential customers. But opening a store was always part of her plan. https://t.co/xA9xMNLdmW"
1506639460997505026,2022-03-23T14:30:14.000Z,1754641,@nytimesbusiness,NYT Business,News,"Spring break travelers should be prepared for full flights and pricier hotels, especially to the most popular destinations. But with some strategy, they can still find deals. Here’s how. https://t.co/NoLIIJf8zA"
1506647023675654153,2022-03-23T15:00:17.000Z,1754641,@nytimesbusiness,NYT Business,News,"The truth is, gadget upgrades needn’t be so automatic even when software updates stop coming. https://t.co/9GknfKPy4q"
1506654543161044993,2022-03-23T15:30:10.000Z,1754641,@nytimesbusiness,NYT Business,News,"Nestle said Wednesday that it was suspending sales of its KitKat and Nesquik brands in Russia, the latest effort from a global consumer giant to rethink operations in the country as it wages war on Ukraine. https://t.co/iC5sEdWwx5"
1506662307643990016,2022-03-23T16:01:01.000Z,1754641,@nytimesbusiness,NYT Business,News,"Along with a decline in the divorce rate, the number of marriage registrations plunged to a 36-year low in 2021, a worrying sign for officials trying to curb China’s demographic crisis. https://t.co/xnNtMW4oCV"
1506669689459589136,2022-03-23T16:30:21.000Z,1754641,@nytimesbusiness,NYT Business,News,Sanctions aimed at the Russian central bank effectively froze hundreds of billions of dollars of assets. The actions immediately drove down the value of the ruble as people frantically rushed to turn their rubles into a more stable currency. https://t.co/pKdlagNTWX
1506677241228496901,2022-03-23T17:00:21.000Z,1754641,@nytimesbusiness,NYT Business,News,"RT @GregoryNYC: Following in the footsteps of Allbirds and Warby Parker,  more direct-to-consumer brands are experimenting with physical lo…"
1506684758515924998,2022-03-23T17:30:13.000Z,1754641,@nytimesbusiness,NYT Business,News,"These are the stories of six people who transformed their careers during the past two years. For some, it was a financial imperative. For others, lockdowns became a chance to rethink their path. For each, it was a big risk on a new future. https://t.co/TlOFZROrV1"
1506692301216747535,2022-03-23T18:00:12.000Z,1754641,@nytimesbusiness,NYT Business,News,"Today in On Tech, @shiraovide writes that unlike so many of our online experiences, shopping is one area that has remained mostly local. https://t.co/30poNh4Tv2"
1506699834769686530,2022-03-23T18:30:08.000Z,1754641,@nytimesbusiness,NYT Business,News,"Bankers racked up their highest bonuses ever in New York last year, but their good fortune may be running out. https://t.co/3fY3ff3XwV"
1506707381534744588,2022-03-23T19:00:07.000Z,1754641,@nytimesbusiness,NYT Business,News,"In Britain, the economic shock waves of the war in Ukraine are exacerbating a squeeze on household budgets and heightening fears of a cost of living crisis. The British government on Wednesday announced measures to help people cope with the rising prices. https://t.co/fdwC8IJH4O"
1506714918820663306,2022-03-23T19:30:04.000Z,1754641,@nytimesbusiness,NYT Business,News,"Treasury Secretary Janet L. Yellen will discuss imposing sanctions on Russia’s gold reserves with lawmakers on Wednesday, amid concerns that Russia is trying to utilize alternative assets to evade international sanctions and help prop up the ruble. https://t.co/sXbdm4uG86"
1506722519142879233,2022-03-23T20:00:16.000Z,1754641,@nytimesbusiness,NYT Business,News,"Saigon Social, a Vietnamese restaurant on the Lower East Side, has only ever existed in pandemic-era limbo. https://t.co/5oNfZxhk14"
1506730057120813069,2022-03-23T20:30:13.000Z,1754641,@nytimesbusiness,NYT Business,News,The invasion of Ukraine by Russia has spurred governments to accelerate plans to reduce their dependence on climate-changing fossil fuels. https://t.co/D2H5fTk7iU
1506737648588800016,2022-03-23T21:00:23.000Z,1754641,@nytimesbusiness,NYT Business,News,"Stellantis and LG Energy Solution, said on Wednesday that they would jointly build a battery plant in Windsor, Ontario, to provide the critical components for a range of electric Jeeps and trucks the automaker aims to introduce over the next several years. https://t.co/OgPJapTCAk"
1506748133581144067,2022-03-23T21:42:03.000Z,1754641,@nytimesbusiness,NYT Business,News,"John Roach, a pioneer of home computers who helped develop the Tandy TRS-80, has died at 83. https://t.co/Y0fSxg5AdW"
1506755691935145988,2022-03-23T22:12:05.000Z,1754641,@nytimesbusiness,NYT Business,News,"Julian Assange, the WikiLeaks founder who is fighting extradition to the United States on espionage charges, married Stella Moris, his longtime partner with whom he has two young children, on Wednesday in a prison in London. https://t.co/ck8m7NyS9m"
1506764740768505856,2022-03-23T22:48:03.000Z,1754641,@nytimesbusiness,NYT Business,News,"While officials say a new law has helped save marriages, the bigger challenge in the country’s demographic crisis is that fewer people are getting married in the first place. https://t.co/OS7kTCSQvN"
1506772296421236742,2022-03-23T23:18:04.000Z,1754641,@nytimesbusiness,NYT Business,News,"“Many landlords are starting to recognize that in order to attract different brands that can make their property stand out, they will have to go to shorter lease terms.” https://t.co/dMvqmJrOfn"
1506793180074844165,2022-03-24T00:41:03.000Z,1754641,@nytimesbusiness,NYT Business,News,"It looks as if Rachel Zegler, who plays Maria in Steven Spielberg’s “West Side Story,” is going to the Oscars. https://t.co/5pqQM5sZYe"
1506800735899598856,2022-03-24T01:11:05.000Z,1754641,@nytimesbusiness,NYT Business,News,"@sheeraf and  @stuartathompson write that as the war in Ukraine rages on, the Kremlin’s talking points and some right-wing discourse in the United States have coalesced. https://t.co/xcN9QwFoov"
1506810294374387720,2022-03-24T01:49:04.000Z,1754641,@nytimesbusiness,NYT Business,News,"@gillianreporter and @emmabgo present the stories of six people who transformed their careers during the past two years of the pandemic. For each, it was a big risk on a new future. https://t.co/xfAqVZZCjf"
1506817344819060736,2022-03-24T02:17:04.000Z,1754641,@nytimesbusiness,NYT Business,News,"While a new gadget must be bought eventually, there are some ways to keep your devices running safely even when software updates are not being provided. Here’s what you need to know: https://t.co/uwgarM4r2p"
1506824646552961025,2022-03-24T02:46:05.000Z,1754641,@nytimesbusiness,NYT Business,News,The pandemic has presented new real estate opportunities. Now e-commerce entrepreneurs are turning to physical stores. https://t.co/5pfu6t6Fej
1506830925480574977,2022-03-24T03:11:02.000Z,1754641,@nytimesbusiness,NYT Business,News,"Aiming to keep unhappy marriages together by forcing couples to undergo a 30-day “cooling off” period before finalizing a divorce, China’s new rule appears to have worked, @jotted writes. https://t.co/Zy7FSgJ3cq"
1506839247776624644,2022-03-24T03:44:07.000Z,1754641,@nytimesbusiness,NYT Business,News,"Collapses at large for-profit chains have sent claims through relief programs soaring, @StacyCowley writes. The new education policy does not guarantee that taxpayers will be repaid for future claims, however. https://t.co/nHWpKRS6qA"
1506843727314178051,2022-03-24T04:01:55.000Z,1754641,@nytimesbusiness,NYT Business,News,"“People are asking if the far right in the U.S. is influencing Russia or if Russia is influencing the far right, but the truth is they are influencing each other,” one professor tells @sheeraf and  @stuartathompson. https://t.co/HopKOyrXel"
1506854930728030209,2022-03-24T04:46:26.000Z,1754641,@nytimesbusiness,NYT Business,News,"“It is crazy to think about it now, but that accident was the best thing that ever could have happened to me,” one former construction worker tells @gillianreporter and @emmabgo. “It made it possible for my dream of opening my own business to come true.” https://t.co/UNEboVjfNW"
1506858988276752390,2022-03-24T05:02:33.000Z,1754641,@nytimesbusiness,NYT Business,News,"“If a company owns, controls or profits from a college, it should also be on the hook if the institution fails students,” an Education Department official said. https://t.co/fxulKHpYrN"
1506862860575649793,2022-03-24T05:17:56.000Z,1754641,@nytimesbusiness,NYT Business,News,@bxchen writes that upgrades to our gadgets needn’t be so automatic. We can often delay them if we follow some security practices and take control of our personal tech. https://t.co/xy6KyhGAY1
1506878685349130243,2022-03-24T06:20:49.000Z,1754641,@nytimesbusiness,NYT Business,News,"“I think more and more people around me don’t want to get married, and the divorce rate and marriage rate in China have dropped significantly, which I think is an irreversible trend,” one bachelor in China tells @jotted. https://t.co/khRfXshiLK"
1506900714211225603,2022-03-24T07:48:21.000Z,1754641,@nytimesbusiness,NYT Business,News,"“When you open stores, your business gets much stronger in that region because people are passing by and can just walk in,” one business owner said, adding that his clientele likes to “feel and touch our offerings and get that experience.” https://t.co/MrP7GWLDA4"
