1480148609077239809,2022-01-09T12:05:02.000Z,1754641,@nytimesbusiness,NYT Business,News,"RT @SteveLohr: Smart, concise look at the M&amp;A outlook for 2022. By @m_delamerced https://t.co/QxGwmf8stA"
1480154919076352002,2022-01-09T12:30:07.000Z,1754641,@nytimesbusiness,NYT Business,News,"After the enormous changes of the last couple of years, many people are reconsidering how much a person should have to put up with at work. https://t.co/51Nt6kdHbs"
1480163213878640645,2022-01-09T13:03:04.000Z,1754641,@nytimesbusiness,NYT Business,News,From the weekend edition of the DealBook newsletter: What’s next for the deal boom?https://t.co/7f1kXZltnG by @m_delamerced
1480172006704300032,2022-01-09T13:38:01.000Z,1754641,@nytimesbusiness,NYT Business,News,Colleges wrongly claim early decision is binding. (It’s not.) Then they make it trickier for students by dangling the possibility (or not) of merit aid. https://t.co/fi67DFg5Sb
1480177569571999744,2022-01-09T14:00:07.000Z,1754641,@nytimesbusiness,NYT Business,News,"Citigroup will dismiss unvaccinated employees by the end of the month as it presses on with a vaccine requirement the company announced in October. More than 90% of its 65,000 U.S. employees have complied with the requirement. https://t.co/fwBPYzF3xP"
1480186108637945856,2022-01-09T14:34:03.000Z,1754641,@nytimesbusiness,NYT Business,News,"While Ford and GM struggled with semiconductor shortages, Tesla powered ahead. Here’s how Elon Musk did it. https://t.co/xEvNxxfckP"
1480191896853037056,2022-01-09T14:57:03.000Z,1754641,@nytimesbusiness,NYT Business,News,Here are some questions and answers about the expanded child tax credit and the 2022 tax filing season: https://t.co/pm4bKOuiqb
1480199453382483971,2022-01-09T15:27:05.000Z,1754641,@nytimesbusiness,NYT Business,News,"The rate was slightly higher than the November increase of 4.9 percent, which was the previous record. https://t.co/5ptPiGxRPJ"
1480208769036472320,2022-01-09T16:04:06.000Z,1754641,@nytimesbusiness,NYT Business,News,"Corrected disclosures show that Vice Chair Richard Clarida sold a stock fund, then swiftly repurchased it before a big Fed announcement. https://t.co/Ev0qIdUKhk"
1480216553941577737,2022-01-09T16:35:02.000Z,1754641,@nytimesbusiness,NYT Business,News,"For almost two years, couches have been offices. Colleagues are instant message avatars. And the tolerance for dealing with jerky bosses has decreased. https://t.co/Y4VDepQf5a"
1480223859110469633,2022-01-09T17:04:03.000Z,1754641,@nytimesbusiness,NYT Business,News,The U.S. intelligence community offered steps that would mitigate — but not stop — spyware developed by firms like the NSO Group. https://t.co/qYHwfMX6UV
1480231396975288326,2022-01-09T17:34:01.000Z,1754641,@nytimesbusiness,NYT Business,News,"If you want to make a New Year’s resolution about investing, it might be to cut costs, diversify and take as long a view as possible, says @jeffsommer. https://t.co/iZngaS2FL9"
1480238465455378437,2022-01-09T18:02:06.000Z,1754641,@nytimesbusiness,NYT Business,News,"Data suggest that a dearth of available workers — and not a lack of demand — may be part of the reason hiring has languished, @melbournecoal and @jeannasmialek write. https://t.co/sRMEg9FjHf"
1480245997540417539,2022-01-09T18:32:02.000Z,1754641,@nytimesbusiness,NYT Business,News,European airlines are being forced to fly thousands of nearly empty “ghost flights” as travel plummets because of Omicron infections. https://t.co/DkQBxZmIVn
1480253073029279747,2022-01-09T19:00:09.000Z,1754641,@nytimesbusiness,NYT Business,News,A $46 billion federal program enacted by Congress to prevent evictions during the pandemic got off to a sluggish start last year. But it is now distributing cash so quickly that many states are running out of money. https://t.co/JqS3MesT73
1480261377893797890,2022-01-09T19:33:09.000Z,1754641,@nytimesbusiness,NYT Business,News,"“This affirms the Fed’s conclusion,” Diane Swonk, chief economist at Grant Thornton, said after the report. “This is a hot labor market.” https://t.co/GhVpWJR6bx"
1480268276425015304,2022-01-09T20:00:33.000Z,1754641,@nytimesbusiness,NYT Business,News,Did you receive the child tax credit or stimulus payments in 2021? Here's what you need to know for tax filing season. https://t.co/wusdGa1Goq
1480275732345630721,2022-01-09T20:30:11.000Z,1754641,@nytimesbusiness,NYT Business,News,What are you supposed to do if your supposedly (but not really) binding early decision offer comes with no merit aid discount? @ronlieber talks to Northeastern about it.  https://t.co/xTE9e9i9Ut
1480283317564059654,2022-01-09T21:00:19.000Z,1754641,@nytimesbusiness,NYT Business,News,"Citigroup will dismiss unvaccinated employees by the end of the month as it presses on with a vaccine requirement the company announced in October. More than 90% of its 65,000 U.S. employees have complied with the requirement. https://t.co/XZ7TcLmUz7"
1480290832838238218,2022-01-09T21:30:11.000Z,1754641,@nytimesbusiness,NYT Business,News,"When Tesla couldn’t get computer chips, it rewrote the software for the ones that were available. Larger auto companies struggled because they relied on outside suppliers for much of their software and computing expertise. https://t.co/0WVhzjhEXj"
1480298369541197828,2022-01-09T22:00:08.000Z,1754641,@nytimesbusiness,NYT Business,News,From the weekend edition of the DealBook newsletter: What’s next for the deal boom?https://t.co/Wx3b7DmDso by @m_delamerced
1480510263631794178,2022-01-10T12:02:08.000Z,1754641,@nytimesbusiness,NYT Business,News,"When over-the-top superyachts aren’t taking their owners to private holiday spots in the Caribbean and the Mediterranean, they need a place to drop anchor and deal with repairs. That’s where Barcelona comes in.  https://t.co/2mKq30sBfI"
1480518553711300621,2022-01-10T12:35:04.000Z,1754641,@nytimesbusiness,NYT Business,News,Flight cancellations continued across the U.S. from Friday through Sunday. Bad weather and staffing shortages because of Covid were still to blame. But the airlines were also trying to deal with the traditional slowdown in travel in January. https://t.co/TIgda378bf
1480526595609841666,2022-01-10T13:07:01.000Z,1754641,@nytimesbusiness,NYT Business,News,The Supreme Court heard arguments on the Biden administration’s vaccine mandates. Job growth stalled. Awards season fizzled. And confirmation hearings for President Biden’s nominees for the two top Fed posts are coming up. Here's the week in business. https://t.co/wjDkPgI7t1
1480535903437271041,2022-01-10T13:44:01.000Z,1754641,@nytimesbusiness,NYT Business,News,"Misinformation about Covid-19 tests has spiked across social media in recent weeks, researchers say, as coronavirus cases have surged again worldwide because of the highly infectious Omicron variant. https://t.co/B4qUpctigX"
1480546945844355073,2022-01-10T14:27:53.000Z,1754641,@nytimesbusiness,NYT Business,News,"RT @GregoryNYC: Good morning! A video game deal will unite the makers of Grand Theft Auto and Farmville, and Elizabeth Warren seeks more de…"
1480547529150316546,2022-01-10T14:30:12.000Z,1754641,@nytimesbusiness,NYT Business,News,In today’s DealBook newsletter: how pandemic-stricken awards shows are another woe for Hollywood; why Tesla keeps winning; the unwinding of debt-maven Ron Perelman’s empire; and more. https://t.co/9n4pYgwJ5s
1480555094122934274,2022-01-10T15:00:16.000Z,1754641,@nytimesbusiness,NYT Business,News,A freelance writer is suing The Atlantic for defamation after the magazine took the unusual step of retracting an article. https://t.co/nazDDZLS3c
1480562629408083977,2022-01-10T15:30:13.000Z,1754641,@nytimesbusiness,NYT Business,News,The Fed has become embroiled in a scandal over transactions made in early 2020. Fed chair Powell has acknowledged that the trades were a problem and acted quickly to overhaul the central bank’s ethics rules. But that has not stemmed the fallout. https://t.co/upjjRkBXhe
1480570198990147588,2022-01-10T16:00:17.000Z,1754641,@nytimesbusiness,NYT Business,News,We’re about to start the 2022 tax filing season. Here’s what to know about the child credit and stimulus payments you may have gotten last year. https://t.co/RnLGbJ2hJW
1480577962923675656,2022-01-10T16:31:08.000Z,1754641,@nytimesbusiness,NYT Business,News,Airlines canceled thousands more flights in recent days as the industry tried to move past its holiday hangover. https://t.co/fek6Zufnhg
1480585346681384960,2022-01-10T17:00:29.000Z,1754641,@nytimesbusiness,NYT Business,News,The Supreme Court heard arguments on the Biden administration’s vaccine mandates; Job growth stalled; Awards season fizzled; And confirmation hearings for President Biden’s nominees for the two top Fed posts are coming up. https://t.co/vGFnvTrChc
1480592527094915076,2022-01-10T17:29:01.000Z,1754641,@nytimesbusiness,NYT Business,News,"The video game publisher Take-Two Interactive agreed on Monday to buy Zynga, a mobile game maker, for more than $11 billion, in a deal that unites the makers of “Grand Theft Auto” and “Farmville.” https://t.co/YRwquEppy9"
1480600403205099524,2022-01-10T18:00:19.000Z,1754641,@nytimesbusiness,NYT Business,News,"Just as the Covid-19 crisis made amateur epidemiologists of people trying to go about their daily lives, it also forced human resources professionals, especially those at small and midsize businesses, into a new focus on public health. https://t.co/l3G4dDqVsI"
1480607635988693004,2022-01-10T18:29:03.000Z,1754641,@nytimesbusiness,NYT Business,News,"On television, the pandemic is already over. In reality, it continues to wreak havoc on the entertainment industry. https://t.co/1UQobJ3pxk"
1480615504553390080,2022-01-10T19:00:19.000Z,1754641,@nytimesbusiness,NYT Business,News,"When over-the-top superyachts aren’t taking their owners to private holiday spots in the Caribbean and the Mediterranean, they need a place to drop anchor and deal with repairs. That’s where Barcelona comes in. https://t.co/SMlPqW3bau"
1480623481612120064,2022-01-10T19:32:01.000Z,1754641,@nytimesbusiness,NYT Business,News,"Misinformation about Covid-19 tests has spiked across social media in recent weeks, researchers say, as coronavirus cases have surged again worldwide because of the highly infectious Omicron variant. https://t.co/xYMajB5AIa"
1480630598100262916,2022-01-10T20:00:18.000Z,1754641,@nytimesbusiness,NYT Business,News,"Symone Sanders, a former top aide for Vice President Harris, is joining MSNBC as an anchor. https://t.co/NIOavHjg1f"
1480638122211917826,2022-01-10T20:30:11.000Z,1754641,@nytimesbusiness,NYT Business,News,"Stocks on Wall Street dropped again on Monday, adding to a stretch of losses that have come as investors adjusted to the prospect that the Federal Reserve could start to raise interest rates soon. https://t.co/qhf9WfxhI7"
1480645703026483203,2022-01-10T21:00:19.000Z,1754641,@nytimesbusiness,NYT Business,News,"Google wrongly claimed attorney-client privilege to protect documents subpoenaed in a National Labor Relations Board case filed by former employees who say the company fired them because of their unionization efforts, a labor judge has ruled. https://t.co/ask1XHhw6f"
1480653443358466053,2022-01-10T21:31:04.000Z,1754641,@nytimesbusiness,NYT Business,News,An announcement from the Treasury Department on Friday revealed that there was less money available for renters than some states had hoped. https://t.co/Mzmo4q16Cw
1480660787442057217,2022-01-10T22:00:15.000Z,1754641,@nytimesbusiness,NYT Business,News,"The Labor Department sued the owner of a Georgia auto-repair shop who paid his former employee’s final wages of $915 by dumping 91,500, oil-soaked pennies on the man’s driveway. https://t.co/EHj3RW8vrB"
1480669045813026818,2022-01-10T22:33:04.000Z,1754641,@nytimesbusiness,NYT Business,News,Ruth Shalit Barrett says The Atlantic smeared her reputation and destroyed her career when it retracted an article she had written and published a lengthy editor’s note. https://t.co/v7dzezoZ9y
1480675940418084865,2022-01-10T23:00:28.000Z,1754641,@nytimesbusiness,NYT Business,News,Vaccine mandates. Boosters. Exemptions. Testing protocol. The Covid-19 crisis has basically turned human resources professionals into school nurses. https://t.co/Jbr7UnJOyC
1480683147977236484,2022-01-10T23:29:06.000Z,1754641,@nytimesbusiness,NYT Business,News,"Robert Durst, the heir to a real estate fortune whose life turned into a lurid tabloid drama when he was tied to three murders, has died.  https://t.co/HNNz2gje4j"
1480686158904532994,2022-01-10T23:41:04.000Z,1754641,@nytimesbusiness,NYT Business,News,He aquí las cuatro tendencias de tecnología que van a invadir nuestras vidas este año. https://t.co/vk5KVG01wf
1480694198374473731,2022-01-11T00:13:01.000Z,1754641,@nytimesbusiness,NYT Business,News,¿Se requerirán refuerzos permanentes de la vacuna contra el coronavirus para combatir la pandemia? https://t.co/SGRA6U60cW
1480699755500081152,2022-01-11T00:35:06.000Z,1754641,@nytimesbusiness,NYT Business,News,"For the first time, surgeons have successfully transplanted a genetically altered pig’s heart into a patient. The procedure may bring  new hope to hundreds of thousands of people with organ failure. https://t.co/bF4yh2iMNj"
1480708054190637059,2022-01-11T01:08:05.000Z,1754641,@nytimesbusiness,NYT Business,News,"Carl Bennett, who with his wife founded Caldor discount chain in the Northeast, dies at 101Carl Bennett, who with his wife founded Caldor discount chain in the Northeast, dies at 101 https://t.co/6hPElug1Vq"
1480715857433092099,2022-01-11T01:39:05.000Z,1754641,@nytimesbusiness,NYT Business,News,"Fox News gives its 7 p.m. time slot to Jesse Watters, a pro-Trump pundit who recently used violent language to criticize Dr. Anthony Fauci. https://t.co/sOg0oS6ieT"
1480727169861099521,2022-01-11T02:24:02.000Z,1754641,@nytimesbusiness,NYT Business,News,@daiwaka reports that the ruling is the latest legal blow to Google’s defense against a complaint that said the company illegally fired and surveilled employees who were involved in labor organizing. https://t.co/iZ5ACfsAKy
1480733981620457483,2022-01-11T02:51:06.000Z,1754641,@nytimesbusiness,NYT Business,News,"@grynbaum writes that Symone Sanders, who left her post with Vice President Kamala Harris at the end of December, is the most prominent member of the Biden White House to shift from politics to a job in the news media. https://t.co/uo3waZ9LHA"
1480739772289241090,2022-01-11T03:14:07.000Z,1754641,@nytimesbusiness,NYT Business,News,"@daveyalba writes that some household liquids can make a Covid test show a positive result, yet health experts say the tests remain accurate. But online videos, like one showing a positive result under running water, undermine their efforts. https://t.co/67GfAtwUmw"
1480747577947693058,2022-01-11T03:45:08.000Z,1754641,@nytimesbusiness,NYT Business,News,"As the rich have gotten richer during the pandemic, their boats have gotten even larger. Increasingly, they need a place big enough to drop anchor and deal with repairs. And it is here that Barcelona sees an economic opportunity. https://t.co/CGlGCCaDCX"
1480756379598131202,2022-01-11T04:20:06.000Z,1754641,@nytimesbusiness,NYT Business,News,Wondering what it was like to serve as a juror in Silicon Valley’s trial of the decade? https://t.co/NGqshFlwEa
1480823424511586308,2022-01-11T08:46:31.000Z,1754641,@nytimesbusiness,NYT Business,News,"Barcelona has turned itself into a hub for these luxury vessels, combining a private marina that is investing 20 million euros to turn itself into the largest port reserved for superyachts in the Mediterranean. https://t.co/pLuPqq7Keq"
1480836880652509186,2022-01-11T09:39:59.000Z,1754641,@nytimesbusiness,NYT Business,News,"The format, title and time slot of Symone Sanders’s MSNBC program, which will air on Saturdays and Sundays starting in the spring, are to be determined, @grynbaum reports. https://t.co/hU6xXHARja"
1480853380964798464,2022-01-11T10:45:33.000Z,1754641,@nytimesbusiness,NYT Business,News,"“Using a fluid with a different chemical makeup than what was designed means that result lines might appear unpredictably,” said one expert. https://t.co/mDFxhx3je6"
1480872626415443975,2022-01-11T12:02:02.000Z,1754641,@nytimesbusiness,NYT Business,News,"A weary retail work force is experiencing the fallout from the latest wave of the pandemic. “Morale could not be lower,” one retail worker said. https://t.co/UNj3sMdavs"
1480880431503495169,2022-01-11T12:33:02.000Z,1754641,@nytimesbusiness,NYT Business,News,"Jerome H. Powell, the Federal Reserve chair, will testify before members of the Senate Banking Committee on Tuesday as he seeks confirmation for a second term. https://t.co/AMXxUfx5Oc"
1480888475293564934,2022-01-11T13:05:00.000Z,1754641,@nytimesbusiness,NYT Business,News,Growing numbers of economists say computerized machines and software have contributed significantly to the yawning gap in incomes in the U.S. https://t.co/PMeFdIXikc
1480907007087587334,2022-01-11T14:18:39.000Z,1754641,@nytimesbusiness,NYT Business,News,In today’s DealBook newsletter: @andrewrsorkin and @m_delamerced on Citadel Securities selling a stake to two big venture firms; big questions for Jay Powell; @stephengandel on a tech stock wobble; SpaceX wants to speed up its satellite business; and more https://t.co/3obxwLtm0K
1480913661489201158,2022-01-11T14:45:05.000Z,1754641,@nytimesbusiness,NYT Business,News,"RT @jeannasmialek: In a new letter, @SenWarren asks Chair Powell for more details on the Fed trading scandal — and she wants them by Jan. 1…"
1480920149431574531,2022-01-11T15:10:52.000Z,1754641,@nytimesbusiness,NYT Business,News,"RT @GregoryNYC: Good morning! Jerome Powell faces a grilling at his confirmation hearing, and the World Bank warns that economic growth wil…"
1480921207599947776,2022-01-11T15:15:04.000Z,1754641,@nytimesbusiness,NYT Business,News,"Wall Street remained unsteady on Tuesday, with major benchmarks slightly lower, after a late rally in technology stocks on Monday failed to hold. https://t.co/vPrqRF6m9j"
1480924977696325644,2022-01-11T15:30:03.000Z,1754641,@nytimesbusiness,NYT Business,News,"In a single day over the holidays, nearly one in three United Airlines employees called in sick at Newark Liberty International Airport, a major hub for the airline, the company’s chief executive said on Tuesday. https://t.co/KNOblW3dog"
1480929005956214787,2022-01-11T15:46:04.000Z,1754641,@nytimesbusiness,NYT Business,News,"Citadel Securities, the powerful trading firm that serves brokerage firms like Robinhood, said on Tuesday that it had sold a stake to the venture capital firms Sequoia Capital and Paradigm for $1.15 billion. https://t.co/IoMKTJb4sv"
1480936308184961026,2022-01-11T16:15:04.000Z,1754641,@nytimesbusiness,NYT Business,News,The sunshine and outdoor lifestyle of Spain have helped make it the top choice for students studying abroad. Real estate developers are taking notice. https://t.co/kI5LWZti56
1480940349107449862,2022-01-11T16:31:08.000Z,1754641,@nytimesbusiness,NYT Business,News,"Boeing said on Tuesday that it received 79 new orders for planes in December, capping its best year of sales since 2018 as it tried to move past a prolonged crisis caused by two crashes of the 737 Max jet. https://t.co/y3G8z5pgzI"
1480943604130529281,2022-01-11T16:44:04.000Z,1754641,@nytimesbusiness,NYT Business,News,"“The tolerance for dealing with jerky bosses has decreased,” said Angelina Darrisaw, chief executive of the firm C-Suite Coach, who saw interest in her executive coaching services rise last year. https://t.co/H2VvUFRFV8"
1480951408899854341,2022-01-11T17:15:05.000Z,1754641,@nytimesbusiness,NYT Business,News,"“The Covid-19 crisis wiped out years of progress in poverty reduction,” David Malpass, the World Bank president, wrote in an introduction to the report. https://t.co/0kB61XYiGk"
1480958967564181506,2022-01-11T17:45:07.000Z,1754641,@nytimesbusiness,NYT Business,News,"When George Orwell wrote in “Animal Farm” that some animals were more equal than others, he was trying to shed light on the human ideological conflicts of the time. These researchers hope to use the analogy in the opposite direction. https://t.co/TWbzijZe1f"
1480960944549289994,2022-01-11T17:52:58.000Z,1754641,@nytimesbusiness,NYT Business,News,"RT @GregoryNYC: Spain is seeing a shift in student housing, fueled by demand for dorms that are safer and have better amenities, writes @Ra…"
1480966511875575808,2022-01-11T18:15:06.000Z,1754641,@nytimesbusiness,NYT Business,News,"A weary retail work force is experiencing the fallout from the latest wave of the pandemic, with a rapidly spreading variant cutting into staffing. “Morale could not be lower,” one retail worker said. https://t.co/EkQWLcxIXP"
1480974078760603652,2022-01-11T18:45:10.000Z,1754641,@nytimesbusiness,NYT Business,News,"RT @jeannasmialek: After news of the trading scandal deepens, Fed Vice Chair Richard Clarida is resigning two weeks early: https://t.co/h3d…"
1480981353369849858,2022-01-11T19:14:04.000Z,1754641,@nytimesbusiness,NYT Business,News,Federal Reserve chair Powell will testify before members of the Senate Banking Committee as he seeks confirmation for a second term. He could face tough questions at this complicated economic juncture and as an ethics scandal dogs the institution he leads. https://t.co/N9WNwuFiAv
1480989187688079361,2022-01-11T19:45:12.000Z,1754641,@nytimesbusiness,NYT Business,News,Growing numbers of economists say computerized machines and software have contributed significantly to the yawning gap in incomes in the U.S. https://t.co/tWn15qgOrt
1480996731923935240,2022-01-11T20:15:11.000Z,1754641,@nytimesbusiness,NYT Business,News,"Investors are pouring money into student housing in Spain: “Spain has a very strong pipeline for the next two years, but we are still convinced that there is room for more,” a real estate executive said. https://t.co/7KRW2L0OYj"
1481004253737066508,2022-01-11T20:45:04.000Z,1754641,@nytimesbusiness,NYT Business,News,"Treasury Department officials said that the I.R.S. would struggle to promptly answer telephone calls from taxpayers with questions. They blamed Republican legislators, who have blocked efforts to increase funding at the agency. https://t.co/HLEO1XTUzD"
1481011821557469187,2022-01-11T21:15:08.000Z,1754641,@nytimesbusiness,NYT Business,News,"The longtime NPR star, who had been a host of “All Things Considered” since 2012 and was a 17-year veteran of the public broadcaster, will host a weekly show for CNN+, as well as contribute to the streaming service’s slate of live programming. https://t.co/CmnDw8CWAm"
1481019365386506245,2022-01-11T21:45:07.000Z,1754641,@nytimesbusiness,NYT Business,News,"If you wondered what it was like to serve as a juror in Silicon Valley’s trial of the decade, Susanna Stefanek can tell you. https://t.co/HbgIbaekJ2"
1481026915569971210,2022-01-11T22:15:07.000Z,1754641,@nytimesbusiness,NYT Business,News,"Ms. Sheikholeslami's appointment is the first big move by Axel Springer, the German publishing giant, since it bought Politico Media Group last year for more than $1 billion as part of its ambition to become a force in the American news media. https://t.co/l2E7nQA4XB"
1481035451859415050,2022-01-11T22:49:02.000Z,1754641,@nytimesbusiness,NYT Business,News,"Mientras Ford y GM tuvieron problemas con la escasez de semiconductores, Tesla siguió adelante. Aquí te contamos cómo lo hizo Elon Musk. https://t.co/NbsurLmaXM"
1481042267834101761,2022-01-11T23:16:07.000Z,1754641,@nytimesbusiness,NYT Business,News,"Michael Lang, one of the creators of the Woodstock festival, which drew more than 400,000 people to an upstate New York farm in 1969 for a weekend of “peace and music,” has died at 77. https://t.co/SZ9JoKvqep"
1481050312622415875,2022-01-11T23:48:05.000Z,1754641,@nytimesbusiness,NYT Business,News,Los empleadores que quieren que sus trabajadores vuelvan a sus escritorios están tratando de adaptarse a distintos grados de tolerancia al riesgo del COVID-19. Démosle la bienvenida a las pulseras de colores que ayudan a indicarlo. https://t.co/CAJK5Kbsgl
1481054843150217220,2022-01-12T00:06:05.000Z,1754641,@nytimesbusiness,NYT Business,News,"Long checkout lines. Closed fitting rooms. Empty shelves. At the same time, retailers are not extending hazard pay as they did earlier in the pandemic and have been loath to adopt vaccine or testing mandates. https://t.co/Sp1p8RWtvd"
1481062885472321542,2022-01-12T00:38:03.000Z,1754641,@nytimesbusiness,NYT Business,News,"@SteveLohr writes that economists point to the postwar years, from 1950 to 1980, as a golden age of automation when technology forged ahead and workers enjoyed rising incomes. But afterward, many workers started falling behind. https://t.co/lzJS3LI7ni"
1481072463484178435,2022-01-12T01:16:06.000Z,1754641,@nytimesbusiness,NYT Business,News,"Global growth is expected to slow to 4.1 percent this year, from a 5.5 percent clip in 2021, according to the World Bank. https://t.co/5XylT4Yh5p"
1481077490802208769,2022-01-12T01:36:05.000Z,1754641,@nytimesbusiness,NYT Business,News,"@nirajc writes that flight cancellations have continued this week, though the number has fallen steadily in recent days. More than 700 flights on Tuesday were canceled, about 150 of them operated by United. https://t.co/FyqdXezg9K"
1481090063543021573,2022-01-12T02:26:03.000Z,1754641,@nytimesbusiness,NYT Business,News,"Economists increasingly expect Fed officials to make three or four interest rate increases in 2022. But the Fed’s rate increases would come on top of other moves intended to keep the economy from overheating, @jeannasmialek writes. https://t.co/etuasHaOiD"
