1488536384822521856,2022-02-01T15:35:04.000Z,1754641,@nytimesbusiness,NYT Business,News,"Federal Reserve officials are preparing to pull back their economic help as inflation remains stubbornly high and the labor market swiftly heals, and they are signaling clearly that the last business cycle is a poor template for what comes next. https://t.co/Zewz1f5vPf"
1488538299845292038,2022-02-01T15:42:41.000Z,1754641,@nytimesbusiness,NYT Business,News,"RT @GregoryNYC: Good morning! Omicron has disrupted businesses, but it has done little to cool off a red-hot job market, and Exxon Mobil re…"
1488542970177634305,2022-02-01T16:01:14.000Z,1754641,@nytimesbusiness,NYT Business,News,"“There may eventually be another hiatus again some time in my future,” Ms. Maddow said. “But for now we’re taking it one step at a time.” https://t.co/RCrdrf1a1l"
1488550262012788736,2022-02-01T16:30:13.000Z,1754641,@nytimesbusiness,NYT Business,News,"When Tom Seaver started making and selling wine he was a curiosity. These days, Dusty Baker, Dave Roberts, Greg Vaughn and others are turning their baseball fame into a second life as vintners. https://t.co/BFGGwiuYmA"
1488557846233026574,2022-02-01T17:00:21.000Z,1754641,@nytimesbusiness,NYT Business,News,"Hanging over the $800 billion Paycheck Protection Program is a simple question: Did it work? 
New research, drawing on millions of wage and payroll records, suggests a complicated answer: Yes, but at an extraordinarily high cost. https://t.co/HmqUympdD4"
1488565124927479812,2022-02-01T17:29:16.000Z,1754641,@nytimesbusiness,NYT Business,News,"RT @GregoryNYC: Warehouse space is drying up. ""It is almost evaporating before your eyes,"" an industrial real estate executive tells @miran…"
1488565386991869963,2022-02-01T17:30:19.000Z,1754641,@nytimesbusiness,NYT Business,News,"The pandemic has supposedly given service workers leverage. Even as employers complain of having to scramble to fill vacancies, there is little evidence that service workers are winning any meaningful, long-term gains. https://t.co/O978MOBEXp"
1488572928400764938,2022-02-01T18:00:17.000Z,1754641,@nytimesbusiness,NYT Business,News,"Retailers and logistics companies trying to stockpile goods are facing a new challenge: In many parts of the United States, there is little to no space available to stash the merchandise. https://t.co/n1f4ORGugY"
1488581428287881221,2022-02-01T18:34:03.000Z,1754641,@nytimesbusiness,NYT Business,News,"Puerto Rico is gentrifying, as outside investors capitalize on tax breaks for a slice of surf and sand. The town of Rincón has attracted many cryptocurrency traders, who hold weekly happy hours at a beachside bar. https://t.co/hkq20PmC6S"
1488588154168918016,2022-02-01T19:00:47.000Z,1754641,@nytimesbusiness,NYT Business,News,"“It’s a bizarro world in Texas,” said one employment lawyer in Texas. “In other states, you have to show proof of vaccination to dine. In Texas, you’re not allowed to ask.” https://t.co/ZB5H9JgX2A"
1488597029647495169,2022-02-01T19:36:03.000Z,1754641,@nytimesbusiness,NYT Business,News,RT @noamscheiber: There's been a lot of talk during the pandemic about whether just-in-time supply chains still make sense.  A lot less tal…
1488605734615060483,2022-02-01T20:10:38.000Z,1754641,@nytimesbusiness,NYT Business,News,"In the Great Supply Chain Disruption, waiting for a return to normalcy has yielded to the realization that a new normal is unfolding. https://t.co/PILQYAm29o"
1488612140290383876,2022-02-01T20:36:05.000Z,1754641,@nytimesbusiness,NYT Business,News,"Facing pressure from streaming services and threats to its funding model, the BBC is reinvesting in programming for young people.  https://t.co/i4keCxPpqo"
1488619192219746307,2022-02-01T21:04:07.000Z,1754641,@nytimesbusiness,NYT Business,News,"“If we succeed, it will be because every patient will have the opportunities I’ve had,” the company’s founder said. https://t.co/vefxx0nzEt"
1488626234246549508,2022-02-01T21:32:06.000Z,1754641,@nytimesbusiness,NYT Business,News,"Retailers and logistics companies trying to stockpile goods are facing a new challenge: In many parts of the United States, there is little to no space available to stash the merchandise. https://t.co/aQO4TWUQ73"
1488633312369381377,2022-02-01T22:00:13.000Z,1754641,@nytimesbusiness,NYT Business,News,"Today in On Tech, @shiraovide writes that experimentation is great, but it costs us when influential companies like Facebook change their mind. https://t.co/RJeoxhmzaO"
1488643841406160900,2022-02-01T22:42:04.000Z,1754641,@nytimesbusiness,NYT Business,News,"Why the Great Supply Chain Disruption may continue for many months, if not years. https://t.co/KJk4RIcUCS"
1488651391992221698,2022-02-01T23:12:04.000Z,1754641,@nytimesbusiness,NYT Business,News,"With the backing of venture capital and well-known tech investors, Synapticure seeks to fill in the gaps in care and research for those with amyotrophic lateral sclerosis. https://t.co/OUCwtTBd6u"
1488661445285924868,2022-02-01T23:52:01.000Z,1754641,@nytimesbusiness,NYT Business,News,Native American tribes have reached a multi-million-dollar settlement with pharmaceutical companies over opioids.  https://t.co/KEXyIic90Z
1488669002247323654,2022-02-02T00:22:02.000Z,1754641,@nytimesbusiness,NYT Business,News,"A Pennsylvania woman who had contact with the monkeys on the highway says she has symptoms of illness, but no one else has reported any. And the airline that shipped the research animals here is getting out of the business. https://t.co/NjhpIAcvVy"
1488675071795372040,2022-02-02T00:46:10.000Z,1754641,@nytimesbusiness,NYT Business,News,@petersgoodman writes that time alone will not solve the Great Supply Chain Disruption. Cheap and reliable shipping may no longer be taken as a given. https://t.co/15JcZ5XHdT
1488680335428788225,2022-02-02T01:07:04.000Z,1754641,@nytimesbusiness,NYT Business,News,"The shortage of commercial warehouse and industrial space is spurring new thinking about how to manage storage, handle distribution and set up new delivery systems for all kinds of goods. https://t.co/qMX2a1H7Aw"
1488687887285633026,2022-02-02T01:37:05.000Z,1754641,@nytimesbusiness,NYT Business,News,@noamscheiber writes that the desire of many part-time employees to work more hours suggests a relatively straightforward way for employers to reduce labor shortages: Offer more full-time positions. https://t.co/n5owWhwsZr
1488698451722395651,2022-02-02T02:19:04.000Z,1754641,@nytimesbusiness,NYT Business,News,"Where did the rest of the money meant to save jobs from the Paycheck Protection Program go? Into deeper pockets, @StacyCowley writes.
https://t.co/vIo3pNIOhS"
1488707258091552770,2022-02-02T02:54:03.000Z,1754641,@nytimesbusiness,NYT Business,News,"@bencasselman reports that employers posted 10.9 million open jobs in the last month of 2021. That was up modestly from November, and close to the record 11.1 million openings in July. https://t.co/RUcTSoGVvN"
1488739252712185856,2022-02-02T05:01:11.000Z,1754641,@nytimesbusiness,NYT Business,News,"“Companies kept their seasonal hires,” one economist said. “One, because it’s already a labor shortage. And two, because they had so many people out sick that they wanted to keep people on.” https://t.co/otBvW7mvyU"
1488747112678440960,2022-02-02T05:32:25.000Z,1754641,@nytimesbusiness,NYT Business,News,"“We tried to figure out, ‘Where did the money go?’ — and it turns out it didn’t primarily go to workers who would have lost jobs. It went to business owners and their shareholders and their creditors,” said one economics professor at M.I.T. https://t.co/1iG29Pt5ER"
1488762549004910594,2022-02-02T06:33:46.000Z,1754641,@nytimesbusiness,NYT Business,News,"“The supply-and-demand imbalance is more significant than I have seen. There is limited inventory of industrial space. It is almost evaporating before your eyes, if you are even lucky enough to know about it.” https://t.co/st3XUTJdk4"
1488805774742724611,2022-02-02T09:25:32.000Z,1754641,@nytimesbusiness,NYT Business,News,"The deepening understanding that the supply chain crisis has staying power poses a daunting challenge to policymakers, @petersgoodman writes. https://t.co/Eve4VqmOQ2"
1488819511335792641,2022-02-02T10:20:07.000Z,1754641,@nytimesbusiness,NYT Business,News,"Grindr, the world’s most popular gay dating app, has been pulled from Apple’s app store in China over concerns about data regulations. https://t.co/2Emy3WCuaA"
1488829813557186562,2022-02-02T11:01:03.000Z,1754641,@nytimesbusiness,NYT Business,News,Seznam was the preferred search engine company in the Czech Republic for years before Google swooped in. It’s making sure Google faces the consequences. https://t.co/1uTfntmMbp
1488845920485748739,2022-02-02T12:05:03.000Z,1754641,@nytimesbusiness,NYT Business,News,"As Japan confronts an epidemic of dementia, several localities have turned to electronic tracking. 

The programs offer the promise of protecting those in cognitive decline, but they have also evoked fears of Orwellian overreach. https://t.co/U36wMBuEEs"
1488850714973646849,2022-02-02T12:24:06.000Z,1754641,@nytimesbusiness,NYT Business,News,"The New York Times Company reached its goal of 10 million subscriptions ahead of schedule, the company said Wednesday, aided substantially by the 1.2 million it gained by buying the sports news website The Athletic. https://t.co/9modHOs1rW"
1488854654494683136,2022-02-02T12:39:45.000Z,1754641,@nytimesbusiness,NYT Business,News,RT @satariano: A spunky Czech company‘s success against Google made for a feel-good story about a local underdog defeating a global giant —…
1488861532972793856,2022-02-02T13:07:05.000Z,1754641,@nytimesbusiness,NYT Business,News,"""There is something unseemly, to put it mildly, about the famous and fabulously wealthy urging crypto on their fans,"" writes @jodyrosen. ""Entertainers and athletes have ample money to risk in speculative bubbles; their millions of admirers don’t."" https://t.co/dwPyBFzFy9"
1488861897566789638,2022-02-02T13:08:32.000Z,1754641,@nytimesbusiness,NYT Business,News,"RT @GregoryNYC: After reaching 10 million subscriptions ahead of schedule, The New York Times Company announced a new goal: 15 million subs…"
1488869572572856323,2022-02-02T13:39:02.000Z,1754641,@nytimesbusiness,NYT Business,News,"Oil prices are increasing, again, casting a shadow over the economy, driving up inflation and eroding consumer confidence.

Here's why oil prices are high and what it would take for them to fall. https://t.co/TJjntKZ4kf"
1488888498329423884,2022-02-02T14:54:14.000Z,1754641,@nytimesbusiness,NYT Business,News,"In today’s newsletter: profits at Alphabet, Exxon, UPS and others are soaring; @laurenshirsch on what the Rooney Rule lawsuit against the NFL means for Corporate America; @el72champs interviews Silvergate about its Diem crypto plans; and more: https://t.co/paZjvzF0MU"
1488898033945300992,2022-02-02T15:32:08.000Z,1754641,@nytimesbusiness,NYT Business,News,"Seznam, a small search engine company in the Czech Republic, has been a thorn in Google’s side since the tech giant crowded it out years ago. Google hasn’t heard the last of it. https://t.co/8Y2FNQvHXO"
1488906082571505665,2022-02-02T16:04:07.000Z,1754641,@nytimesbusiness,NYT Business,News,"As Japan rapidly ages, it is envisioning fundamental changes, even in infrastructure. Is electronic surveillance an answer to its epidemic of dementia? https://t.co/HtPAQbHHYx"
1488907686053879811,2022-02-02T16:10:29.000Z,1754641,@nytimesbusiness,NYT Business,News,RT @GregoryNYC: BREAKING: Jeff Zucker resigned as CNN president after failing to disclose a workplace relationship with a top executive tha…
1488912360706387974,2022-02-02T16:29:04.000Z,1754641,@nytimesbusiness,NYT Business,News,The Honduran island of Roatán is surrounded by some of the most beautiful and accessible coral reefs in the world. The question now is how to balance an influx of tourists with a fragile undersea environment. https://t.co/S1Tg8Qa74v
1488921666751279104,2022-02-02T17:06:02.000Z,1754641,@nytimesbusiness,NYT Business,News,"When @bxchen pressed the trigger to activate the Dyson V15 Detect vacuum, he began spewing profanities. https://t.co/d9OFqJlcfU"
1488927755328761863,2022-02-02T17:30:14.000Z,1754641,@nytimesbusiness,NYT Business,News,"Oil prices are increasing, again, casting a shadow over the economy, driving up inflation and eroding consumer confidence. 
Here's why oil prices are high and what it would take for them to fall. https://t.co/W8ihFEFeFS"
1488935294485381129,2022-02-02T18:00:11.000Z,1754641,@nytimesbusiness,NYT Business,News,"""There is something unseemly, to put it mildly, about the famous and fabulously wealthy urging crypto on their fans,"" writes @jodyrosen. ""Entertainers and athletes have ample money to risk in speculative bubbles; their millions of admirers don’t."" https://t.co/OibtwbLenZ"
1488942839614492672,2022-02-02T18:30:10.000Z,1754641,@nytimesbusiness,NYT Business,News,Puerto Rico se está gentrificando. Los inversionistas foráneos aprovechan las exenciones tributarias y van a la isla en pos de playa y surf. Rincón ha atraído a numerosos comerciantes de criptodivisas que se reúnen en un bar playero para la hora feliz. https://t.co/zpHH42fZLu
1488953410816823300,2022-02-02T19:12:11.000Z,1754641,@nytimesbusiness,NYT Business,News,"The European Union wants to direct investments toward nuclear power stations and gas-fired generators as part of a transition away from fossil fuels, but critics have called the move greenwashing. https://t.co/0V2oc9O9gg"
1488960176485019648,2022-02-02T19:39:04.000Z,1754641,@nytimesbusiness,NYT Business,News,"Today in On Tech, @shiraovide writes that the continued prevalence of SMS in the U.S. is a reminder that the most resilient technologies aren’t necessarily the best ones.  https://t.co/3K6YFfCsRq"
1488967214875267075,2022-02-02T20:07:02.000Z,1754641,@nytimesbusiness,NYT Business,News,"Seznam, a small search engine company in the Czech Republic, has been a thorn in Google’s side since the tech giant crowded it out years ago. Google hasn’t heard the last of it. https://t.co/4wUyESgNOR"
1488972752275050499,2022-02-02T20:29:02.000Z,1754641,@nytimesbusiness,NYT Business,News,"As Japan rapidly ages, it is envisioning fundamental changes, even in infrastructure. Is electronic surveillance an answer to its epidemic of dementia? https://t.co/cOY2Ldy8iI"
1488980621766672384,2022-02-02T21:00:18.000Z,1754641,@nytimesbusiness,NYT Business,News,"Oil prices are increasing, again, casting a shadow over the economy, driving up inflation and eroding consumer confidence. 
Here's why oil prices are high and what it would take for them to fall. https://t.co/YAMPhGMcYV"
1488988355450880000,2022-02-02T21:31:02.000Z,1754641,@nytimesbusiness,NYT Business,News,"Executives with Grindr, the world’s most popular gay dating app, have pulled it from Apple’s app store in China over concerns about data regulations, marking the latest of a series of foreign departures from the Chinese market following new rules. https://t.co/Lu6mtInJvV"
1488995716701773830,2022-02-02T22:00:17.000Z,1754641,@nytimesbusiness,NYT Business,News,"Ultimately, Facebook (now Meta) gave up on Libra (now Diem). Last week, the intellectual property and technology behind Diem was sold for $180 million to Silvergate Capital, a bank holding company. https://t.co/Qy0Iq0eJ2m"
1489003225919410188,2022-02-02T22:30:08.000Z,1754641,@nytimesbusiness,NYT Business,News,"The abrupt end of his nine-year tenure immediately throws into flux the direction of CNN and its parent company, WarnerMedia, which is expected to be acquired later this year by Discovery Inc. in one of the nation’s largest media mergers. https://t.co/s2XCR7iCNN"
1489014023140093955,2022-02-02T23:13:02.000Z,1754641,@nytimesbusiness,NYT Business,News,“What I really wish we had was a Warp Speed 2.0 for nasal vaccines.” https://t.co/ruhoLxK1wy
1489021595045842945,2022-02-02T23:43:07.000Z,1754641,@nytimesbusiness,NYT Business,News,¿Cómo conviertes un gigante de las redes sociales en el metaverso? https://t.co/i7uMZP2pCq
1489028633729585153,2022-02-03T00:11:05.000Z,1754641,@nytimesbusiness,NYT Business,News,"John Koss and a friend invented the first stereo headphones in 1958, giving people a new, individualized way to listen to music. Save for an ill-fated expansion in the 1980s, his company has focused almost entirely on headphones ever since. https://t.co/9xWFQxgrFU"
1489039195230330882,2022-02-03T00:53:03.000Z,1754641,@nytimesbusiness,NYT Business,News,"@grynbaum and @koblin write that the sudden end of Jeff Zucker’s nine-year tenure throws into flux the direction of CNN and its parent company, WarnerMedia. https://t.co/De4DuNgmjt"
1489042979960541186,2022-02-03T01:08:06.000Z,1754641,@nytimesbusiness,NYT Business,News,"The pandemic depressed energy prices in 2020, even sending the U.S. benchmark oil price below zero for the first time ever. But prices have snapped back faster than many analysts had expected. Our @ckrausss explores why: https://t.co/r06QsgLKVx"
1489053025784184833,2022-02-03T01:48:01.000Z,1754641,@nytimesbusiness,NYT Business,News,"@satariano writes that new rules in Europe, expected to pass by June, would affect how Apple and Google operate app stores, Amazon sells products online, and Meta and Google sell online advertising. https://t.co/bZk5rxly1r"
1489060331485806599,2022-02-03T02:17:03.000Z,1754641,@nytimesbusiness,NYT Business,News,"As the nation with the world’s oldest population, Japan is most vulnerable to the ravages of dementia. Several localities in the country have now turned to electronic tracking of seniors, @benjamindooley and @hudidi1 report. https://t.co/RKiUdA90ZW"
1489065872287227907,2022-02-03T02:39:04.000Z,1754641,@nytimesbusiness,NYT Business,News,"Ahead of schedule, The New York Times Company reached its goal of 10 million subscriptions – aided by the 1.2 million it gained by buying the sports news website The Athletic, @marcatracy reports. https://t.co/HnpkrZfOjC"
1489074955564331015,2022-02-03T03:15:09.000Z,1754641,@nytimesbusiness,NYT Business,News,"Losing more than $10 billion in 2021 as it built its metaverse business, Meta, the company that was founded as Facebook, revealed for the first time the results of its hardware division, @MikeIsaac writes. https://t.co/wX368ZFZgj"
1489104872133869570,2022-02-03T05:14:02.000Z,1754641,@nytimesbusiness,NYT Business,News,"“Together, we had nine great years,” Jeff Zucker wrote in his memo. “I certainly wish my tenure here had ended differently. But it was an amazing run. And I loved every minute.” https://t.co/QllZCR8wmw"
1489108856827437057,2022-02-03T05:29:52.000Z,1754641,@nytimesbusiness,NYT Business,News,"His headphones became standard equipment for music listeners, disc jockeys and recording artists in the studio. They were even used during President Richard M. Nixon’s impeachment inquiry. John C. Koss has died at 91. https://t.co/nxYIL3zZc0"
1489113185101697029,2022-02-03T05:47:04.000Z,1754641,@nytimesbusiness,NYT Business,News,@ckrausss writes that Exxon Mobil and other oil companies are thriving – raking in their biggest profits in years. https://t.co/bRzs67EBsp
1489120733276086274,2022-02-03T06:17:03.000Z,1754641,@nytimesbusiness,NYT Business,News,"In the European Union, policymakers point to the experience of Seznam, a search engine that once was preferred over Google in the Czech Republic, as evidence of the need for more swift intervention in the digital economy. https://t.co/tgcPu3zFnz"
1489129283016699906,2022-02-03T06:51:02.000Z,1754641,@nytimesbusiness,NYT Business,News,Analysts at Goldman Sachs warn that “the combination of rising geopolitical tensions (Ukraine and Iran) and prices approaching politically sensitive levels are likely to increase volatility.” https://t.co/dGhpb96cBl
1489137099190190080,2022-02-03T07:22:05.000Z,1754641,@nytimesbusiness,NYT Business,News,Spending on the metaverse dragged down the company’s profits and Meta’s stock plunged about 22 percent in after-hours trading. https://t.co/bwccPtoCSH
1489144897416269825,2022-02-03T07:53:05.000Z,1754641,@nytimesbusiness,NYT Business,News,"Inventories of oil are well below their long-run averages, creating the risk of price spikes, @stanleyreed12 notes. Any disruption involving Russia, a major oil exporter, would send shudders through the markets. https://t.co/Nw1L7NLTXg"
1489185660774895618,2022-02-03T10:35:03.000Z,1754641,@nytimesbusiness,NYT Business,News,Investors in Britain are preparing for something that hasn’t happened in more than 17 years: back-to-back interest rate increases by the Bank of England. https://t.co/1FHc6cCyaJ
1489192950164865025,2022-02-03T11:04:01.000Z,1754641,@nytimesbusiness,NYT Business,News,"Meta's higher spending on the metaverse dragged down quarterly profits, which fell 8 percent in the three months ending in December from a year earlier. 

“It is time for a reality check on Meta’s position for the metaverse,” said a technology analyst. https://t.co/7cSzTTH6Bn"
1489202269505695748,2022-02-03T11:41:03.000Z,1754641,@nytimesbusiness,NYT Business,News,"The Federal Reserve is trying to decide how best to steer the economy through a swirl of competing threats. 

The January jobs report is unlikely to provide a clear guide. “It’s going to be a mess,” said one expert. https://t.co/WPNIpJAaym"
1489211147358195716,2022-02-03T12:16:20.000Z,1754641,@nytimesbusiness,NYT Business,News,"RT @GregoryNYC: BREAKING: In an effort to combat soaring prices in Britain, the Bank of England raises interest rates to 0.5 percent, repor…"
1489212844809805832,2022-02-03T12:23:05.000Z,1754641,@nytimesbusiness,NYT Business,News,"Sarah Bloom Raskin, the White House’s nominee to be vice chair for supervision at the Federal Reserve, will field questions from the Senate Committee on Banking, Housing and Urban Affairs on Thursday. Her views are almost certain to ignite sparks. https://t.co/8Hkcr7F8S5"
1489216822905872387,2022-02-03T12:38:53.000Z,1754641,@nytimesbusiness,NYT Business,News,"RT @LaurenSHirsch: The WNBA has raised $75m from investors including  Michael Dell, Condoleezza Rice and Laurene Powell Jobs

It's the firs…"
1489223408693006338,2022-02-03T13:05:03.000Z,1754641,@nytimesbusiness,NYT Business,News,"Booming prices for oil and natural gas propelled Shell’s profit in the fourth quarter of 2021, lifting its adjusted earnings to $6.39 billion, up from $393 million a year earlier. https://t.co/x7Eluc6pBd"
1489229857527578624,2022-02-03T13:30:41.000Z,1754641,@nytimesbusiness,NYT Business,News,RT @bencasselman: Tomorrow's jobs report is coming at a crucial moment for the U.S. economy. Too bad it's going to be (in the words of @Irv…
1489239017975595016,2022-02-03T14:07:05.000Z,1754641,@nytimesbusiness,NYT Business,News,"“It’s one of the industries that really hasn’t changed in the past 100 years,” said Mallory Greene, the founder of Eirene, a direct-to-consumer cremation start-up. https://t.co/rme93nsu7N"
1489265019283980290,2022-02-03T15:50:24.000Z,1754641,@nytimesbusiness,NYT Business,News,"A Florida college student said that Elon Musk offered him $5,000 to stop tracking his private jet and posting its whereabouts on a popular Twitter account. He countered with $50,000 or a Tesla Model 3. https://t.co/nIEFects1r"
1489273483041333251,2022-02-03T16:24:02.000Z,1754641,@nytimesbusiness,NYT Business,News,"In today’s DealBook newsletter: How Mark Zuckerberg and Jeff Zucker are in hot water, for different reasons; why PayPal’s shares took a dive; @el72champs gets a first look at Coinbase’s new partnership with TurboTax; and more: https://t.co/W3CCM3qTSX"
1489282560857460739,2022-02-03T17:00:06.000Z,1754641,@nytimesbusiness,NYT Business,News,"The Biden administration and its allies are bracing for a grim report, warning on Twitter and in conversations with reporters that a weak January jobs number would not necessarily be a sign of a sustained slowdown. https://t.co/XQs812tp6o"
1489289864227004424,2022-02-03T17:29:07.000Z,1754641,@nytimesbusiness,NYT Business,News,"The long-awaited energy battle between Russia, for decades the dominant gas exporter to Europe, and the United States, which for years has promoted its ability to export gas to customers, is at last playing out. https://t.co/CImJIUJtrs"
1489297702106157060,2022-02-03T18:00:16.000Z,1754641,@nytimesbusiness,NYT Business,News,"Millennials and Gen Xers are increasingly making end-of-life decisions for their parents, and some are expecting a process that approximates the ease of an online order. https://t.co/unTsfWycxc"
1489305459408441351,2022-02-03T18:31:06.000Z,1754641,@nytimesbusiness,NYT Business,News,"“It was one of the best things I’ve ever done in my life,” said Motocross World Champion Stefy Bau about mentoring Tanya Muzinda. “From the moment I saw this little 9-year-old at the airport I was in awe."" https://t.co/mrpo3o9dJP"
1489313019930857474,2022-02-03T19:01:08.000Z,1754641,@nytimesbusiness,NYT Business,News,"Coinbase is trying to establish itself as a mainstream gateway to the world of cryptocurrency, a place to routinely deposit paychecks, expense reimbursements and tax refunds. https://t.co/msEOe5vzhO"
1489320801362972672,2022-02-03T19:32:03.000Z,1754641,@nytimesbusiness,NYT Business,News,"The European Central Bank on Thursday kept to its cautious approach in the face of record inflation in the eurozone, but will continue to pull back from its pandemic-era support for the economy. https://t.co/ZnK7JGipEn"
