1509923641991045138,2022-04-01T16:00:23.000Z,19546277,@YahooFinance,Yahoo Finance,News,"Breaking news that $AMZN workers in Staten Island have clinched a union victory: 

https://t.co/Jb7k9tf4PH https://t.co/FTPrXSGwrg"
1509928561037254671,2022-04-01T16:19:56.000Z,19546277,@YahooFinance,Yahoo Finance,News,The pandemic created this ‘permanent’ improvement in medicine: health care CEO https://t.co/3SMhUD6Umh by @maxzahn_ and @serwer https://t.co/U7WwqsmvJa
1509928989867089926,2022-04-01T16:21:38.000Z,19546277,@YahooFinance,Yahoo Finance,News,#Breaking: #Amazon NYC workers win first US union in company's history https://t.co/J8ToVIbqZ3 by @MaxZahn_ $AMZN https://t.co/Xd8RqpuCl1
1509929304934785037,2022-04-01T16:22:54.000Z,19546277,@YahooFinance,Yahoo Finance,News,RT @YahooFinance: #Breaking: #Amazon NYC workers win first US union in company's history https://t.co/J8ToVIbqZ3 by @MaxZahn_ $AMZN https:/…
1509931094904238080,2022-04-01T16:30:00.000Z,19546277,@YahooFinance,Yahoo Finance,News,".@flyfrontier CEO Barry Biffle talks about what his airline is doing to manage fuel costs and take a ""green"" stance on the environment https://t.co/uBmfNtqB0l"
1509931810863595529,2022-04-01T16:32:51.000Z,19546277,@YahooFinance,Yahoo Finance,News,"RT @bcheungz: last week we spoke w/ @shut_downAmazon, who spearheaded that major union effort that won in Staten Island today:

Smalls: “We…"
1509936937158721545,2022-04-01T16:53:13.000Z,19546277,@YahooFinance,Yahoo Finance,News,RT @yfinanceplus: $GM shares are slipping slightly after the automaker said U.S. sales slumped in the first quarter. General Motors said sa…
1509938922335391756,2022-04-01T17:01:07.000Z,19546277,@YahooFinance,Yahoo Finance,News,Is $18 an hour the new minimum wage? https://t.co/8bXzS6k0Jw by @BrianSozzi https://t.co/8LudeYUiOt
1509945766583877652,2022-04-01T17:28:18.000Z,19546277,@YahooFinance,Yahoo Finance,News,@elonmusk and I had a good chat: US Labor Secretary @SecMartyWalsh https://t.co/afHaiAehKP via @BrianSozzi $tsla https://t.co/hVXGrYthC0
1509946191806668802,2022-04-01T17:30:00.000Z,19546277,@YahooFinance,Yahoo Finance,News,Using Earth’s ‘digital twin’ to fight climate change: @Nvidia CEO https://t.co/bFkCu8Arxo $NVDA #nvidia https://t.co/NfkFGJVV36
1509957170531606529,2022-04-01T18:13:37.000Z,19546277,@YahooFinance,Yahoo Finance,News,SEC proposes new crypto rules for exchanges to protect users from hacks https://t.co/G59fSesJVV by @Jenniferisms https://t.co/t62xm3L76D
1509961571447054338,2022-04-01T18:31:07.000Z,19546277,@YahooFinance,Yahoo Finance,News,"Editor-at-Large @BrianSozzi speaks with NFL All-Pro quarterback @PatrickMahomes about the recent changes to #NFL overtime rules, Mahomes business investments with Airshare and Whoop, as well as what to anticipate ahead of the next NFL season. Watch: https://t.co/lOt1wH7RcW https://t.co/UwWxvqTYtq"
1509964681011773443,2022-04-01T18:43:28.000Z,19546277,@YahooFinance,Yahoo Finance,News,"Serum Institute mulls Africa plant, mRNA future https://t.co/5K3W0oAE0g by @AnjKhem https://t.co/MDvfp4YgUJ"
1509966842126901259,2022-04-01T18:52:03.000Z,19546277,@YahooFinance,Yahoo Finance,News,Column: This week in Bidenomics: Almost everything is great https://t.co/bhzxjyUKoG by @RickJNewman https://t.co/0ksfXLvBna
1509969381232717825,2022-04-01T19:02:09.000Z,19546277,@YahooFinance,Yahoo Finance,News,Student loans: Democrats push to ease 'unnecessary high bar' for debt relief in bankruptcy https://t.co/47PyH7jNaH by @aarthiswami https://t.co/GnsX5aNKG9
1509970207657402374,2022-04-01T19:05:26.000Z,19546277,@YahooFinance,Yahoo Finance,News,Investigations turn up the heat on Hunter Biden https://t.co/qjsPWMUb2F via @YahooNews
1509972303194509318,2022-04-01T19:13:45.000Z,19546277,@YahooFinance,Yahoo Finance,News,"""Younger people are realizing that they've spent all the money that they got for free from the government,” Stanford University Business Professor David Dodson says, adding: “maybe it's time to stop sitting on an inner tube drinking beer and go get a job.” https://t.co/h23fgk7FxB"
1509974827817390082,2022-04-01T19:23:47.000Z,19546277,@YahooFinance,Yahoo Finance,News,"""It's very clear that we are late-cycle,"" @PIMCO Managing Director and Portfolio Manager Sonali Pier says. ""Our base case is not for a recession at this stage. … As a result, we have to acknowledge that [it] will lead to increased uncertainty."" https://t.co/eyqgqXsym9"
1509976036418727936,2022-04-01T19:28:35.000Z,19546277,@YahooFinance,Yahoo Finance,News,RT @yfinanceplus: One of @YahooFinance #trending tickers is $BB. Blackberry shares are down more than 11% after reporting disappointing qua…
1509977347361067010,2022-04-01T19:33:48.000Z,19546277,@YahooFinance,Yahoo Finance,News,".@StewLeonards CEO @StewLeonardJr on the rise in food prices: ""I've never seen anything like this. … It's like our crystal ball is [broken]."" https://t.co/RHmhw2eO3u"
1509979112198311940,2022-04-01T19:40:49.000Z,19546277,@YahooFinance,Yahoo Finance,News,CDC to end Trump-era rule blocking asylum seekers at the border https://t.co/8QBhWh3Dcm by @YahooNews
1509979558254108672,2022-04-01T19:42:35.000Z,19546277,@YahooFinance,Yahoo Finance,News,.@Gap may be next activist investor target: analyst https://t.co/8O9ea8hMHy by @BrianSozzi https://t.co/lceHP7p4b7
1509982259562127367,2022-04-01T19:53:19.000Z,19546277,@YahooFinance,Yahoo Finance,News,"""Manufacturers are thinking about, 'How do they mitigate risks?,'"" @DeloitteMFG Vice Chairman Paul Wellener says. ""One way to mitigate risks is to bring things back to where they have a little bit more control over the supply chain."" https://t.co/gZ1Rsk0CMr"
1509982845913161739,2022-04-01T19:55:39.000Z,19546277,@YahooFinance,Yahoo Finance,News,NCAA athletes face tax consequences following rule change on earning money https://t.co/XBHKcEwQT3 by @WritesRonda https://t.co/uPNjUoc5Bb
1509984136227926020,2022-04-01T20:00:46.000Z,19546277,@YahooFinance,Yahoo Finance,News,Spam texts plaguing your phone? Here's how to stop them https://t.co/OhMFKMu4Xd by @DanielHowley https://t.co/JUDrAjIymw
1509987061134147588,2022-04-01T20:12:24.000Z,19546277,@YahooFinance,Yahoo Finance,News,$3-billion Las Vegas development proposal aims to lure NBA to Sin City https://t.co/S3sGg7v3Fh by @_JoshSchafer https://t.co/AC1DlpVbTC
1509987715802185731,2022-04-01T20:15:00.000Z,19546277,@YahooFinance,Yahoo Finance,News,#Bitcoin acts as a store-of-value for all sides in Russia-Ukraine war https://t.co/SchegibVhD $BTC https://t.co/VVxQ05pfS0
1509987823549624321,2022-04-01T20:15:26.000Z,19546277,@YahooFinance,Yahoo Finance,News,"Given the strong jobs report, does the Fed have any choice but to raise rates by 50 basis points?

“Absolutely not,” @InfraCap CEO Jay Hatfield says. “The Fed policy… has been extraordinarily erratic, dating back to when Powell took over and almost created a recession in 2018."" https://t.co/6ETaxA0xIP"
1509990542419058689,2022-04-01T20:26:14.000Z,19546277,@YahooFinance,Yahoo Finance,News,Supply chains and labor crunch are making things 'impossible' for music festivals https://t.co/vy0FWjErya by @alliecanal8193 https://t.co/7t7BXa09gL
1509990642033868810,2022-04-01T20:26:37.000Z,19546277,@YahooFinance,Yahoo Finance,News,"""It's starting to feel like that road to recovery is getting pushed back further and further,"" Edmunds Executive Director of Insights Jessica Caldwell says about weak car sales and supply chain issues. ""The big issue is the chip shortage."" https://t.co/iXiEc8MRJs"
1509991053444763653,2022-04-01T20:28:16.000Z,19546277,@YahooFinance,Yahoo Finance,News,America's struggling restaurants might have hope for more relief https://t.co/RmDEwE20qU by @BrookeDiPalma and @benwerschkul https://t.co/YTJahZ6T8G
1509992664250396683,2022-04-01T20:34:40.000Z,19546277,@YahooFinance,Yahoo Finance,News,Fauci: Omicron is to blame for vaccine delay for children 6 and under https://t.co/fdHZFZNnBF by @AnjKhem https://t.co/hE1TKegkNG
1509993463785394185,2022-04-01T20:37:50.000Z,19546277,@YahooFinance,Yahoo Finance,News,Randstad RiseSmart Sr. Practice Development Manager @KJSchneiderman explains why more people are choosing to re-enter the workforce after retiring during the pandemic: https://t.co/jPM3KhIdyF
1509994333855965192,2022-04-01T20:41:18.000Z,19546277,@YahooFinance,Yahoo Finance,News,Recession warning sign flashes as yield curve inverts https://t.co/LI1DYO2ucR by @bcheungz https://t.co/BfROvmL4rN
1509995136910077962,2022-04-01T20:44:29.000Z,19546277,@YahooFinance,Yahoo Finance,News,What economists are saying about the ‘March Madness’ jobs report https://t.co/IZ2ohAl5jh by @alexandraandnyc https://t.co/nGFbNMB6Lc
1509996634561818629,2022-04-01T20:50:26.000Z,19546277,@YahooFinance,Yahoo Finance,News,"BA.2 surge could determine mask timeline for planes, trains: Fauci https://t.co/uxxWIKmVJt by @AnjKhem https://t.co/mr5cwpeEW6"
1509997025634533379,2022-04-01T20:51:59.000Z,19546277,@YahooFinance,Yahoo Finance,News,"Former ""Bachelorette"" Star and author @Jason_Tartick discusses his new book ""The Restart Roadmap"" and setting pragmatic financial goals: https://t.co/o62j0vyfUJ"
1509998144452546567,2022-04-01T20:56:26.000Z,19546277,@YahooFinance,Yahoo Finance,News,Economist on this year's housing market: 'You'll be disappointed' https://t.co/gFOL6srkn6 by @WritesRonda https://t.co/NhbdrIEKTZ
1509998310555361284,2022-04-01T20:57:06.000Z,19546277,@YahooFinance,Yahoo Finance,News,WATCH NOW: @Jonathan_Bush joins #Influencers with @YahooFinance Editor-in-Chief @serwer https://t.co/UWOLmhSvvY
1509999544678981633,2022-04-01T21:02:00.000Z,19546277,@YahooFinance,Yahoo Finance,News,".@BIGEAST Commissioner Val Ackerman on the variety of athletes capitalizing on NIL deals: ""It's not a surprise... that athletes other than football players and men's basketball players have begun to cash out."" https://t.co/elqPQL1EdW"
1510003318218797061,2022-04-01T21:17:00.000Z,19546277,@YahooFinance,Yahoo Finance,News,Noise-canceling headphones meet personal air-purification from @dyson https://t.co/kO3R7d16n5 https://t.co/YAHIQWtCWq
1510236789717577733,2022-04-02T12:44:44.000Z,19546277,@YahooFinance,Yahoo Finance,News,"The real problem with U.S. marijuana regulation 'not from federal illegality,' WeedMaps CEO says https://t.co/F6OV91YfTS by @daniromerotv https://t.co/tLGunsdaYK"
1510240590197317632,2022-04-02T12:59:50.000Z,19546277,@YahooFinance,Yahoo Finance,News,NIL: Michigan basketball player @NunezAdrien explains how he built a lucrative TikTok empire https://t.co/fGbhrD5ZgO https://t.co/x4X4270Tsv
1510258082831605761,2022-04-02T14:09:20.000Z,19546277,@YahooFinance,Yahoo Finance,News,Analysis: Big victory at Amazon gives unions promise - but no end to challenges https://t.co/16OBsosQIc via @Reuters https://t.co/V5Sy4B9O5E
1510259715472867332,2022-04-02T14:15:50.000Z,19546277,@YahooFinance,Yahoo Finance,News,Virgin Voyages' CEO on CDC green light: 'People just want to get out' https://t.co/YehXdkA5yi by @daniromerotv https://t.co/ULjGxMG374
1510259861539467265,2022-04-02T14:16:24.000Z,19546277,@YahooFinance,Yahoo Finance,News,Recording Academy CEO: Grammys focus on diversity and goes crypto  https://t.co/FBCCFfAORb by @Jenniferisms https://t.co/KUgFfscZn8
1510260253878894605,2022-04-02T14:17:58.000Z,19546277,@YahooFinance,Yahoo Finance,News,"Grammys 2022: NFTs 'part of music ecosystem,' OneOf co-founder says https://t.co/UB3qRKKv6I by @alliecanal8193 https://t.co/KEXstDhynB"
1510261104156590082,2022-04-02T14:21:21.000Z,19546277,@YahooFinance,Yahoo Finance,News,Recording Academy CEO: Grammys focus on diversity and goes crypto https://t.co/85a1uSLxK8 by @Jenniferisms https://t.co/HDdJa9pwR6
1510261575030132736,2022-04-02T14:23:13.000Z,19546277,@YahooFinance,Yahoo Finance,News,Bachelorette's Jason Tartick on ditching corporate America &amp; restarting his career https://t.co/GLO973gqsj by @alliecanal8193 https://t.co/RZkRdDDvUN
1510267251903148037,2022-04-02T14:45:46.000Z,19546277,@YahooFinance,Yahoo Finance,News,Amazon union vote in Alabama could drag out amid contested ballots https://t.co/i8MQC7gSAA by @MaxZahn_ and @agarfinks https://t.co/rAjfBQ7Vl4
1510267772714029057,2022-04-02T14:47:51.000Z,19546277,@YahooFinance,Yahoo Finance,News,"Housing: A ‘perfect storm’ is driving up home prices, expert says https://t.co/s5IvGvwbkB by @__gabriellacruz https://t.co/pbgKDb1OtP"
1510273324559048715,2022-04-02T15:09:54.000Z,19546277,@YahooFinance,Yahoo Finance,News,Is $18 an hour the new minimum wage? https://t.co/9wzgQ9vZRt by @BrianSozzi https://t.co/2Ik0PzZ7BY
1510283062881525772,2022-04-02T15:48:36.000Z,19546277,@YahooFinance,Yahoo Finance,News,"Student loans: Mom slams Purdue ISA offering as son deals with nearly $100,000 in debt https://t.co/BWiavpo1oU by @aarthiswami https://t.co/2wzqQLrHcy"
1510288491787304968,2022-04-02T16:10:10.000Z,19546277,@YahooFinance,Yahoo Finance,News,SEC proposes new crypto rules for exchanges to protect users from hacks https://t.co/yevmKtv0Zu by @Jenniferisms https://t.co/BPqfY8GsgW
1510292905482760194,2022-04-02T16:27:43.000Z,19546277,@YahooFinance,Yahoo Finance,News,"Tesla delivers record vehicles in Q1, beats analysts' estimates https://t.co/5OCIiRzug6 https://t.co/bvOBgOAPBU"
1510295188157218819,2022-04-02T16:36:47.000Z,19546277,@YahooFinance,Yahoo Finance,News,EU says it eyes further Russia sanctions that will not affect energy sector https://t.co/LDA1VpChqw https://t.co/oIqLXH2G4m
1510306600820617216,2022-04-02T17:22:08.000Z,19546277,@YahooFinance,Yahoo Finance,News,Rental assistance is becoming a bigger necessity as rents rapidly rise https://t.co/UAdhLUqDgt by @__gabriellacruz https://t.co/7ruzruzvlu
1510311841632772096,2022-04-02T17:42:57.000Z,19546277,@YahooFinance,Yahoo Finance,News,"The real problem with U.S. marijuana regulation 'not from federal illegality,' WeedMaps CEO says https://t.co/0vXONfoGhA by @daniromerotv https://t.co/OyAV8qW23Q"
1510317940092067847,2022-04-02T18:07:11.000Z,19546277,@YahooFinance,Yahoo Finance,News,$3-billion Las Vegas development proposal aims to lure NBA to Sin City https://t.co/7OwFTKMotB by @_JoshSchafer https://t.co/xHoxmZVufV
1510323911484919815,2022-04-02T18:30:55.000Z,19546277,@YahooFinance,Yahoo Finance,News,Fauci: Omicron is to blame for vaccine delay for children 6 and under https://t.co/GfBJV9sH95 by @AnjKhem https://t.co/KcZq8CZumB
1510330557858729985,2022-04-02T18:57:20.000Z,19546277,@YahooFinance,Yahoo Finance,News,Electric vehicle push will ‘uplift’ chipmakers: Truist Managing Director https://t.co/MdcpFgabR8 by @thomashumtv https://t.co/6LE1QeMFjP
1510336820894121993,2022-04-02T19:22:13.000Z,19546277,@YahooFinance,Yahoo Finance,News,.@Gap may be next activist investor target: analyst https://t.co/jYVkxtdOss by @BrianSozzi https://t.co/Tcmti8e4Eb
1510342626431537153,2022-04-02T19:45:17.000Z,19546277,@YahooFinance,Yahoo Finance,News,America's struggling restaurants might have hope for more relief https://t.co/LHVMqnLS7T by @BrookeDiPalma and @benwerschkul https://t.co/i01YrRiAch
1510352892154290187,2022-04-02T20:26:05.000Z,19546277,@YahooFinance,Yahoo Finance,News,Student loans: Democrats push to ease 'unnecessary high bar' for debt relief in bankruptcy https://t.co/aYRENMbUli by @aarthiswami https://t.co/wGOq2iDqdF
1510358079929565190,2022-04-02T20:46:42.000Z,19546277,@YahooFinance,Yahoo Finance,News,Why miners are cheering Biden's move to help EV makers https://t.co/N0kxDUJQhp by @benwerschkul https://t.co/bPEr3r06sK
1510363294036594693,2022-04-02T21:07:25.000Z,19546277,@YahooFinance,Yahoo Finance,News,Spam texts plaguing your phone? Here's how to stop them https://t.co/D4dhmnjIv2 by @DanielHowley https://t.co/AdQfxGT8BT
1510374149696495619,2022-04-02T21:50:33.000Z,19546277,@YahooFinance,Yahoo Finance,News,Column: This week in Bidenomics: Almost everything is great https://t.co/so8HfEgD60 by @RickJNewman https://t.co/AFHZ21fGqS
1510380149858050052,2022-04-02T22:14:23.000Z,19546277,@YahooFinance,Yahoo Finance,News,Recession warning sign flashes as yield curve inverts https://t.co/VOa8S4UXfM by @bcheungz https://t.co/XdAxXappBR
1510408736300584960,2022-04-03T00:07:59.000Z,19546277,@YahooFinance,Yahoo Finance,News,NCAA athletes face tax consequences following rule change on earning money https://t.co/TPqsinoh8g by @WritesRonda https://t.co/ftG5VFroGJ
1510416669801390086,2022-04-03T00:39:30.000Z,19546277,@YahooFinance,Yahoo Finance,News,Supply chains and labor crunch are making things 'impossible' for music festivals https://t.co/L7qyqTdL7Y by @alliecanal8193 https://t.co/VxH7k6cLD7
1510423619855343622,2022-04-03T01:07:07.000Z,19546277,@YahooFinance,Yahoo Finance,News,McLaren Racing CEO on F1: ‘I’ve never seen the sport stronger’ https://t.co/i1rgSeXg42 by @Pras_S https://t.co/0f6PEDexm6
1510428703758725127,2022-04-03T01:27:20.000Z,19546277,@YahooFinance,Yahoo Finance,News,NIL: Michigan basketball player explains how he built a lucrative TikTok empire https://t.co/KN4l6OCLzd by @_JoshSchafer https://t.co/gqXe9EtVhS
1510442778546814982,2022-04-03T02:23:15.000Z,19546277,@YahooFinance,Yahoo Finance,News,Will April’s winning streak for stocks continue? https://t.co/EfSptxatXg by @emily_mcck https://t.co/OQ9mAqd4W3
1510448670050865152,2022-04-03T02:46:40.000Z,19546277,@YahooFinance,Yahoo Finance,News,.@EmmaGrede on building businesses with the Kardashians: 'It wasn't exactly a walk in the park' https://t.co/r0kEmy4NHx by @daniromerotv https://t.co/0OHnGbp0Q8
1510480085379432455,2022-04-03T04:51:30.000Z,19546277,@YahooFinance,Yahoo Finance,News,"Serum Institute mulls Africa plant, mRNA future https://t.co/1mM2z1I5IL by @AnjKhem https://t.co/CHZJmJYUBs"
1510488188200095755,2022-04-03T05:23:42.000Z,19546277,@YahooFinance,Yahoo Finance,News,"Americans crowdfunding for medical debt is 'insane' — and inefficient, experts find https://t.co/z0RRHEevXa by @adrianambells https://t.co/4y8V0M0KVz"
1510493276989792259,2022-04-03T05:43:55.000Z,19546277,@YahooFinance,Yahoo Finance,News,CDC to end Trump-era rule blocking asylum seekers at the border https://t.co/nbIryohIOp by @YahooNews
1510498410968854529,2022-04-03T06:04:19.000Z,19546277,@YahooFinance,Yahoo Finance,News,"Intel is coming for Nvidia and AMD, and that’s good news for you https://t.co/RmqseE2cZB by @DanielHowley https://t.co/jsi9fECu1M"
1510510173416214536,2022-04-03T06:51:03.000Z,19546277,@YahooFinance,Yahoo Finance,News,The pandemic created this ‘permanent’ improvement in medicine: health care CEO https://t.co/VD0PDH5RDU by @maxzahn_ and @serwer https://t.co/EohFp5j1Ow
1510515278114955269,2022-04-03T07:11:20.000Z,19546277,@YahooFinance,Yahoo Finance,News,Economist on this year's housing market: 'You'll be disappointed' https://t.co/QI0nHM4s2S by @WritesRonda https://t.co/fCHSN8BRpO
1510533362657734657,2022-04-03T08:23:12.000Z,19546277,@YahooFinance,Yahoo Finance,News,"BA.2 surge could determine mask timeline for planes, trains: Fauci https://t.co/iACRgJFBsA by @AnjKhem https://t.co/MEBBGumnAL"
1510539832354918401,2022-04-03T08:48:55.000Z,19546277,@YahooFinance,Yahoo Finance,News,Bachelorette's Jason Tartick on ditching corporate America &amp; restarting his career https://t.co/a0dM3QalHQ by @alliecanal8193 https://t.co/q5L49BgdEc
1510556129016877069,2022-04-03T09:53:40.000Z,19546277,@YahooFinance,Yahoo Finance,News,Virgin Voyages' CEO on CDC green light: 'People just want to get out' https://t.co/vIEK8gCy4G by @daniromerotv https://t.co/58RijcYPbx
1510561975981547525,2022-04-03T10:16:54.000Z,19546277,@YahooFinance,Yahoo Finance,News,"Grammys 2022: NFTs 'part of music ecosystem,' OneOf co-founder says https://t.co/wqgq6CI1hp by @alliecanal8193 https://t.co/mbkboxm0vt"
1510602466898944001,2022-04-03T12:57:48.000Z,19546277,@YahooFinance,Yahoo Finance,News,What economists are saying about the ‘March Madness’ jobs report https://t.co/Y5PjV7CupM by @alexandraandnyc https://t.co/oDbs9YArll
1510607245582737411,2022-04-03T13:16:47.000Z,19546277,@YahooFinance,Yahoo Finance,News,Tesla unable to restart Shanghai production on Monday -internal memo https://t.co/YMWVFL8WRv https://t.co/uahiSWK95E
1510617386000719877,2022-04-03T13:57:05.000Z,19546277,@YahooFinance,Yahoo Finance,News,"‘Profound’ shift to digital healthcare should cut insurance premiums, says @Jonathan_Bush to @serwer. WATCH #Influencers here: https://t.co/J5WWj0z5AD"
1510622257378471951,2022-04-03T14:16:26.000Z,19546277,@YahooFinance,Yahoo Finance,News,Fashion startup Shein raising funds at $100 billion value: Bloomberg News https://t.co/EJQr85NLFR https://t.co/8GjvtY74Dj
1510622502241845253,2022-04-03T14:17:25.000Z,19546277,@YahooFinance,Yahoo Finance,News,U.K. to unveil energy revamp with focus on nuclear and wind https://t.co/gjqhmTCAtj via @business https://t.co/yp4IJcROkQ
1510629143511191553,2022-04-03T14:43:48.000Z,19546277,@YahooFinance,Yahoo Finance,News,Battle heats up over remaining federal rental assistance https://t.co/nuNhV0daz5 https://t.co/PCOM4dy10P
1510634189040795660,2022-04-03T15:03:51.000Z,19546277,@YahooFinance,Yahoo Finance,News,How increasing NIL opportunities could ‘inspire more fans to watch’ women’s basketball https://t.co/qY41VWZMFl by @_JoshSchafer https://t.co/TsxygvnDLU
1510642607898124294,2022-04-03T15:37:18.000Z,19546277,@YahooFinance,Yahoo Finance,News,China's BYD ends combustion engine cars to focus on electric https://t.co/f65lkPKsun https://t.co/R5sGsonTAQ
1510649285062410246,2022-04-03T16:03:50.000Z,19546277,@YahooFinance,Yahoo Finance,News,Recording Academy CEO: Grammys focus on diversity and goes crypto https://t.co/QzrIWjKWOS by @Jenniferisms https://t.co/EZSAGJuzm1
1510654385138896904,2022-04-03T16:24:06.000Z,19546277,@YahooFinance,Yahoo Finance,News,‘It’s early in the game’ for crucial dockworker labor negotiations: Pacific Maritime Association CEO https://t.co/VQdxt5ivaA by @daniromerotv https://t.co/w2psH0RAzv
1510660255776227337,2022-04-03T16:47:26.000Z,19546277,@YahooFinance,Yahoo Finance,News,Adrian Grenier: Crypto can 'fix a lot of the systems that are broken' https://t.co/NTKVfQifkg by @alliecanal8193 https://t.co/57d8Q3pN9e
1510677331777622020,2022-04-03T17:55:17.000Z,19546277,@YahooFinance,Yahoo Finance,News,"Fed meeting minutes, Conagra earnings: What to know in markets this week https://t.co/gHzR21ctui by @emily_mcck https://t.co/qEwMgpvIg4"
1510678451354841089,2022-04-03T17:59:44.000Z,19546277,@YahooFinance,Yahoo Finance,News,"Supply chains: ‘Nearshoring’ could be the answer to America’s logistics problems, Deloitte exec says https://t.co/YPkSKZXAn3 by @daniromerotv https://t.co/yH3fZ9pleK"
1510939142905028614,2022-04-04T11:15:38.000Z,19546277,@YahooFinance,Yahoo Finance,News,"Is the stock market flashing a net bullish sign?: Morning Brief
https://t.co/tLyFeSBRdI by @BrianSozzi https://t.co/8LmpkumWg7"
1510939301705564165,2022-04-04T11:16:16.000Z,19546277,@YahooFinance,Yahoo Finance,News,"Elon Musk just took a 9.2% stake in Twitter — what may happen next
 https://t.co/XoQMJeFDtW by @BrianSozzi https://t.co/iaSB9f7U5y"
1510968949495799814,2022-04-04T13:14:04.000Z,19546277,@YahooFinance,Yahoo Finance,News,"$TSLA CEO Elon Musk “previously floated the idea of starting his own social network and brought up discussions about what he says are free speech issues on Twitter,” @DanielHowley says on Musk’s 9.2% stake in $TWTR. https://t.co/lOsJpro6Pk"
1510970510309568517,2022-04-04T13:20:16.000Z,19546277,@YahooFinance,Yahoo Finance,News,"$TSLA “broke records once again for the first quarter… [with] deliveries just over 310,000 this year,” @juleshyman says. https://t.co/GKhfS5L4o8"
1510970966263975936,2022-04-04T13:22:05.000Z,19546277,@YahooFinance,Yahoo Finance,News,"RT @juleshyman: Dan Ives tells @YahooFinance Musk's Twitter stake ""is just the appetizer"" -- he's likely to increase it and have more a voi…"
1510971698354532352,2022-04-04T13:25:00.000Z,19546277,@YahooFinance,Yahoo Finance,News,.@JPMorgan's Jamie Dimon: Fed to hike rates 'higher than the markets expect' https://t.co/nOtDauSNld by @Bcheungz $JPM https://t.co/Ct98kpj0Zy
1510974842765512704,2022-04-04T13:37:29.000Z,19546277,@YahooFinance,Yahoo Finance,News,"“This is just the appetizer. Ultimately, we believe [Elon Musk] will have an active stake over the coming weeks or months,” @Wedbush Securities Analyst @DivesTech says on Musk’s stake in $TWTR. Full comments: https://t.co/3NbPq0J4MY"
1510974919848386560,2022-04-04T13:37:48.000Z,19546277,@YahooFinance,Yahoo Finance,News,RT @yfinanceplus: Shares of $TWTR are the top #trending ticker on @YahooFinance after news that Elon Musk took a 9.2% stake in the social m…
1510978237131800581,2022-04-04T13:50:59.000Z,19546277,@YahooFinance,Yahoo Finance,News,"Hertz is buying 65,000 electric vehicles from Tesla rival Polestar https://t.co/ks4c995kHl by @BrianSozzi $HTZ $TSLA https://t.co/aoJJCHJFJi"
1510978244878684175,2022-04-04T13:51:00.000Z,19546277,@YahooFinance,Yahoo Finance,News,"“When we think of a mild recession, I think the best example is probably what happened in 2001 — maybe a two percentage point increase in the unemployment rate [and] a couple quarters of pretty weak GDP growth,” @Nomura Securities Senior U.S. Economist says. Full comments: https://t.co/wdemPfLV4a"
1510979083823370251,2022-04-04T13:54:20.000Z,19546277,@YahooFinance,Yahoo Finance,News,Biden speech to tout improvements in the trucking industry amid ongoing challenges https://t.co/JHcAYNec3x by @benwerschkul https://t.co/DEnWS6r6KR
1510979255903129605,2022-04-04T13:55:01.000Z,19546277,@YahooFinance,Yahoo Finance,News,Rockefeller's $105M plan to produce climate-friendly food https://t.co/lTd924vBiJ
1510979793134796810,2022-04-04T13:57:09.000Z,19546277,@YahooFinance,Yahoo Finance,News,"$TWTR shares jump after $TSLA CEO Elon Musk’s 9.2% stake in the platform, $DOGE prices soar, $DWAC stock falls, $AMD stock upticks after announcing acquisition of startup Pensando. https://t.co/yCFhT97KuR"
