1496151516859801603,2022-02-22T15:54:53.000Z,19546277,@YahooFinance,Yahoo Finance,News,"The U.S. Women’s National Soccer Team “became bigger and bigger stars… Alex Morgan, Megan Rapinoe… and their jerseys ended up being some of the most sold jerseys we’ve ever seen,” @_JoshSchafer details the latest in equal pay negotiations from U.S. Soccer. Full comments: https://t.co/iNjTLFQyOG"
1496153285505470473,2022-02-22T16:01:55.000Z,19546277,@YahooFinance,Yahoo Finance,News,"“We’re an infrequent brand... the average user visits a Krispy Kreme two and a half times a year,” @krispykreme CEO Mike Tattersfield says on prices. “It’s about a celebration... so pricing isn't the number one feature someone’s walking into Krispy Kreme to order the dozens.” https://t.co/63A8k27C8Z"
1496155422381719553,2022-02-22T16:10:24.000Z,19546277,@YahooFinance,Yahoo Finance,News,"“Runners know if a shoe is working for them 20 miles in. Three weeks into the shoe, they know mile after mile if they would buy it again,"" @brooksrunning CEO @jimweberseattle says. “So we've always challenged ourselves to earn that second shoe, that second pair that people buy."" https://t.co/OFgTX0AU4n"
1496157130591772679,2022-02-22T16:17:11.000Z,19546277,@YahooFinance,Yahoo Finance,News,"“California could potentially be legal by 2023, we keep telling people it’s the seventh-largest economy in the world, so expect more spend,” @Oppenheimer Senior Analyst Jed Kelly says on $DKNG’s profitability being reliant on more states adopting legal sports betting. https://t.co/xda63x6MtS"
1496173285779947521,2022-02-22T17:21:23.000Z,19546277,@YahooFinance,Yahoo Finance,News,"Russia 'will be more isolated than ever' from the world, strategist says https://t.co/qzwTciu4V7 by @BrianSozzi https://t.co/vEq7wKDZ1m"
1496175916438929411,2022-02-22T17:31:50.000Z,19546277,@YahooFinance,Yahoo Finance,News,RT @yfinanceplus: Markets opened lower Tuesday as investors monitor tensions between Russia and Ukraine. One bright spot: $HMHC shares are…
1496175964459573251,2022-02-22T17:32:02.000Z,19546277,@YahooFinance,Yahoo Finance,News,"RT @yfinanceplus: #Trending at @yahoofinance: $HD shares are down 7% after the company reports strong sales growth, raises dividend by 15%…"
1496182640008966146,2022-02-22T17:58:33.000Z,19546277,@YahooFinance,Yahoo Finance,News,Four tax tips everybody should know when investing for retirement https://t.co/ups17OPDp2 by @WritesRonda https://t.co/aLoJT5ZjVe
1496182832770727937,2022-02-22T17:59:19.000Z,19546277,@YahooFinance,Yahoo Finance,News,US home price growth stalls in the final month of 2021 https://t.co/JGs6zhhBld by @amandafung https://t.co/pteWX7jKgs
1496183086459072512,2022-02-22T18:00:20.000Z,19546277,@YahooFinance,Yahoo Finance,News,Ukraine-Russia crisis: Goldman Sachs' worst-case scenario for stock market https://t.co/5DvgszRfvL by @BrianSozzi https://t.co/nmMHU2JDPb
1496184526007148547,2022-02-22T18:06:03.000Z,19546277,@YahooFinance,Yahoo Finance,News,Health care: ‘Junk plans’ are an increasing problem in the U.S. https://t.co/FWVgbvuw56 by @adrianambells https://t.co/79tIKS6eKH
1496186450529984512,2022-02-22T18:13:42.000Z,19546277,@YahooFinance,Yahoo Finance,News,This luxury flying ‘yacht’ could pave the way for environmentally-friendly air travel. https://t.co/N2DluDUnVL
1496189222713278465,2022-02-22T18:24:43.000Z,19546277,@YahooFinance,Yahoo Finance,News,Macy's spinning off its e-commerce business would have been 'pretty deadly': analyst https://t.co/SxljUazizO by @BrianSozzi https://t.co/GDpNmKCckF
1496189344608051200,2022-02-22T18:25:12.000Z,19546277,@YahooFinance,Yahoo Finance,News,RT @yfinanceplus: $DWAC shares are up 6%. The special purpose acquisition is slated to purchase #Trump Media &amp; Technology Group after Truth…
1496193547749498880,2022-02-22T18:41:54.000Z,19546277,@YahooFinance,Yahoo Finance,News,"RT @adrianambells: .@SenatorBaldwin on ""junk"" insurance plans: ""These plans can be devastating when you find out how little it covers and h…"
1496196193952665602,2022-02-22T18:52:25.000Z,19546277,@YahooFinance,Yahoo Finance,News,"The Parent Company CEO Troy Datcher on the California cannabis industry: ""There’s been a commoditization of flower in the marketplace here which has been provided some challenges… we’ve got some regulatory and legislative headwinds here that make this marketplace a bit unique."" https://t.co/IZHjudIabf"
1496198065740525574,2022-02-22T18:59:51.000Z,19546277,@YahooFinance,Yahoo Finance,News,"""10, 20 years from now, there's going to be a young little man or woman who right now they're watching Shark Tank... looking at me and they're saying 'I can be bigger and better,'"" @TheSharkDaymond says, adding: ""That person is going to be the next Oprah Winfrey..."" https://t.co/W3a2VAfdKj"
1496200506607386628,2022-02-22T19:09:33.000Z,19546277,@YahooFinance,Yahoo Finance,News,"""The Russians want to rebuild their Eastern Orthodox Slavic empire — that's Ukraine, Belarus, and Russia and that's what Putin is doing,"" Atlantic Council Senior Fellow @Dr_Ariel_Cohen says, adding: ""He is destroying the principle of invincibility of European borders..."" https://t.co/HqTghbUPKy"
1496201956217524224,2022-02-22T19:15:19.000Z,19546277,@YahooFinance,Yahoo Finance,News,"""We do think there's some positioning that is probably going to be a little bit of a buffer to the downside, but that's being juxtaposed against a really poor liquidity environment in markets right now,"" @Horizon_IMG Chief Investment Officer Scott Ladner says. https://t.co/T90aTqO5yW"
1496205474307395584,2022-02-22T19:29:17.000Z,19546277,@YahooFinance,Yahoo Finance,News,"""This is the beginning of a Russian invasion of Ukraine,"" President Biden says, adding: ""I'm going to begin to pose sanctions in response far beyond the steps we and our allies and partners implemented in 2014."" https://t.co/Jb7k9tf4PH https://t.co/85giItExye"
1496206452721135622,2022-02-22T19:33:11.000Z,19546277,@YahooFinance,Yahoo Finance,News,"""Who in the Lord's name does Putin think gives him the right to declare new so-called countries on territory that belongs to his neighbors?"" President Biden says. ""This is a flagrant violation of international law and demands a firm response from the international community."" https://t.co/X4v6Jngp4a"
1496207394145288197,2022-02-22T19:36:55.000Z,19546277,@YahooFinance,Yahoo Finance,News,"""I have authorized additional movements of U.S. forces and equipment already stationed in Europe to strengthen our Baltic allies,"" President Biden says. ""Let me be clear: These are totally defensive moves on our part. We have no intention of fighting Russia."" https://t.co/brcjwWNww3"
1496207419000729612,2022-02-22T19:37:01.000Z,19546277,@YahooFinance,Yahoo Finance,News,Why this technical analyst sees a nearly 20% S&amp;P 500 nosedive https://t.co/5XE0T62hmt by BrianSozzi https://t.co/VQ9JjQv0Tp
1496208542646382593,2022-02-22T19:41:29.000Z,19546277,@YahooFinance,Yahoo Finance,News,"""If Russia proceeds, it is Russia and Russia alone that bears the responsibility,"" @POTUS says. ""As we respond, my administration is using every tool at our disposal to protect American businesses and consumers from rising prices at the pump... Defending freedom will have costs."" https://t.co/IRwSZ4QtHG"
1496209467788173313,2022-02-22T19:45:10.000Z,19546277,@YahooFinance,Yahoo Finance,News,RT @yfinanceplus: $SOFI shares dropped more than 9% after the fintech company announced plans to buy banking software provider Technisys fo…
1496209537866641408,2022-02-22T19:45:26.000Z,19546277,@YahooFinance,Yahoo Finance,News,"""There's still time to avert the worst case scenario that will bring untold suffering to millions of people if [Russia] moves as suggested,"" President Biden says. ""The United States and our allies and partners remain open to diplomacy — if it's serious."" https://t.co/Jb7k9tf4PH https://t.co/sR40KqfDya"
1496214117014716419,2022-02-22T20:03:38.000Z,19546277,@YahooFinance,Yahoo Finance,News,"EU could impose further sanctions on Russia, Germany's Scholz says https://t.co/93tzWTGtvY https://t.co/j4vMtWXAje"
1496219716683247624,2022-02-22T20:25:53.000Z,19546277,@YahooFinance,Yahoo Finance,News,"""We have massive inflation,"" University of Chicago Economist Tomas J. Philipson says, adding: ""I don't think it's a… mystery. Congress is putting the break on the White House."" https://t.co/XuXoE0I2FC"
1496219939987984392,2022-02-22T20:26:46.000Z,19546277,@YahooFinance,Yahoo Finance,News,Considering joint financial accounts with your partner? Here are some tips https://t.co/uzFMLsEDuG by @amykpoulter https://t.co/o7708VLpMM
1496221015768285196,2022-02-22T20:31:03.000Z,19546277,@YahooFinance,Yahoo Finance,News,"“You’re going to have inflation tied to energy commodity,” @tortoise_invest Portfolio Manager Rob Thummel says, noting that the energy sector offers “high-dividend yields for a lot of investors.” https://t.co/tUlNNnyE9n"
1496222815380455427,2022-02-22T20:38:12.000Z,19546277,@YahooFinance,Yahoo Finance,News,Charlie Munger discusses vaccination hesitancy amid COVID-19 pandemic: https://t.co/GbCINl477D
1496223061166731272,2022-02-22T20:39:10.000Z,19546277,@YahooFinance,Yahoo Finance,News,"“Bitcoin, like everything else, is vulnerable to macroeconomic shocks,” @DecryptMedia Executive Editor @jeffjohnroberts says, adding: “Bitcoin doesn’t die — it just gets stronger.” https://t.co/2txLKTRgxB"
1496227891817889793,2022-02-22T20:58:22.000Z,19546277,@YahooFinance,Yahoo Finance,News,Stacey Abrams: Georgia should 'follow the science' on mask-wearing https://t.co/AFS2VQCmdL by @serwer and @MaxZahn_ https://t.co/2yOShdDJ3d
1496228263831740422,2022-02-22T20:59:51.000Z,19546277,@YahooFinance,Yahoo Finance,News,"“One of the reasons why we’re seeing the market respond the way it is today is the restraint on the… allies,” RSM Chief Economist @joebrusuelas says, adding: “The main issue at hand is: Will there be another supply shock to the American economy?” https://t.co/MwgqfJBppE"
1496230447868616704,2022-02-22T21:08:32.000Z,19546277,@YahooFinance,Yahoo Finance,News,"Market Stats 2/22/2022:
-S&amp;P 500 settles down more than 10% from high, entering 'correction' territory
-Dow, S&amp;P 500 close at lowest levels this year
-Wheat futures up 5.5% -- biggest jump since March 2019
-Gold futures hit highest price since June 2020"
1496232440536391682,2022-02-22T21:16:27.000Z,19546277,@YahooFinance,Yahoo Finance,News,Virgin Galactic posts smaller quarterly loss https://t.co/Rt0vLFau88 https://t.co/7JmL5pDA4p
1496233992487583746,2022-02-22T21:22:37.000Z,19546277,@YahooFinance,Yahoo Finance,News,"“We’re looking at gaming,” @FTX_Official CEO @SBF_FTX says. “We’re looking at what’s going to happen with NFT. We’re excited for… whatever the metaverse ends up being.” https://t.co/BikRH8oz3g"
1496236300738904070,2022-02-22T21:31:47.000Z,19546277,@YahooFinance,Yahoo Finance,News,"“Crypto equities are a great way to play this market,” @BitwiseInvest CIO Matthew Hougan says, adding: “We’re many years… from an index-based ETF.” https://t.co/F5NFz5SXCc"
1496241973254103040,2022-02-22T21:54:19.000Z,19546277,@YahooFinance,Yahoo Finance,News,"""The big thing that we're seeing this year is a big explosion in complexity,"" @CoinTracker Co-Founder Chandan Lodha says. https://t.co/leh3pPWQlG"
1496243359261904912,2022-02-22T21:59:50.000Z,19546277,@YahooFinance,Yahoo Finance,News,"The world of NFTs ""is going to be even bigger… NFTs is [an] entry point,"" Crypto Entrepreneur Cordell Broadus says, ""The metaverse is going to be where we spend most of our times."" https://t.co/5qLpP3Gb4A"
1496243865275219968,2022-02-22T22:01:51.000Z,19546277,@YahooFinance,Yahoo Finance,News,"""One of the biggest issues that the government's grappling with now is ransomware ,"" former SEC Enforcement Official @AlmaAngotti says on regulating crypto. Full comments: https://t.co/eEmoXGl5ym"
1496255624828669956,2022-02-22T22:48:34.000Z,19546277,@YahooFinance,Yahoo Finance,News,Biden is worried about Putin’s war on … American drivers https://t.co/XjWzOpOUR0 by @rickjnewman https://t.co/e0q4LYi8Wi
1496256468265406464,2022-02-22T22:51:55.000Z,19546277,@YahooFinance,Yahoo Finance,News,"Snoop Dogg scion Cordell Broadus embraces crypto, NFTs as the future of music https://t.co/JcaZVFPL62 by @Jenniferisms https://t.co/sW9funblbc"
1496317189300932611,2022-02-23T02:53:12.000Z,19546277,@YahooFinance,Yahoo Finance,News,Macy's spinning off its e-commerce business would have been 'pretty deadly': analyst https://t.co/DnYaZ3rOom by @BrianSozzi https://t.co/9Nr6O4SITR
1496322743381409792,2022-02-23T03:15:17.000Z,19546277,@YahooFinance,Yahoo Finance,News,A bullish contradiction: Consumers are acting more bullish than they're saying https://t.co/E9NuWZPNHV by @SamRo via @TKerLLC https://t.co/cLEZyBCIWE
1496329225166598150,2022-02-23T03:41:02.000Z,19546277,@YahooFinance,Yahoo Finance,News,Goldman Sachs' worst-case scenario for stock market https://t.co/G5Ndl4R9dp by @BrianSozzi https://t.co/K22VCjVqwm
1496336278111019008,2022-02-23T04:09:03.000Z,19546277,@YahooFinance,Yahoo Finance,News,Why this technical analyst sees a nearly 20% S&amp;P 500 nosedive https://t.co/2e5I6izw6W by @BrianSozzi https://t.co/5UXuS5aNmj
1496354370543308801,2022-02-23T05:20:57.000Z,19546277,@YahooFinance,Yahoo Finance,News,Stacey Abrams: Georgia should 'follow the science' on mask-wearing https://t.co/wkMN3SDQZt by @serwer and @MaxZahn_ https://t.co/Bt5CLbVXr6
1496360402904666113,2022-02-23T05:44:55.000Z,19546277,@YahooFinance,Yahoo Finance,News,Biden is worried about Putin’s war on … American drivers https://t.co/wiVeA8eQaF by @rickjnewman https://t.co/fgZJjhqrKr
1496365794032336896,2022-02-23T06:06:21.000Z,19546277,@YahooFinance,Yahoo Finance,News,Stacey Abrams: Georgia should be 'very intentional' about lifting mask mandate https://t.co/lW3dGBvWcC by @serwer and @MaxZahn_ https://t.co/4H3wjXV5KQ
1496370990993096713,2022-02-23T06:27:00.000Z,19546277,@YahooFinance,Yahoo Finance,News,"Snoop Dogg scion Cordell Broadus embraces crypto, NFTs as the future of music https://t.co/JzIfAUb8o6 by @Jenniferisms https://t.co/G89iS0Wj4s"
1496377425718042624,2022-02-23T06:52:34.000Z,19546277,@YahooFinance,Yahoo Finance,News,Considering joint financial accounts with your partner? Here are some tips https://t.co/8UdTba8CbO by @amykpoulter https://t.co/gDIB7HwKMi
1496475651074924545,2022-02-23T13:22:53.000Z,19546277,@YahooFinance,Yahoo Finance,News,"Russia-Ukraine may stir dreaded ‘stagflation’ beast from slumber: Morning Brief
https://t.co/I3PTTFdjl1 by @TeflonGeek https://t.co/f7eAfEke8p"
1496492739768291338,2022-02-23T14:30:47.000Z,19546277,@YahooFinance,Yahoo Finance,News,RT @Pras_S: Update on the #FelicityAce - Source reveals @Porsche telling customers with cars on order that it has “prioritized production c…
1496493048859082756,2022-02-23T14:32:01.000Z,19546277,@YahooFinance,Yahoo Finance,News,AMD is now worth more than rival Intel https://t.co/tM6soCFL28 by @BrianSozzi https://t.co/tL1Bbjun6v
1496493585318957059,2022-02-23T14:34:08.000Z,19546277,@YahooFinance,Yahoo Finance,News,Biden administration sets aside $450 million to unclog U.S. ports https://t.co/aXs3y9mBHH by @benwerschkul https://t.co/RJEJ3qEkji
1496495118626525186,2022-02-23T14:40:14.000Z,19546277,@YahooFinance,Yahoo Finance,News,"$TJX shares slump as Q4 net sales estimates miss, $LOW stock rises following a sales figure beat, $HIMS jumps on a positive revenue forecast. Full comments: https://t.co/VRFR3JON0H"
1496495393970036740,2022-02-23T14:41:20.000Z,19546277,@YahooFinance,Yahoo Finance,News,"Yesterday, President Biden said “freedom is not free and there’s going to be a cost — he’s referring to gasoline and oil prices, which… have been going up,” @rickjnewman says. “Biden hinted… there’s a plan in the works to make sure that pump prices do not get out of control.” https://t.co/Fug17pUS8G"
1496495401897181184,2022-02-23T14:41:22.000Z,19546277,@YahooFinance,Yahoo Finance,News,Hedge funds are hating on tech stocks https://t.co/XwfxVBXKy0 by @BrianSozzi https://t.co/bdsEOCzICt
1496497024270802947,2022-02-23T14:47:48.000Z,19546277,@YahooFinance,Yahoo Finance,News,"“Oil, copper, aluminum, all of these are the markets that are the most exposed,” @GoldmanSachs’ Jeffrey Currie says. “Aluminum is the one that’s the most dislocated… we call it the climate paradox. It creates emissions to produce, plus you need it to solve climate change.” https://t.co/CjvrXoxsGj"
1496498003280072708,2022-02-23T14:51:42.000Z,19546277,@YahooFinance,Yahoo Finance,News,".@SPYJared examines markets amid rising volatility levels and the S&amp;P entering into a correction, in addition to looking at the tech sector, FAANG stocks, and hedge funds. Full comments: https://t.co/FBepYomkjq"
1496500005133299715,2022-02-23T14:59:39.000Z,19546277,@YahooFinance,Yahoo Finance,News,RT @yfinanceplus: #Trending now at @yahoofinance: $OSTK shares jumped 32% this morning. The online retailer posted better than expected ear…
1496501322484490244,2022-02-23T15:04:53.000Z,19546277,@YahooFinance,Yahoo Finance,News,"“This is not the only situation the stock market is down and oil prices are up because of this Ukraine situation,” Miller Tabak’s Matt Maley says on crude oil. “They were already making those moves. Therefore they’re going to stay, we’re not going to see oil fall out of bed.” https://t.co/pDvIJv04DZ"
1496501331456106499,2022-02-23T15:04:55.000Z,19546277,@YahooFinance,Yahoo Finance,News,Retirement planning: Know the 401(k) rules when you leave a job https://t.co/WGo2IWWbTk by @KerryHannon https://t.co/7qq1kdeh3E
1496503329949728774,2022-02-23T15:12:52.000Z,19546277,@YahooFinance,Yahoo Finance,News,".@ines_ferre breaks down movements within commodities such as $WTI crude oil and metals gold and palladium, in addition to looking at stock gains from $PANW $TDOC and $SPEC. Full comments: https://t.co/BJKpzBwiNm"
1496507603244965894,2022-02-23T15:29:51.000Z,19546277,@YahooFinance,Yahoo Finance,News,"“The typical employee at a Toast restaurant is producing 4.5% more orders per hour than in 2020,” @ToastTab CEO @ChrisComparato says on short-staffed restaurants using digital tools, later adding: “[Restaurants] are enabling consumers to do more with their personal device.” https://t.co/dhgufTQb67"
1496510553044496393,2022-02-23T15:41:34.000Z,19546277,@YahooFinance,Yahoo Finance,News,"“Sanctions can really only do so much, but a targeted effort to implement export controls with buy-in from other countries can really curtail the flow of key products into Russia,” BTIG Director of Policy Research Isaac Boltansky says on technology like semiconductors. https://t.co/Zy9IsBkGX0"
1496515053247422472,2022-02-23T15:59:27.000Z,19546277,@YahooFinance,Yahoo Finance,News,"“As challenging the year 2021 was in terms of demand recovery, Marriott opened more rooms globally than in any other year in our history,” @MarriottIntl CEO Anthony Capuano says. “When these projects are under development, they tend to reach their normal conclusion and open.” https://t.co/tzcdn7hpe4"
1496516893615824904,2022-02-23T16:06:46.000Z,19546277,@YahooFinance,Yahoo Finance,News,"“It seems unicorns are less unicorn-y every day, it felt like a lot of last year,” Bloomreach Co-Founder and CEO @rdedatta says on the private tech space. “What we started to see… in October or November is almost a 30% plus correction in high growth SaaS names out there.” https://t.co/Epvt1yhX3p"
1496519017783308293,2022-02-23T16:15:12.000Z,19546277,@YahooFinance,Yahoo Finance,News,"“There’s a lot of companies that may not have so much substance,"" @645ventures Co-founder Nnamdi Okie says on Web3. “When we think about Web3, we think about companies where there’s no middle-man, there’s software that controls the business model and controls the approach."" https://t.co/mv9YbNKDFj"
1496519349103996933,2022-02-23T16:16:31.000Z,19546277,@YahooFinance,Yahoo Finance,News,"“Putin knew these were going to be coming,” CSIS International Security Program Senior Adviser Mark Cancian says about U.S. sanctions on Russia. “He took his move anyway, so it’s unlikely that they will deter him.” Full interview: https://t.co/UAFw7Z3Jbi"
1496522223032713228,2022-02-23T16:27:56.000Z,19546277,@YahooFinance,Yahoo Finance,News,"“I have never… seen the economic fundamentals and the geopolitical fundamentals and the health fundamentals line up globally like this,” Walser Wealth Management President Rebecca Walser says. “I don’t see a silver lining in this cloud.” Full interview: https://t.co/FT8QWlWjSr"
1496523695149490176,2022-02-23T16:33:47.000Z,19546277,@YahooFinance,Yahoo Finance,News,RT @yfinanceplus: $SPCE shares are up 12% after reporting narrower than expected Q4 losses. Virgin Galactic said it is on track to launch c…
1496526119272685568,2022-02-23T16:43:25.000Z,19546277,@YahooFinance,Yahoo Finance,News,"“We have about 30% of our categories today that are in some kind of challenge in terms of supply in which we’re thinking differently and more creatively of a new game plan,” @KraftHeinzCo North America President Carlos Abrams-Rivera says. Full comments: https://t.co/tD6WjvXFeC"
1496526392871329805,2022-02-23T16:44:30.000Z,19546277,@YahooFinance,Yahoo Finance,News,.@KraftHeinzCo North America President Carlos Abrams-Rivera discusses the company's efforts around sustainable packaging and plant-based products: https://t.co/FQVkoNmUwa
1496528481760514054,2022-02-23T16:52:48.000Z,19546277,@YahooFinance,Yahoo Finance,News,"RT @CentivoxMedia: Dr. @TaisonBell spoke on @YahooFinance about states beginning to relax their stance on #covid19
""We just have to be prep…"
1496530540526194696,2022-02-23T17:00:59.000Z,19546277,@YahooFinance,Yahoo Finance,News,We need to think about the COVID-19 vaccines we'll need in 3 to 5 years: Public health expert https://t.co/j534xFnSmT by @AnjKhem https://t.co/XrxyXOnd0s
1496530638949818373,2022-02-23T17:01:23.000Z,19546277,@YahooFinance,Yahoo Finance,News,Three things are driving the latest crypto pullback: expert https://t.co/qKXu5qRw4r by @emily_mcck https://t.co/QSn5oLOH5T
1496535570675376130,2022-02-23T17:20:58.000Z,19546277,@YahooFinance,Yahoo Finance,News,"“When [oil] prices go up across the Atlantic, they go up here as well,” @RaymondJames's Pavel Molchanov says. “Because Russia is one of the top three oil producers, anything that directly affects the oil industry... would show up at the pump” in the U.S. Full interview: https://t.co/cUCiAN7F73"
1496535693744553984,2022-02-23T17:21:28.000Z,19546277,@YahooFinance,Yahoo Finance,News,U.S. officials warn businesses of possible cyberattacks following sanctions on Russia. @danielhowley explains: https://t.co/AKubADAE8X
1496538910637314056,2022-02-23T17:34:15.000Z,19546277,@YahooFinance,Yahoo Finance,News,"Oprah, Rihanna, and Serena Williams are among some of the richest, self-made Black women in the world. https://t.co/8UjsffIiS6"
1496539172349353986,2022-02-23T17:35:17.000Z,19546277,@YahooFinance,Yahoo Finance,News,"$SPCE has been “burning through $50 million a quarter, and they’re now up to $80 million,” @SpaceCapital Managing Partner Chad Anderson says. “They have less than a year of cash runway, so they really have to get their commercial service launched this year.” Full interview: https://t.co/a9QexuZlpe"
1496540899270180870,2022-02-23T17:42:09.000Z,19546277,@YahooFinance,Yahoo Finance,News,"“Million-dollar homes are quickly becoming the norm,” Yahoo Finance Contributor @veragibbons says on the hot housing market. https://t.co/Jb7k9tf4PH https://t.co/1Go0SN4aFI"
1496554525674594311,2022-02-23T18:36:18.000Z,19546277,@YahooFinance,Yahoo Finance,News,"""I think there's a myth out there that Russia's economy is sanctions-proof,"" @CNASdc adjunct fellow @EdwardFishman says. ""Since we initially imposed sanctions in 2014, Putin has done things to try to insulate Russia's economy... but Russia's economy remains very vulnerable."" https://t.co/PvxoIqBdLd"
1496554627415875591,2022-02-23T18:36:42.000Z,19546277,@YahooFinance,Yahoo Finance,News,"""I do think the risk right now in the market is actually to the upside,"" Great Hill Capital's Thomas Hayes says. ""Everyone is positioned for more downside. I think this is just some after tremors... This is a case of 'sell the rumor, buy the news.'"" https://t.co/Jb7k9tf4PH https://t.co/3csDKMc1az"
1496556524067504134,2022-02-23T18:44:14.000Z,19546277,@YahooFinance,Yahoo Finance,News,"""What we've learned is that trade sanctions alone are not effective,"" @WhiteHouseCEA Sr. Trade Economist @ChristineMcDan says. ""We also need to cut off financial ties, and that's what we're seeing the Biden administration do in pretty close coordination with the EU."" https://t.co/0LW4DA76aS"
1496556930529206277,2022-02-23T18:45:51.000Z,19546277,@YahooFinance,Yahoo Finance,News,"Oil is ""precious stuff"" that can largely ""remain in the ground,"" says Charlie Munger. https://t.co/a3UBrcW9Tm"
1496557477713883147,2022-02-23T18:48:02.000Z,19546277,@YahooFinance,Yahoo Finance,News,RT @yfinanceplus: $DKNG shares are up 9% and #trending. Some Wall Street investment firms cut their price targets on the stock after the co…
1496557522198708230,2022-02-23T18:48:12.000Z,19546277,@YahooFinance,Yahoo Finance,News,"Don't rule out a commodities 'super spike', warns Goldman Sachs https://t.co/tBddMntdL4 by @BrianSozzi https://t.co/0P1V8KwYvy"
1496561794239938568,2022-02-23T19:05:11.000Z,19546277,@YahooFinance,Yahoo Finance,News,Starbucks union vote in Buffalo gets delayed as labor battle heats up https://t.co/FTJDsCBPKN by @daniromerotv https://t.co/ZhSn3YMfre
