1504908921756172291,2022-03-18T19:53:41.000Z,19546277,@YahooFinance,Yahoo Finance,News,"""At a time where global demand for energy continues to rise… it just puts more stress on the overall supply,"" @PoccaPort CEO Sean Strawbridge says, later adding: ""We certainly can expect… higher fuel prices in the near term until the Ukrainian crisis is resolved."" https://t.co/kJGtGyZTCm"
1504910972095545355,2022-03-18T20:01:50.000Z,19546277,@YahooFinance,Yahoo Finance,News,GameStop is ‘digging a hole they’ll never climb out of’: Analyst https://t.co/v9ZOW5Iko1 by @thebradsmith https://t.co/TJUEOc99cx
1504915140638040069,2022-03-18T20:18:24.000Z,19546277,@YahooFinance,Yahoo Finance,News,"""The inflation situation is clearly still a serious headwind for markets,"" RiverFront Investment Group Chief Investment Strategist Chris Konstantinos says, later adding that the uncertainty for a recession ""is still out there."" https://t.co/QwfigmN8tD"
1504916288531009537,2022-03-18T20:22:57.000Z,19546277,@YahooFinance,Yahoo Finance,News,"""We're not in a financial crisis,"" Lipow Oil Associates President Andrew Lipow says. ""Housing prices are robust, the stock market is moving up, the consumer for the most part has extra money to spend on gasoline — but they don't like to spend more."" https://t.co/RGBTpfgkY5"
1504917026569134085,2022-03-18T20:25:53.000Z,19546277,@YahooFinance,Yahoo Finance,News,.@generalelectric CEO Larry Culp’s 2022 annual equity incentive grant will be reduced to $5 million from $15 million after shareholders voiced concerns over board practices. https://t.co/p218jnsTLt
1504918916824510465,2022-03-18T20:33:24.000Z,19546277,@YahooFinance,Yahoo Finance,News,Tax season brings bigger tax refunds and 'no unexpected problems' so far https://t.co/rM9v6n2N2f by @WritesRonda with @__gabriellacruz https://t.co/eSat7UXER8
1504921003725578244,2022-03-18T20:41:42.000Z,19546277,@YahooFinance,Yahoo Finance,News,"Market Stats 3/18/2022:
-Dow snaps 5-week losing streak
-S&amp;P 500 Consumer Discretionary sector up 9.1% -- best week since Apr 2020
-S&amp;P 500 Tech sector up 7.6% -- best week since Nov 2020
-KraneShares Chinese Internet ETF (KWEB) up 28.9%-- best week ever"
1504921330042482689,2022-03-18T20:42:59.000Z,19546277,@YahooFinance,Yahoo Finance,News,"$TSLA continues to dominate the U.S. EV market by a large margin, despite price increases due to supply chain disruption and inflation. https://t.co/I3ZExUy7RE"
1504922006579462147,2022-03-18T20:45:41.000Z,19546277,@YahooFinance,Yahoo Finance,News,"Edmunds Executive Director of Insight Jessica Caldwell on why Americans could be switching to electric vehicles sooner rather than later: ""People are quick to really use gas as the singlemost reason why they're purchasing a certain type of vehicle.” https://t.co/jocXhtn8gg"
1504922883323273222,2022-03-18T20:49:10.000Z,19546277,@YahooFinance,Yahoo Finance,News,AppHarvest CEO envisions 'couple-decade journey' after going public https://t.co/dbW7AfUfdm by @BrookeDiPalma https://t.co/n3gwE1dNCA
1504923539660578816,2022-03-18T20:51:46.000Z,19546277,@YahooFinance,Yahoo Finance,News,.@getsilvur CEO Rhian Horgan discusses how to combat high inflation on a fixed income: https://t.co/LKzw2zd5IT
1504923970168098820,2022-03-18T20:53:29.000Z,19546277,@YahooFinance,Yahoo Finance,News,"Work from home, car-pooling can help ease gas 'price pain': IEA https://t.co/K4p32jukGL by @ines_ferre https://t.co/b0P4x6dDkN"
1504929496239157261,2022-03-18T21:15:26.000Z,19546277,@YahooFinance,Yahoo Finance,News,Biden's marathon call with China's Xi leaves questions unanswered on Russia https://t.co/JTXdurFhIv by @benwerschkul https://t.co/KHp7RTV3aw
1505179292061339649,2022-03-19T13:48:02.000Z,19546277,@YahooFinance,Yahoo Finance,News,"Fighting back against Putin's war on the media
https://t.co/yKX2dHD0F7 by @serwer https://t.co/H5bVlSGmbz"
1505231758501072896,2022-03-19T17:16:31.000Z,19546277,@YahooFinance,Yahoo Finance,News,Daylight Savings debate: Winners — and losers — of ending biannual time changes https://t.co/rpDVphPAAP by @adrianambells https://t.co/pHP6u0eQKw
1505232011077767172,2022-03-19T17:17:31.000Z,19546277,@YahooFinance,Yahoo Finance,News,"Gas prices ‘without a doubt’ changing consumer behavior, AAA spokesman explains https://t.co/LDsq2ecywq by @eromanjm https://t.co/b4ForMM3o1"
1505591028472074241,2022-03-20T17:04:08.000Z,19546277,@YahooFinance,Yahoo Finance,News,"Americans 'want to do things' right now, and that's bullish https://t.co/BqjMQEp5y1 by @SamRo via @TKerLLC https://t.co/8oCiSoItaC"
1505825773235716099,2022-03-21T08:36:55.000Z,19546277,@YahooFinance,Yahoo Finance,News,"Nike earnings, consumer sentiment: What to know in markets this week
https://t.co/vujibjdOI3 by @emily_mcck https://t.co/xt6W6Zt5SI"
1505859543624003586,2022-03-21T10:51:07.000Z,19546277,@YahooFinance,Yahoo Finance,News,"The stock market is depressed, and apparently that's great: Morning Brief
https://t.co/Pyca1MZWCi by @BrianSozzi https://t.co/STZTDMhIg0"
1505896007237869571,2022-03-21T13:16:00.000Z,19546277,@YahooFinance,Yahoo Finance,News,"“China’s state media was reporting… that the country’s aviation ministry has decided to halt all flights of that [Boeing] 737-800,” @alexiskweed says on a $BA crash in China that reportedly killed 132 people. Full comments: https://t.co/EBfC0KfHBb"
1505896108622495745,2022-03-21T13:16:25.000Z,19546277,@YahooFinance,Yahoo Finance,News,Russia's Ukraine invasion expected to have 'huge impact' Jersey Shore's economy https://t.co/OjwdNOcmqr by @DanielHowley https://t.co/WVnslEdqQ3
1505896563121471490,2022-03-21T13:18:13.000Z,19546277,@YahooFinance,Yahoo Finance,News,Fighting back against Putin's war on the media https://t.co/0hPViZuS80 by @serwer with @MaxZahn_ https://t.co/1C2IhENBYS
1505897000654540801,2022-03-21T13:19:57.000Z,19546277,@YahooFinance,Yahoo Finance,News,Homebuyers and owners scramble to secure low mortgage rates before more hikes come https://t.co/4z9CCTybjK by @__gabriellacruz https://t.co/EByjng5U6R
1505898737977200641,2022-03-21T13:26:52.000Z,19546277,@YahooFinance,Yahoo Finance,News,"“We might end up in a situation where there’s 6% nominal GDP growth, there’s obvious excesses in the consumer or corporate space,” @rwbaird's @BullandBaird says. “Yet we have inverted yield curves... a tried and tested recession signal, but the consumer's in really good shape.” https://t.co/aqbpM7LCtY"
1505899998814298121,2022-03-21T13:31:52.000Z,19546277,@YahooFinance,Yahoo Finance,News,"Gas prices ‘without a doubt’ changing consumer behavior, AAA spokesman explains https://t.co/3bDLfXOTS4 by @eromanjm https://t.co/29viTlBaGk"
1505900184907223046,2022-03-21T13:32:37.000Z,19546277,@YahooFinance,Yahoo Finance,News,"Green investing 'is going to be enhanced over time,' financial adviser says https://t.co/WS1XzHad3L by @graceodonne11 https://t.co/ligtbnsotz"
1505900202124881923,2022-03-21T13:32:41.000Z,19546277,@YahooFinance,Yahoo Finance,News,"“It’s really a very dangerous and difficult situation, not only in Ukraine and Russia, but globally,” @serwer says on Russian opposition to the media. “Vladimir Putin and Russian forces have been killing journalists in Ukraine, just last week three journalists were killed.” https://t.co/MLIEwTJptf"
1505901416178663426,2022-03-21T13:37:30.000Z,19546277,@YahooFinance,Yahoo Finance,News,Why Hollywood's obsessed with Silicon Valley: 'Everybody loves a rise-and-fall story' https://t.co/jXNLqeT3AR by @alliecanal8193 https://t.co/Ux4hIlkV9m
1505901662992482306,2022-03-21T13:38:29.000Z,19546277,@YahooFinance,Yahoo Finance,News,"$BA shares dip following a Chinese plane crash, $GM increases stake in Cruise Automation, and $NLSN stock falls amid refusal of a $9 billion takeover offer. Full comments: https://t.co/CSYppPVuTZ"
1505904714528997377,2022-03-21T13:50:36.000Z,19546277,@YahooFinance,Yahoo Finance,News,"RT @yfinanceplus: Markets are trending lower, after posting its strongest week since Nov. 2020, but volatility continues due to the conflic…"
1505905900732784642,2022-03-21T13:55:19.000Z,19546277,@YahooFinance,Yahoo Finance,News,Colorado's governor wants to be a haven for crypto as a 'basic convenience thing' https://t.co/RtQvq07SFI by @benwerschkul https://t.co/HnhWx81vgk
1505906304459710470,2022-03-21T13:56:56.000Z,19546277,@YahooFinance,Yahoo Finance,News,Instagram finally has parental controls. Here’s how to use them https://t.co/8aUhEG4coy by @DanielHowley https://t.co/cePdwYm9iX
1505906491743690752,2022-03-21T13:57:40.000Z,19546277,@YahooFinance,Yahoo Finance,News,Airlines are passing on fuel price hikes to travelers as demand rebounds https://t.co/vfoTL78csw by @daniromerotv https://t.co/5s12fgECWv
1505907029059285001,2022-03-21T13:59:48.000Z,19546277,@YahooFinance,Yahoo Finance,News,"Climate tech opportunities ‘are increasing radically,’ venture capitalist says https://t.co/DcpfY3KoSJ by @graceodonne11 https://t.co/2B6zbAWHB7"
1505907822202171398,2022-03-21T14:02:57.000Z,19546277,@YahooFinance,Yahoo Finance,News,Eating at a restaurant roars back from the COVID-19 pandemic: survey https://t.co/udbArqcpbz by @BrianSozzi https://t.co/3cHyjSjFux
1505908465444827147,2022-03-21T14:05:31.000Z,19546277,@YahooFinance,Yahoo Finance,News,"“The wonderful thing is people during COVID have spent more time with fewer people,” @SignetJewelers CEO @GinaDrosos says. “We’ve seen many people are giving nicer gifts to those close to them, and jewelry is a fantastic gift to take on a trip or present while you’re on a trip.” https://t.co/wr1N4uNeLg"
1505908840881131532,2022-03-21T14:07:00.000Z,19546277,@YahooFinance,Yahoo Finance,News,China EV maker Nio says has no plans to raise prices in short term https://t.co/5J8IIaykYG https://t.co/4EdKTHRn5q
1505912193581211652,2022-03-21T14:20:20.000Z,19546277,@YahooFinance,Yahoo Finance,News,"“We were up 15% last year, so we navigated the chip crises pretty good. If I look at our battery supply with what we have coming from SK Innovation in Georgia, relatively stable,” @VW Group of North America CEO Scott Keogh says. “I think we’ve covered our bets.” https://t.co/67hye1szSd"
1505913337594490892,2022-03-21T14:24:52.000Z,19546277,@YahooFinance,Yahoo Finance,News,".@SPYJared looks at the market action after the opening bell, volatility levels, sector actions, and price movements in $WTI crude oil and other Russian-tied commodities. https://t.co/srkdJjCRQf"
1505914657613225994,2022-03-21T14:30:07.000Z,19546277,@YahooFinance,Yahoo Finance,News,"Dollar pauses, yen near six-year lows as Ukraine crisis weighs https://t.co/n5lplpGxK2 https://t.co/goUR8kF5Aq"
1505914797430349832,2022-03-21T14:30:40.000Z,19546277,@YahooFinance,Yahoo Finance,News,How Instagram is trying to get you to use NFTs https://t.co/wOsjOLQc2T via @YahooFinanceUK https://t.co/M8NWEp63nF
1505915234720092171,2022-03-21T14:32:25.000Z,19546277,@YahooFinance,Yahoo Finance,News,"Chinese Boeing jet crashes in mountains with 132 on board, no sign of survivors https://t.co/2yV57SOCSM https://t.co/d38mNuAOIh"
1505915445794295808,2022-03-21T14:33:15.000Z,19546277,@YahooFinance,Yahoo Finance,News,FTSE opens higher as oil prices heat up again https://t.co/2xwnkaUDY1 via @YahooFinanceUK https://t.co/0tP0hjtWbS
1505917014539481092,2022-03-21T14:39:29.000Z,19546277,@YahooFinance,Yahoo Finance,News,"“The travel industry is anticipating airline activity will be higher, because there’s a lot pent-up demand from the pandemic,” @KPMG Global Head of Energy @Regina_Mayor says, adding: ""Unfortunately, I think in the near-term consumers will be seeing very high prices at the pump.” https://t.co/2JTXaoySBC"
1505919325584211972,2022-03-21T14:48:40.000Z,19546277,@YahooFinance,Yahoo Finance,News,"“95% of the consumers that buy Nike running shoes do not use them to run, they use them for more aesthetic, casual... everyday purposes,” BTIG Managing Director Camilo Lyon says. “When we’re talking about On… [or] Hoka, we’re talking about more technical running footwear.” https://t.co/fYWBofvbhr"
1505921265504333829,2022-03-21T14:56:23.000Z,19546277,@YahooFinance,Yahoo Finance,News,"U.S., British officials kick off fresh dialogue on 'smarter' trade ties https://t.co/7pVX2Z1nGf https://t.co/agmGEKzb3E"
1505921584976084994,2022-03-21T14:57:39.000Z,19546277,@YahooFinance,Yahoo Finance,News,Buffett deepens insurance exposure with $11.6 billion Alleghany deal https://t.co/Rc2toqHOF2 https://t.co/SPrvUGto9u
1505921626558414853,2022-03-21T14:57:49.000Z,19546277,@YahooFinance,Yahoo Finance,News,"“Brace yourself for some sticker shock when buying those airfare tickets. Experts are warning you should buy your tickets now because those prices will continue to go up,” @daniromerotv says on rising flights costs. https://t.co/fUYJw4dGeW"
1505922826792022021,2022-03-21T15:02:35.000Z,19546277,@YahooFinance,Yahoo Finance,News,Kohl's says board reviewing multiple buyout offers https://t.co/XaSxbNWhT4 https://t.co/VLU3PeAv3G
1505923510992097284,2022-03-21T15:05:18.000Z,19546277,@YahooFinance,Yahoo Finance,News,"Fed's Bostic sees 6 rate hikes this year, war risks https://t.co/sSICPcsfbw https://t.co/Bx4v1kmjVX"
1505924180277182469,2022-03-21T15:07:57.000Z,19546277,@YahooFinance,Yahoo Finance,News,"“Companies like DraftKings employ over 3,000 people… completely separate from the hundreds of millions... they’re spending on marketing to acquire customers,” Macquarie Group's Chad Beynon says. “From a promotion standpoint, giving people free bets… is net of your net revenue.” https://t.co/uSOhji3xOD"
1505925748082757644,2022-03-21T15:14:11.000Z,19546277,@YahooFinance,Yahoo Finance,News,"Russia labels Meta an 'extremist organisation', says WhatsApp can stay https://t.co/jpUcGv6YYO https://t.co/GYW6CEerUL"
1505927710924853251,2022-03-21T15:21:59.000Z,19546277,@YahooFinance,Yahoo Finance,News,Goldman Sachs to Offer Over-the-Counter Crypto Options Trading https://t.co/p1lZAVCzrw via @business https://t.co/OTJmB6CLdW
1505927855158579200,2022-03-21T15:22:34.000Z,19546277,@YahooFinance,Yahoo Finance,News,Josh Peck describes new memoir as 'most millennial thing I could ever do' https://t.co/z6MSM1hamM by @alliecanal8193 https://t.co/J5KN6MYVbF
1505928119420608513,2022-03-21T15:23:37.000Z,19546277,@YahooFinance,Yahoo Finance,News,Who will be the first trillionaire? Study predicts Elon Musk in 2024 https://t.co/dVYpAabBiQ by @IFanusie https://t.co/93zq6cx9y4
1505928500884254730,2022-03-21T15:25:08.000Z,19546277,@YahooFinance,Yahoo Finance,News,"“Valuations have broadly reset. That doesn’t mean we should aggressively buy the dip… [but] there are still opportunities,” @JPMorganAM’s Meera Pandit says about stocks. “We anticipate 10% earnings growth on the S&amp;P 500 this year.” https://t.co/4TzhyHfHEW"
1505929631865712640,2022-03-21T15:29:37.000Z,19546277,@YahooFinance,Yahoo Finance,News,These are the most and least federally-dependent U.S. states https://t.co/wCWuzxxkhw by @LukeCarMog42 https://t.co/wC2tTFwv7t
1505931696771903491,2022-03-21T15:37:50.000Z,19546277,@YahooFinance,Yahoo Finance,News,CEO optimism dips amid ‘unprecedented times’ https://t.co/2rb2YX6jsv by @benwerschkul https://t.co/yoslI7V6O2
1505936539888541701,2022-03-21T15:57:04.000Z,19546277,@YahooFinance,Yahoo Finance,News,Here's the secret message from Warren Buffett's newest big deals https://t.co/vY6sLX4R4r by @BrianSozzi https://t.co/5tDR3qcMs0
1505938349483245572,2022-03-21T16:04:16.000Z,19546277,@YahooFinance,Yahoo Finance,News,"‘Workplaces have never been built for women’: @GirlsWhoCode founder @reshmasaujani on challenges faced by women in business

#whm https://t.co/7wENyXHpkj"
1505938397453451264,2022-03-21T16:04:27.000Z,19546277,@YahooFinance,Yahoo Finance,News,"One user found a way to claim another a million dollars of ApeCoin tokens from another. “It’s a sad situation, but operator error in my opinion,” The Drop Founder @gannonbreslin explains. https://t.co/uY5ZFUyjHv"
1505938442357673991,2022-03-21T16:04:38.000Z,19546277,@YahooFinance,Yahoo Finance,News,"Instagram is will soon incorporate NFTs. “There’s basically an arms race for NFT marketplaces,” The Drop Founder @gannonbreslin says. “I think they should go a step further. https://t.co/k7SnJJap9e"
1505940087439343621,2022-03-21T16:11:10.000Z,19546277,@YahooFinance,Yahoo Finance,News,U.S. SEC unveils landmark climate change risk disclosure rule https://t.co/w4R4SF74kn https://t.co/G29pkoSGBd
1505940175595180036,2022-03-21T16:11:31.000Z,19546277,@YahooFinance,Yahoo Finance,News,"RT @yfinanceplus: Berkshire Hathaway inked a deal with insurer $Y, sending its shares up more than 24%. The deal is valued at $11.6 billion…"
1505940609235775488,2022-03-21T16:13:14.000Z,19546277,@YahooFinance,Yahoo Finance,News,Yahoo Sports’ @petee39 on March Madness: https://t.co/KIEmXyigOZ
1505946903791427588,2022-03-21T16:38:15.000Z,19546277,@YahooFinance,Yahoo Finance,News,"Powell: Fed will 'adjust policy as needed' to lower inflation, avoid recession https://t.co/U2KE4dyrPQ by @bcheungz https://t.co/FoPsGwrPtM"
1505959683395403783,2022-03-21T17:29:02.000Z,19546277,@YahooFinance,Yahoo Finance,News,"Nike earnings preview: Ukraine war, supply chain issues make for tough beat https://t.co/cRDLpSJVU2 by @thomashumTV"
1505965259533828102,2022-03-21T17:51:12.000Z,19546277,@YahooFinance,Yahoo Finance,News,"Warren Buffett’s Berkshire Hathaway agrees to buy insurance company Alleghany for $11.6 billion, marking the first large-scale acquisition for Buffett in more than 5 years. 

$Y $BRKA $BRKB https://t.co/tWlQz0MqU7"
1505967946392342532,2022-03-21T18:01:52.000Z,19546277,@YahooFinance,Yahoo Finance,News,RT @yfinanceplus: $NKE is down about 1.5% ahead of releasing its Q3 earnings. Analysts are expecting revenue of $10.6 billion and adjusted…
1505968149094612992,2022-03-21T18:02:40.000Z,19546277,@YahooFinance,Yahoo Finance,News,"Sell stocks, warns one of Wall Street's biggest bears after fresh rally https://t.co/V27TYh6WEn by @BrianSozzi"
1505977651923668995,2022-03-21T18:40:26.000Z,19546277,@YahooFinance,Yahoo Finance,News,"Cadillac LYRIQ production kicks off in Spring Hill, Tenn. https://t.co/MfoCZze6nx by @Pras_S"
1505986949114478594,2022-03-21T19:17:23.000Z,19546277,@YahooFinance,Yahoo Finance,News,"The CPI print is ""not going to look kind,"" Allianz Investment Management's Johan Grahn says on inflation. ""That will be the indicator that the Fed is going to hang their hat on."" https://t.co/Jb7k9tf4PH https://t.co/T4dgz5Q7zd"
1505990286081732629,2022-03-21T19:30:38.000Z,19546277,@YahooFinance,Yahoo Finance,News,"KPMG U.S. Impact &amp; ESG Leader Rob Fisher on the SEC's new climate disclosure rules for companies: ""Investors will drive where this goes."" https://t.co/RSX6KTH5jh"
1505995023753654282,2022-03-21T19:49:28.000Z,19546277,@YahooFinance,Yahoo Finance,News,"“The bigger concern [for wheat farmers] right now is staying in business with the input costs,” @wheatworld President Nicole Berg says. “We are enjoying the higher prices in wheat, but the wheat prices aren’t quite high enough to cover our bottom line.” https://t.co/D50tdPWHxq"
1505998657518194693,2022-03-21T20:03:54.000Z,19546277,@YahooFinance,Yahoo Finance,News,.@Bankrate Senior Industry Analyst @tedrossman discusses changes to how credit agencies are reporting medical debt: https://t.co/p9YTjTlboc
1506000162497384457,2022-03-21T20:09:53.000Z,19546277,@YahooFinance,Yahoo Finance,News,RT @yfinanceplus: $DIS shares fell more than 1% after reports the company said due to a #COVID outbreak in China it would close Shanghai Di…
1506000463837245447,2022-03-21T20:11:05.000Z,19546277,@YahooFinance,Yahoo Finance,News,"Stocks end lower after hawkish Fed remarks: Dow drops 202 points, or 0.6% https://t.co/3FW4W2pvL0 by @emily_mcck"
1506000699552931850,2022-03-21T20:12:01.000Z,19546277,@YahooFinance,Yahoo Finance,News,Port of Corpus Christi CEO: ‘Expect to see higher fuel prices’ amid Russia oil ban https://t.co/MDYdXnxxh2 by @daniromerotv
1506003311006208000,2022-03-21T20:22:24.000Z,19546277,@YahooFinance,Yahoo Finance,News,"Nike 3Q 2022 earnings beat estimates despite Ukraine war, supply chain issues https://t.co/4dBiHD796K by @thomashumTV"
1506004598426845192,2022-03-21T20:27:31.000Z,19546277,@YahooFinance,Yahoo Finance,News,"The Fed is ""going to tighten until something breaks,"" @BlankeScheinWM CIO Robert Schein says. “That’s either breaking the back of inflation or growth is going to slow.” https://t.co/GSnY1NSZXJ"
1506004778928820229,2022-03-21T20:28:14.000Z,19546277,@YahooFinance,Yahoo Finance,News,".@Cowen_Inc's Cai von Rumohr on the Boeing 737 crash in China: ""This has been a very well proven plane, so I would say the much, much more likely situation is this is either pilot error, maintenance error, or sabotage."" https://t.co/ZgKkoCfTnd"
1506009513274806274,2022-03-21T20:47:02.000Z,19546277,@YahooFinance,Yahoo Finance,News,Nike has a key advantage over upstart running shoe brands: Analyst https://t.co/bPAXDyG7AM by @daniromerotv https://t.co/W5Gb4S7RCn
1506011587215343618,2022-03-21T20:55:17.000Z,19546277,@YahooFinance,Yahoo Finance,News,"Nike is moving away from some of their retail partnerships ""because they want people who are really going to reinforce their brand from a presentation perspective as well as from an engagement perspective,"" Williams Trading Senior Equity Analyst Sam Poser says. Full interview: https://t.co/6GcXScyvlO"
1506019870034509838,2022-03-21T21:28:12.000Z,19546277,@YahooFinance,Yahoo Finance,News,Nike has a key advantage over upstart running shoe brands: Analyst https://t.co/Ubg6R4Vu0v by @daniromerotv
1506021648318832641,2022-03-21T21:35:16.000Z,19546277,@YahooFinance,Yahoo Finance,News,Hedge funds focused on Russia plunge amid invasion of Ukraine https://t.co/VbxHY8bBlT by @alexandraandnyc
1506075334231441418,2022-03-22T01:08:35.000Z,19546277,@YahooFinance,Yahoo Finance,News,Here's the secret message from Warren Buffett's newest big deals https://t.co/K8JOXuDVHz by @BrianSozzi https://t.co/6I0HedRJa3
1506081250154622979,2022-03-22T01:32:06.000Z,19546277,@YahooFinance,Yahoo Finance,News,"Sell stocks, warns one of Wall Street's biggest bears after fresh rally https://t.co/WAOTjouHuT by @BrianSozzi"
1506091685696184324,2022-03-22T02:13:34.000Z,19546277,@YahooFinance,Yahoo Finance,News,Who will be the first trillionaire? Study predicts Elon Musk in 2024 https://t.co/oCF3ii3TeY by @IFanusie https://t.co/OdLw5x0j99
1506096779028316162,2022-03-22T02:33:48.000Z,19546277,@YahooFinance,Yahoo Finance,News,Josh Peck describes new memoir as 'most millennial thing I could ever do' https://t.co/dQQ9KjYZy9 by @alliecanal8193 https://t.co/VHb0WEp5dd
1506102828678492163,2022-03-22T02:57:51.000Z,19546277,@YahooFinance,Yahoo Finance,News,These are the most and least federally-dependent U.S. states https://t.co/w9umSrDJmM by @LukeCarMog42 https://t.co/uRFLVuvw38
1506111433267896323,2022-03-22T03:32:02.000Z,19546277,@YahooFinance,Yahoo Finance,News,"Nike 3Q 2022 earnings beat estimates despite Ukraine war, supply chain issues https://t.co/WlZgOJnubj by @thomashumTV"
1506117970736697344,2022-03-22T03:58:01.000Z,19546277,@YahooFinance,Yahoo Finance,News,"Powell: Fed will 'adjust policy as needed' to lower inflation, avoid recession https://t.co/MHqKNNjT8k by @bcheungz https://t.co/Gr5FAOXSmg"
1506123210626150400,2022-03-22T04:18:50.000Z,19546277,@YahooFinance,Yahoo Finance,News,"Cadillac LYRIQ production kicks off in Spring Hill, Tenn. https://t.co/VpkSFJv6R4 by @Pras_S"
1506136568762875904,2022-03-22T05:11:55.000Z,19546277,@YahooFinance,Yahoo Finance,News,CEO optimism dips amid ‘unprecedented times’ https://t.co/WoKgJ9JvTF by @benwerschkul https://t.co/Aw7fatHKh8
1506141991758872579,2022-03-22T05:33:28.000Z,19546277,@YahooFinance,Yahoo Finance,News,Nike has a key advantage over upstart running shoe brands: Analyst https://t.co/JwVMtr0gu7 by @daniromerotv
1506147996240683012,2022-03-22T05:57:19.000Z,19546277,@YahooFinance,Yahoo Finance,News,Port of Corpus Christi CEO: ‘Expect to see higher fuel prices’ amid Russia oil ban https://t.co/ruCeS78bUv by @daniromerotv
1506153337460305921,2022-03-22T06:18:33.000Z,19546277,@YahooFinance,Yahoo Finance,News,Hedge funds focused on Russia plunge amid invasion of Ukraine https://t.co/Q9KC1d8Ek4 by @alexandraandnyc
1506220719209857024,2022-03-22T10:46:18.000Z,19546277,@YahooFinance,Yahoo Finance,News,"For stocks, 'good news' is a relative term: Morning Brief
https://t.co/0LjZU7TMPB by @emily_mcck https://t.co/EF5bFYlqQy"
1506260108925452298,2022-03-22T13:22:49.000Z,19546277,@YahooFinance,Yahoo Finance,News,"“The optimistic view on cyberattacks is it’s difficult to cause lasting damage,” @SilveradoPolicy's @DAlperovitch says on Russia. “So even though you can infiltrate some of these networks... they’re likely to... get them to operational status within hours, days at the outset.” https://t.co/i81lpAUigy"
1506261540118405132,2022-03-22T13:28:30.000Z,19546277,@YahooFinance,Yahoo Finance,News,"“From building in Europe… it’s too expensive to build cars elsewhere and homogenize them in local markets,” @Pras_S says on $TSLA’s Berlin gigafactory opening. “It’s going to be a huge cost given Tesla is a first-mover now in Europe… VW’s big EV plant won’t open until 2026.” https://t.co/crVbPPEjX9"
1506263391807197189,2022-03-22T13:35:52.000Z,19546277,@YahooFinance,Yahoo Finance,News,Novartis suspends some business activities in Russia https://t.co/EhnszjfQnC https://t.co/1ARSrjkiiD
1506264141849321472,2022-03-22T13:38:51.000Z,19546277,@YahooFinance,Yahoo Finance,News,"Disney CEO forms task force, promises listening tour in response to LGBTQ+ concerns https://t.co/h3G5vVKK4h https://t.co/Rvu05rtGWJ"
